identifier,title,description,source,startDate,endDate,locality,Submission Deadline,Notification Due,Final Version Due,Categories,Call For Papers,Related Resources
b'http://www.wikicfp.com/cfp/servlet/event.showcfp?eventid=163802',b'STI 4.O 2022',b'4th INTERNATIONAL CONFERENCE ON SUSTAINABLE TECHNOLOGIES FOR INDUSTRY',b'https://fse.green.edu.bd/sti-2022/',b'2022-12-17T00:00:00',b'2022-12-18T23:59:59',b'Permanent Campus at Purbachal American C',"b'Aug 31, 2022'",,"b'Aug 31, 2022'",b'intelligent computing' b'SENSORS AND COMMUNICATIONS' b'robotics' ,"b'\nABOUT THE EVENT\rWHY STI?\r\xe2\x97\x8f First conference in southeast Asia on Sustainable Technologies for Industry 4.0\r\xe2\x97\x8f Only conference in Bangladesh, which is technically sponsored by the central IEEE Computer Society\r\xe2\x97\x8f All the papers of our previous editions are included in the IEEE xplore digital library within short period of times\r\xe2\x97\x8f From the very first edition, all the accepted papers are included in the Scopus and other renowned databases\r\xe2\x97\x8f With each subsequent edition, involvement of international participants is increasing, e.g., 2019: 20 countries, 2020: 22 countries, and 2021: 35 countries\r\xe2\x97\x8f In our last edition (STI 2021), SEVEN (7) IEEE fellows have joined us as keynote speakers, and it is a common practice\r CALL for Paper\rSTI conference provides a platform for facilitating and promoting innovative research on Industry 4.0 (or Industrial Revolution 4.0) by encompassing research areas related to smart industries, smart grids, intelligent transportation, real-time healthcare, and others that are bolstered by automation and cyber-physical systems. In addition, detailed studies and research are required to design and develop sustainable solutions for Industry 4.0 since they depend on the complex relations among humans, systems and objects, which is also covered in this conference.\rSTI 2022 welcomes researchers, industry professionals, and practitioners to display their scientific achievements and sustainable solutions for industrial developments in the fields of computer science & engineering, electrical & electronic engineering, textile engineering, robotics and cyber-physical systems related to Industry 4.0. It will be hosted at the permanent campus of Green University of Bangladesh, Purbachal American City, Dhaka, Bangladesh during 17-18 December 2022.\rWe are seeking original high-quality innovative research for submissions. All submissions to STI 2022 will go through a double-blind peer reviewing process. ACcepted and presented papers will be submitted to the IEEE Xplore digital library. Papers presenting original research are being sought within following tracks, but not limited to:\n\t'","b'<div align=""left"" class=""cfp"">\n<table align=""center"" cellpadding=""0"" cellspacing=""0px"" width=""100%"">\n<tr valign=""top"">\n<td>\n<table align=""center"" cellpadding=""4"" cellspacing=""3"" width=""100%"">\n<tr><td>\n<a href=""/cfp/servlet/event.showcfp?eventid=161152"">ICEMAT--Ei, Scopus 2023</a>\xc2\xa0\xc2\xa0\n2023 5th International Conference on Energy Management and Applications Technologies (ICEMAT 2023)--EI Compendex, Scopus\n</td></tr>\n<tr><td>\n<a href=""/cfp/servlet/event.showcfp?eventid=121887"">IOP, EI, Scopus-PRECE 2022</a>\xc2\xa0\xc2\xa0\n2022 International Conference on Power, Renewable Energy and Control Engineering (PRECE 2022)-EI Compendex\n</td></tr>\n<tr><td>\n<a href=""/cfp/servlet/event.showcfp?eventid=130871"">STI 2022</a>\xc2\xa0\xc2\xa0\n4th INTERNATIONAL CONFERENCE ON SUSTAINABLE TECHNOLOGIES FOR INDUSTRY 4.0\n</td></tr>\n<tr><td>\n<a href=""/cfp/servlet/event.showcfp?eventid=150707"">CSML 2023</a>\xc2\xa0\xc2\xa0\nInternational Conference on Computer Science and Machine Learning \n</td></tr>\n<tr><td>\n<a href=""/cfp/servlet/event.showcfp?eventid=162980"">3rd Food Chemistry Conference 2023</a>\xc2\xa0\xc2\xa0\n3rd Food Chemistry Conference: Shaping a healthy and sustainable food chain through knowledge\n</td></tr>\n<tr><td>\n<a href=""/cfp/servlet/event.showcfp?eventid=166974"">AAMAS  2023</a>\xc2\xa0\xc2\xa0\nThe 22nd International Conference on Autonomous Agents and Multiagent Systems\n</td></tr>\n<tr><td>\n<a href=""/cfp/servlet/event.showcfp?eventid=163568"">CETA 2023</a>\xc2\xa0\xc2\xa0\n2023 2nd International Conference on Computer Engineering, Technologies and Applications (CETA 2023)\n</td></tr>\n<tr><td>\n<a href=""/cfp/servlet/event.showcfp?eventid=147549"">WiMNET 2022</a>\xc2\xa0\xc2\xa0\n9th International Conference on Wireless and Mobile Network\n</td></tr>\n<tr><td>\n<a href=""/cfp/servlet/event.showcfp?eventid=161159"">ICMLT--Ei, Scopus 2023</a>\xc2\xa0\xc2\xa0\n2023 8th International Conference on Machine Learning Technologies (ICMLT 2023)--EI Compendex, Scopus\n</td></tr>\n<tr><td>\n<a href=""/cfp/servlet/event.showcfp?eventid=161160"">ICMLT 2023</a>\xc2\xa0\xc2\xa0\n2023 8th International Conference on Machine Learning Technologies (ICMLT 2023)\n</td></tr>\n</table>\n</td>\n</tr>\n</table>\n</div>'"
b'http://www.wikicfp.com/cfp/servlet/event.showcfp?eventid=163803',b'DMCIT 2023',"b'2023 7th International Conference on Data Mining, Communications and Information Technology (DMCIT 2023)'",b'http://www.dmcit.net',b'2023-04-28T00:00:00',b'2023-04-30T23:59:59',"b'Chongqing, China'","b'Oct 30, 2022'",,,b'communication' b'data mining' b'information technology' b'data' ,"b'\nCall For Papers\r2023 7th International Conference on Data Mining, Communications and Information Technology (DMCIT 2023)\rChongqing, China | Apr. 28-30, 2023\rWeb: https://www.dmcit.net/\r  2023 7th International Conference on Data Mining, Communications and Information Technology (DMCIT 2023) is organzied by Asia Pacific Institute of Science and Engineering(APISE),sponsored by Jiangnan University, and will be held in Chongqing, China during Apr. 28-30, 2023!\r  \xe2\x97\x8fPublication & Indexing\r1) All the registered and presented papers will be included in the volume of DMCIT 2023 conference proceeding. After publishing, the publisher will submit articles to Engineering Village, Scopus, Web of Science and other databases for review and indexing.\r2) Conference proceedding will be online published.\rSelected papers with great extension will be recommended to publish in international journals.\r DMCIT 2022/2021/2020/2019/2018/2017 conference proceeding has been indexed by EI compendex and Scopus!\r \xe2\x97\x8fSpeakers\rProf. Shahram Latifi, University of Nevada, Las Vegas, USA\rShahram Latifi, an IEEE Fellow, received the Master of Science and the PhD degrees both in Electrical and Computer Engineering from Louisiana State University, Baton Rouge, in 1986 and 1989, respectively. He is currently a Professor of Electrical Engineering at the University of Nevada, Las Vegas. Dr. Latifi is the co-director of the Center for Information Technology and Algorithms (CITA) at UNLV. He has designed and taught undergraduate and graduate courses in the broad spectrum of Computer Science and Engineering in the past four decades. He has given keynotes and seminars on machine learning/AI and IT-related topics all over the world.\r \xe2\x97\x8fThe topics of conference are included below, but not limited to :\r1,Core Data Mining Topics\r Data Pre-Processing\rData Transformation and Dimensionality Reduction\rFeature Extraction and Feature Selection\rData Mining Algorithms\rData Analytics Foundations\rReal-time Mining, Data Stream Mining, and Dynamic Data Mining\rVisual Mining and Data Visualization\rStatistical Learning Theory and Neural Network Research\rGraph Mining and Semi-Structured Data\rSpatial and Temporal Data Mining\rUncertainty Modeling in Data Mining\rWeb Mining\r 2,Data Mining For Intelligent IT Application Topics:\r Convergence of Data Mining and Intelligent IT Applications\rHow Data Mining Techniques have been used in IT Applications\rNovel Applications of Intelligent IT Techniques for Complex Systems\rRobustness and Scalability Issues of Intelligent IT Techniques\rAgent-based Data Analysis and Knowledge Discovery\rIntelligent Multi-gent Systems\rIntrusion Detection and Access Control Techniques\rData-mining Applications for Terrorist Network Tracing\rCrime Modeling, Fraud and Misuse Detection\rCredit Scoring, Financial Modeling and Forecasting\rCRM, e-Marketing and e-Commerce Recommender\rWeb Intelligence\rPrediction Systems\rKnowledge Management\rDecision Analysis and Decision Support Systems\rIndustrial Applications of Business Analytics and Optimization\rPerformance Evaluation in Intelligent IT Applications\rEmerging Intelligent IT Applications and Lessons Learned\r 3,Communication Engineering Related Topics:\r Communication Networks\rWireless Communications\rMobile Communications\rInfrastructure for Next Generation Networks\rInformation & Communication\rCoding Theory\rOptical Communications\rInternet Technologies\rCommunication Software\rSensor Networks\rNew Communication Technologies\rVisual Arts & Visual Communication Design\rMarketing Communication\rGreen Communication\rCommunication Systems\rTelecommunication Technologies\rData Communications\rInformation Technology Application\rSatellite Communication\rNetwork Security\rDSP Algorithms & Architectures\rothers\r 4,Information Technology Applications Related Topics:\r Machine Learning for Multimedia\rHuman Computer Interaction\rBiometric Identification Technology\rRobot Vision Applications\rVirtual Reality and Augmented Reality\rE-Commerce, E-Business and E-Learning\rWeb Information Systems\rWeb Content Generation and Management\rTelecommunication and Wireless Communications\rDatabase Technology\rData Modeling and Engineering\rMultimedia Technology\rHealthcare Applications and Medical Diagnosis\rSecurity and Forensic Applications\rIT Software Development and Methodology\rIT Applications for Agriculture Management\rOther Industrial Applications\rThe Latest Advances in IT\r \xe2\x97\x8fPaper Submission\rElectronic submission system: https://cmt3.research.microsoft.com/DMCIT2023\rE-mail: dmcit@vip.163.com\r \xe2\x97\x8fCall for participants\r1,Presenter: If you are interested in giving presentation on conference,without publishing your paper in the proceeding,you need to submit the abstract and title of your presentation to us: dmcit@vip.163.com\r 2,Listener: You are welcome to attend this great event. You need to complete the registration as Listener before the registration dealdine.\r 3,Reviewer: We sincerely welcome professors, associate professors, teachers and other experts in the areas of Data Mining, Communications and Information Technology join the conference as a reviewer.\r \xe2\x97\x8fContact Us\rMs. Yury Yu\rEmail: dmcit@vip.163.com\rTel:+852-30506939( Hong Kong)\rWeb: https://www.dmcit.net/\r\n'","b'<div align=""left"" class=""cfp"">\n<table align=""center"" cellpadding=""0"" cellspacing=""0px"" width=""100%"">\n<tr valign=""top"">\n<td>\n<table align=""center"" cellpadding=""4"" cellspacing=""3"" width=""100%"">\n<tr><td>\n<a href=""/cfp/servlet/event.showcfp?eventid=137130"">MLDM 2023</a>\xc2\xa0\xc2\xa0\n18th International Conference on Machine Learning and Data Mining\n</td></tr>\n<tr><td>\n<a href=""/cfp/servlet/event.showcfp?eventid=166806"">ACBT--EI 2023</a>\xc2\xa0\xc2\xa0\n2023 Asia Conference on Blockchain Technologies (ACBT 2023)\n</td></tr>\n<tr><td>\n<a href=""/cfp/servlet/event.showcfp?eventid=151078"">IEEE-ADMIT 2022</a>\xc2\xa0\xc2\xa0\n2022 International Conference on Algorithms, Data Mining, and Information Technology (ADMIT 2022)\n</td></tr>\n<tr><td>\n<a href=""/cfp/servlet/event.showcfp?eventid=166808"">ITIOT 2023</a>\xc2\xa0\xc2\xa0\n2023 8th International Conference on Information Technology and Internet of Things (ITIOT 2023)\n</td></tr>\n<tr><td>\n<a href=""/cfp/servlet/event.showcfp?eventid=154303"">CSTY 2022</a>\xc2\xa0\xc2\xa0\n8th International Conference on Computer Science and Information Technology\n</td></tr>\n<tr><td>\n<a href=""/cfp/servlet/event.showcfp?eventid=165451"">ICTC--Ei 2023</a>\xc2\xa0\xc2\xa0\n2023 4th Information Communication Technologies Conference (ICTC 2023)\n</td></tr>\n<tr><td>\n<a href=""/cfp/servlet/event.showcfp?eventid=144738"">CSEA 2022</a>\xc2\xa0\xc2\xa0\n8th International Conference on Computer Science, Engineering and Applications\n</td></tr>\n<tr><td>\n<a href=""/cfp/servlet/event.showcfp?eventid=163804"">China, DMCIT 2023</a>\xc2\xa0\xc2\xa0\n2023 7th International Conference on Data Mining, Communications and Information Technology (DMCIT 2023)\n</td></tr>\n<tr><td>\n<a href=""/cfp/servlet/event.showcfp?eventid=166827"">SDM 2023</a>\xc2\xa0\xc2\xa0\nSDM 2023 : SIAM International Conference on Data Mining\n</td></tr>\n<tr><td>\n<a href=""/cfp/servlet/event.showcfp?eventid=146828"">NLPTA 2022</a>\xc2\xa0\xc2\xa0\n3rd International Conference on NLP Techniques and Applications\n</td></tr>\n</table>\n</td>\n</tr>\n</table>\n</div>'"
b'http://www.wikicfp.com/cfp/servlet/event.showcfp?eventid=163804',"b'China, DMCIT 2023'","b'2023 7th International Conference on Data Mining, Communications and Information Technology (DMCIT 2023)'",b'http://www.dmcit.net',b'2023-04-28T00:00:00',b'2023-04-30T23:59:59',"b'Chongqing, China'","b'Oct 30, 2022'",,,b'data mining' b'data science' b'communications' b'big data' ,"b'\nCall For Papers\r2023 7th International Conference on Data Mining, Communications and Information Technology (DMCIT 2023)\rChongqing, China | Apr. 28-30, 2023\rWeb: https://www.dmcit.net/\r  2023 7th International Conference on Data Mining, Communications and Information Technology (DMCIT 2023) is organzied by Asia Pacific Institute of Science and Engineering(APISE),sponsored by Jiangnan University, and will be held in Chongqing, China during Apr. 28-30, 2023!\r   \xe2\x97\x8fPublication & Indexing\r1) All the registered and presented papers will be included in the volume of DMCIT 2023 conference proceeding, which will be submitted to Engineering Village, Scopus, Thomson Reuters (WoS) and other databases for review and indexing.\r2) Conference proceedding will be online published.\rSelected papers with great extension will be recommended to publish in international journals.\r DMCIT 2022/2021/2020/2019/2018/2017 conference proceeding has been indexed by EI compendex and Scopus!\r \xe2\x97\x8fThe topics of conference are included below, but not limited to :\r1,Core Data Mining Topics\r Data Pre-Processing\rData Transformation and Dimensionality Reduction\rFeature Extraction and Feature Selection\rData Mining Algorithms\rData Analytics Foundations\rReal-time Mining, Data Stream Mining, and Dynamic Data Mining\rVisual Mining and Data Visualization\rStatistical Learning Theory and Neural Network Research\rGraph Mining and Semi-Structured Data\rSpatial and Temporal Data Mining\rUncertainty Modeling in Data Mining\rWeb Mining\r 2,Data Mining For Intelligent IT Application Topics:\r Convergence of Data Mining and Intelligent IT Applications\rHow Data Mining Techniques have been used in IT Applications\rNovel Applications of Intelligent IT Techniques for Complex Systems\rRobustness and Scalability Issues of Intelligent IT Techniques\rAgent-based Data Analysis and Knowledge Discovery\rIntelligent Multi-gent Systems\rIntrusion Detection and Access Control Techniques\rData-mining Applications for Terrorist Network Tracing\rCrime Modeling, Fraud and Misuse Detection\rCredit Scoring, Financial Modeling and Forecasting\rCRM, e-Marketing and e-Commerce Recommender\rWeb Intelligence\rPrediction Systems\rKnowledge Management\rDecision Analysis and Decision Support Systems\rIndustrial Applications of Business Analytics and Optimization\rPerformance Evaluation in Intelligent IT Applications\rEmerging Intelligent IT Applications and Lessons Learned\r 3,Communication Engineering Related Topics:\r Communication Networks\rWireless Communications\rMobile Communications\rInfrastructure for Next Generation Networks\rInformation & Communication\rCoding Theory\rOptical Communications\rInternet Technologies\rCommunication Software\rSensor Networks\rNew Communication Technologies\rVisual Arts & Visual Communication Design\rMarketing Communication\rGreen Communication\rCommunication Systems\rTelecommunication Technologies\rData Communications\rInformation Technology Application\rSatellite Communication\rNetwork Security\rDSP Algorithms & Architectures\rothers\r 4,Information Technology Applications Related Topics:\r Machine Learning for Multimedia\rHuman Computer Interaction\rBiometric Identification Technology\rRobot Vision Applications\rVirtual Reality and Augmented Reality\rE-Commerce, E-Business and E-Learning\rWeb Information Systems\rWeb Content Generation and Management\rTelecommunication and Wireless Communications\rDatabase Technology\rData Modeling and Engineering\rMultimedia Technology\rHealthcare Applications and Medical Diagnosis\rSecurity and Forensic Applications\rIT Software Development and Methodology\rIT Applications for Agriculture Management\rOther Industrial Applications\rThe Latest Advances in IT\r \xe2\x97\x8fPaper Submission\rElectronic submission system: https://cmt3.research.microsoft.com/DMCIT2023\rE-mail: dmcit@vip.163.com\r \xe2\x97\x8fCall for participants\r1,Presenter: If you are interested in giving presentation on conference,without publishing your paper in the proceeding,you need to submit the abstract and title of your presentation to us: dmcit@vip.163.com\r 2,Listener: You are welcome to attend this great event. You need to complete the registration as Listener before the registration dealdine.\r 3,Reviewer: We sincerely welcome professors, associate professors, teachers and other experts in the areas of Data Mining, Communications and Information Technology join the conference as a reviewer.\r \xe2\x97\x8fContact Us\rMs. Yury Yu\rEmail: dmcit@vip.163.com\rTel:+852-30506939( Hong Kong)\rWeb: https://www.dmcit.net/\r\n'","b'<div align=""left"" class=""cfp"">\n<table align=""center"" cellpadding=""0"" cellspacing=""0px"" width=""100%"">\n<tr valign=""top"">\n<td>\n<table align=""center"" cellpadding=""4"" cellspacing=""3"" width=""100%"">\n<tr><td>\n<a href=""/cfp/servlet/event.showcfp?eventid=137130"">MLDM 2023</a>\xc2\xa0\xc2\xa0\n18th International Conference on Machine Learning and Data Mining\n</td></tr>\n<tr><td>\n<a href=""/cfp/servlet/event.showcfp?eventid=165451"">ICTC--Ei 2023</a>\xc2\xa0\xc2\xa0\n2023 4th Information Communication Technologies Conference (ICTC 2023)\n</td></tr>\n<tr><td>\n<a href=""/cfp/servlet/event.showcfp?eventid=149056"">BIOS 2022</a>\xc2\xa0\xc2\xa0\n8th International Conference on Bioinformatics &amp; Biosciences \n</td></tr>\n<tr><td>\n<a href=""/cfp/servlet/event.showcfp?eventid=165456"">ICMT 2023</a>\xc2\xa0\xc2\xa0\n2023 International Conference on Metaverse Technology (ICMT 2022)\n</td></tr>\n<tr><td>\n<a href=""/cfp/servlet/event.showcfp?eventid=152145"">MLDS 2022</a>\xc2\xa0\xc2\xa0\n3rd International Conference on Machine Learning Techniques and Data Science\n</td></tr>\n<tr><td>\n<a href=""/cfp/servlet/event.showcfp?eventid=166806"">ACBT--EI 2023</a>\xc2\xa0\xc2\xa0\n2023 Asia Conference on Blockchain Technologies (ACBT 2023)\n</td></tr>\n<tr><td>\n<a href=""/cfp/servlet/event.showcfp?eventid=147901"">NLTM 2023</a>\xc2\xa0\xc2\xa0\n3rd International Conference on NLP &amp; Text Mining \n</td></tr>\n<tr><td>\n<a href=""/cfp/servlet/event.showcfp?eventid=166808"">ITIOT 2023</a>\xc2\xa0\xc2\xa0\n2023 8th International Conference on Information Technology and Internet of Things (ITIOT 2023)\n</td></tr>\n<tr><td>\n<a href=""/cfp/servlet/event.showcfp?eventid=146395"">JARES 2022</a>\xc2\xa0\xc2\xa0\nInternational Journal of Advance Robotics &amp; Expert Systems \n</td></tr>\n<tr><td>\n<a href=""/cfp/servlet/event.showcfp?eventid=166545"">ICWOC 2023</a>\xc2\xa0\xc2\xa0\n2023 11th International Conference on Intelligent Computing and Wireless Optical Communications (ICWOC 2023)\n</td></tr>\n</table>\n</td>\n</tr>\n</table>\n</div>'"
b'http://www.wikicfp.com/cfp/servlet/event.showcfp?eventid=163805',b'CSMO 2023',"b'2023 6th International Conference on Simulation, Modeling and Optimization (CSMO 2023)'",b'http://www.csmo2023.org/',b'2023-04-28T00:00:00',b'2023-04-30T23:59:59',b'Chongqing',"b'Oct 30, 2022'",,,b'modeling' b'optimization' b'artificial intelligence' b'electrical engineering' ,"b'\nCall For Papers\r2023 6th International Conference on Simulation, Modeling and Optimization (CSMO 2023)\rChongqing, China | Apr. 28-30, 2023\rWeb: http://www.csmo2023.org/\r 2023 6th International Conference on Simulation, Modeling and Optimization (CSMO 2023) is a wokshop of DMCIT 2023, which is organized by Asia Pacific Institute of Science and Engineering (APISE)and sponsored by Jiangnan University. CSMO 2023 will be held in Chongqing, China during Apr. 28-30, 2023.\r \xe2\x97\x8fPublication & Indexed \rAll registered and presented papers will be included in the conference proceedings. The publisher will submit articles to Engineering Village, Scopus, Web of Science and other databases for review and indexing after publication. \r \xe2\x97\x8fSpeakers\rProf. Shahram Latifi, University of Nevada, Las Vegas, USA\rShahram Latifi, an IEEE Fellow, received the Master of Science and the PhD degrees both in Electrical and Computer Engineering from Louisiana State University, Baton Rouge, in 1986 and 1989, respectively. He is currently a Professor of Electrical Engineering at the University of Nevada, Las Vegas. Dr. Latifi is the co-director of the Center for Information Technology and Algorithms (CITA) at UNLV. He has designed and taught undergraduate and graduate courses in the broad spectrum of Computer Science and Engineering in the past four decades. He has given keynotes and seminars on machine learning/AI and IT-related topics all over the world.\r \xe2\x97\x8fThe topics of conference are included below, but not limited to :\rArtificial Intelligence\rBiomedical Engineering\rChemical Engineering\r Computer Engineering\rCivil Engineering\rElectrical Engineering\r Engineering Systems Management\rMechanical Engineering\rApplied Mathematics\r Statistics and Probability\rMathematical Modeling and Simulations\rCombinatorics and Discrete Mathematics\r \xe2\x97\x8fPaper Submission\rElectronic submission system: https://cmt3.research.microsoft.com/CSMO2023\rE-mail: csmo@apise.org\r \xe2\x97\x8fCall for participants\r1,Presenter: If you are interested in giving presentation on conference,without publishing your paper in the proceeding,you need to submit the abstract and title of your presentation to us: csmo@apise.org\r 2,Listener: You are welcome to attend this great event. You need to complete the registration as Listener before the registration dealdine.\r 3,Reviewer: We sincerely welcome professors, associate professors, teachers and other experts in the areas of Simulation, Modeling and Optimization join the conference as a reviewer.\r \xe2\x97\x8fContact Us\rMs. Con Cong\rEmail: csmo@apise.org\rTel:+852-30506939( Hong Kong)\rWeb: http://www.csmo2023.org/\r\n'","b'<div align=""left"" class=""cfp"">\n<table align=""center"" cellpadding=""0"" cellspacing=""0px"" width=""100%"">\n<tr valign=""top"">\n<td>\n<table align=""center"" cellpadding=""4"" cellspacing=""3"" width=""100%"">\n<tr><td>\n<a href=""/cfp/servlet/event.showcfp?eventid=146828"">NLPTA 2022</a>\xc2\xa0\xc2\xa0\n3rd International Conference on NLP Techniques and Applications\n</td></tr>\n<tr><td>\n<a href=""/cfp/servlet/event.showcfp?eventid=154565"">ORAJ 2022</a>\xc2\xa0\xc2\xa0\nOperations Research and Applications: An International Journal \n</td></tr>\n<tr><td>\n<a href=""/cfp/servlet/event.showcfp?eventid=151700"">IJCI 2022</a>\xc2\xa0\xc2\xa0\nInternational Journal on Cybernetics &amp; Informatics\n</td></tr>\n<tr><td>\n<a href=""/cfp/servlet/event.showcfp?eventid=167422"">IEEE ICCSS 2023</a>\xc2\xa0\xc2\xa0\nIEEE--2023 6th International Conference on Circuits, Systems and Simulation (ICCSS 2023)\n</td></tr>\n<tr><td>\n<a href=""/cfp/servlet/event.showcfp?eventid=115414"">ACM-EI/Scopus-ACAI 2022</a>\xc2\xa0\xc2\xa0\n2022 5th International Conference on Algorithms, Computing and Artificial Intelligence (ACAI 2022)-EI Compendex\n</td></tr>\n<tr><td>\n<a href=""/cfp/servlet/event.showcfp?eventid=164700"">BDMO 2022</a>\xc2\xa0\xc2\xa0\n2022 Big Data Modeling and Optimization (BDMO 2022)\n</td></tr>\n<tr><td>\n<a href=""/cfp/servlet/event.showcfp?eventid=153664"">AIAA 2022</a>\xc2\xa0\xc2\xa0\n12th International Conference on Artificial Intelligence, Soft Computing and Applications\n</td></tr>\n<tr><td>\n<a href=""/cfp/servlet/event.showcfp?eventid=166161"">SIMPAT SI: CyberPhysicalSystems 2022</a>\xc2\xa0\xc2\xa0\nSIMPAT (IF: 4.199) Elsevier - Special Issue on Cyber-Physical Systems, Digital Twins and Industry 4.0: The Role of Modeling and Simulation\n</td></tr>\n<tr><td>\n<a href=""/cfp/servlet/event.showcfp?eventid=149056"">BIOS 2022</a>\xc2\xa0\xc2\xa0\n8th International Conference on Bioinformatics &amp; Biosciences \n</td></tr>\n<tr><td>\n<a href=""/cfp/servlet/event.showcfp?eventid=156314"">NETWORKS 2022</a>\xc2\xa0\xc2\xa0\n6th International Conference on Networks &amp; Communications\n</td></tr>\n</table>\n</td>\n</tr>\n</table>\n</div>'"
