identifier,title,description,source,startDate,endDate,locality,Submission Deadline,Notification Due,Final Version Due,Categories,Call For Papers,Related Resources
b'http://www.wikicfp.com/cfp/servlet/event.showcfp?eventid=164483',b'DSM 2022',b'FIRST INTERNATIONAL SUMMER SCHOOL ON DATA SCIENCE FOR MOBILITY',b'http://master-school.isti.cnr.it/',b'2022-10-03T00:00:00',b'2022-10-07T23:59:59',"b'Santorini, Greece'","b'Aug 31, 2022'",,,b'summer school' b'data science' b'mobility data' b'data analysis' ,"b'\nFIRST INTERNATIONAL SUMMER SCHOOL ON DATA SCIENCE FOR MOBILITY\rOctober 3 - 7, 2022\rKastelli Resort, Kamari Village, Santorini, Greece\rhttp://master-school.isti.cnr.it\r  ***** Deadline approaching: August 31, 2022 *****\r  *** Call for Participation ***\r MOTIVATION \rMassive amounts of Spatio-temporal data representing trajectories of moving objects are produced by an ever-increasing number of diverse, real-life applications, ranging from mobile to social media apps and surveillance systems, from vehicle tracking systems to IoT mobile sensors. Such mobility-aware traces come in huge numbers and very complex forms and can be enriched with multiple different semantic dimensions. These semantically enriched trajectories have the potential to unveil novel challenges in several domains, such as urban, maritime and aviation.\r The explosion in Data Science is happening now. The Big Data technological infrastructure has reached maturity. Significant interest from the research community is being shown towards the Big Data Value Analytics reference model: data management, data processing, data analytics, data visualization. The time is right for the field of Mobility Data Science to follow the trend!\r Our First Summer School on Data Science for Mobility offers participants both visionary keynote speeches and hands-on mini-courses held by leading experts in AI and Data Analytics for Mobility from Canada, Greece & Italy. The keynotes speeches will explore the challenges faced due to the voluminous and complex mobility data generated every day in maritime and aviation domains. The hands-on mini-courses complement the keynotes by giving practical experience in the usage of analysis tools on real mobility datasets.\r  TARGET GROUPS\rThis Summer School is intended for PhD students, researchers and practitioners in the fields of Computer and Information Science, interested in learning about the most recent developments in mobility data science. Attendees will familiarise themselves with the most recent data science trends, including deep learning and AI methods for mobility data, methods to analyze human mobility as well as with methods for big mobility data. With the hands-on experience, participants will gain familiarity with some commonly used tools and datasets.\r  COURSE AIM\rAt the end of the course, each attendee will:\r ** Understand how to analyze mobility data with deep learning techniques\r** Understand how machine learning and AI methods can be tailored to mobility data\r** Understand how to manage Big Mobility Data\r** Gain significant hands-on experience with state-of-the-art technologies and tools\r** Have a vision of open research as well as technological challenges customized to key application areas and domains\r  KEYNOTE SPEAKERS\rProf. Goce Trajcevski Iowa State University (USA)\rProf. George Vouros, University of Piraeus (Greece)\r  HANDS-ON MINI COURSES\r Title: Deep Learning for Mobility\rTutors: Franco Maria Nardini & Salvatore Trani (ISTI-CNR, Italy)\r Title: Human mobility analysis and simulation in Python\rTutors: Luca Pappalardo (ISTI-CNR, Italy)\r Title: Learning from our movements: Big Mobility Data Analytics\rTutors: Yannis Theodoridis (Data Science Lab, University of Piraeus, Greece) & Panagiotis Tampakis (Department of Mathematics and Computer Science of the University of Southern Denmark, Denmark)\r  PANEL: Emerging issues on mobility data science\r The objective of this panel session is to highlight the emerging issues that relate to the analysis of mobility data and their applications. Examples of such issues could revolve around: datasets, AI approaches, privacy compromise, unethical use of analysis products and others. The audience will get the chance to participate in a live discussion with experts in the field from academia and industry, who will share their opinions, in a moderated open discussion.\r Panelists (initial list):\r Prof. George Vouros, University of Piraeus (Greece)\rDr. Thierry Chevallier (AKKA Technologies, France) \rProf. Bettina Berendt (Technische Universit\xc3\xa4t Berlin, Germany & KU Leuven, Belgium)\rDr. Franco Maria Nardini (ISTI-CNR, Italy)\rDr. Luca Pappalardo (ISTI-CNR, Italy)\rProf. Yannis Theodoridis (University of Piraeus, Greece)\r Moderator: Konstantinos Tserpes (Harokopio University, Greece)\r  REGISTRATION\r Registration fee is 300 euro.  \rDetails on the registration procedure, deadlines and the school schedule are available at the school web site: http://master-school.isti.cnr.it\r  VENUE\r The Summer School will be held at the Kastelli Resort on the magic island of Santorini, in Greece.\rhttps://www.kastelliresort.com\rhttp://www.santorini.gr/index.php?lang=en\r  ACCOMMODATIONS\r  The Summer School has NOT reserved rooms for the school. All the participants are warmly invited to reserve their accommodation on their own as soon as possible.\r *** Kastelli Resort, the venue of the Summer School, is a peaceful luxury retreat that combines an idyllic and convenient location, with upscale accommodation, state-of-the-art facilities, and impeccable services.\r *** Dioskouri Art Villas is a 3* boutique hotel situated in a central and quiet area of the village Kamari in Santorini, near Kamari Beach. The hotel is two minutes walking from the venue of the summer school.\r For details check instructions at: http://master-school.isti.cnr.it/accomodation/\r  SOCIAL PROGRAM\r The Data Science for Mobility school offers a rich social program, including a Welcome cocktail with dinner on Monday 3rd, the trip to Oia to admire the famous Santorini sunset, and a wine tasting experience with the Caldera view. All details are available at: http://master-school.isti.cnr.it/social-program/\r  GENERAL CHAIRS\r Nikos Pelekis \rUniversity of Piraeus (Greece)\r Chiara Renso \rISTI-CNR (Italy)\r ORGANIZATION and PUBLICITY CHAIR\rBeatrice Rapisarda (ISTI-CNR) \r REGISTRATION CHAIR \rYannis Kontoulis (University of Piraeus, Greece)\r PANEL CHAIR \rKonstantinos Tserpes (Harokopio University, Greece)\r ORGANIZATION COMMITTEE \rJose Fernandes da Macedo (Federal University of Ceara\xe2\x80\x99, Brazil) \rRaffaele Perego (ISTI-CNR, Italy) \rAlessandra Raffaeta\xe2\x80\x99 (University Ca\xe2\x80\x99 Foscari of Venice, Italy) \rAmilcar Soares (Memorial University of Newfoundland, Canada) \rYannis Theodoridis (University of Piraeus, Greece) \rKarine Zeitouni (University of Versailles Saint Quentin, France) \r  SPONSORS\r This Summer School is organized and supported by H2020 MSCA project MASTER GA 777695 http://www.master-project-h2020.eu and sponsored by H2020 VesselAI  GA 957237  https://vessel-ai.eu/ and H2020 MOBIDATALAB GA 101006879 http://www.mobidatalab.eu \r  CONTACT US\rFor further information: master-summer-chairs AT isti.cnr.it\n\t'","b'<div align=""left"" class=""cfp"">\n<table align=""center"" cellpadding=""0"" cellspacing=""0px"" width=""100%"">\n<tr valign=""top"">\n<td>\n<table align=""center"" cellpadding=""4"" cellspacing=""3"" width=""100%"">\n<tr><td>\n<a href=""/cfp/servlet/event.showcfp?eventid=116286"">IEEE-Ei/Scopus-CISDS 2022</a>\xc2\xa0\xc2\xa0\n2022 International Conference on Frontiers of Communications, Information System and Data Science (CISDS 2022)-EI Compendex\n</td></tr>\n<tr><td>\n<a href=""/cfp/servlet/event.showcfp?eventid=152145"">MLDS 2022</a>\xc2\xa0\xc2\xa0\n3rd International Conference on Machine Learning Techniques and Data Science\n</td></tr>\n<tr><td>\n<a href=""/cfp/servlet/event.showcfp?eventid=137130"">MLDM 2023</a>\xc2\xa0\xc2\xa0\n18th International Conference on Machine Learning and Data Mining\n</td></tr>\n<tr><td>\n<a href=""/cfp/servlet/event.showcfp?eventid=147901"">NLTM 2023</a>\xc2\xa0\xc2\xa0\n3rd International Conference on NLP &amp; Text Mining \n</td></tr>\n<tr><td>\n<a href=""/cfp/servlet/event.showcfp?eventid=158794"">SI PMABD 2023</a>\xc2\xa0\xc2\xa0\nSpecial Issue on Programming Models and Algorithms for Big Data\n</td></tr>\n<tr><td>\n<a href=""/cfp/servlet/event.showcfp?eventid=161074"">Smart Cities 2022</a>\xc2\xa0\xc2\xa0\nSmart Cities: Enabling Technologies and Applications\n</td></tr>\n<tr><td>\n<a href=""/cfp/servlet/event.showcfp?eventid=146395"">JARES 2022</a>\xc2\xa0\xc2\xa0\nInternational Journal of Advance Robotics &amp; Expert Systems \n</td></tr>\n<tr><td>\n<a href=""/cfp/servlet/event.showcfp?eventid=166548"">ICCSN 2023</a>\xc2\xa0\xc2\xa0\nIEEE--2023 15th International Conference on Communication Software and Networks (ICCSN 2023)\n</td></tr>\n<tr><td>\n<a href=""/cfp/servlet/event.showcfp?eventid=161318"">Smart Cities 2022</a>\xc2\xa0\xc2\xa0\nSmart Cities: Urban Profiling with Artificial Intelligence and Big Data\n</td></tr>\n</table>\n</td>\n</tr>\n</table>\n</div>'"
b'http://www.wikicfp.com/cfp/servlet/event.showcfp?eventid=164484',b'CMO 2022',b'Collective Memory & Oral tradition: Explorations and Interpretations',b'https://www.gires.org/activities/conferences/collective-memory-and-oral-tradition-explorations-and-interpretations-4/',b'2022-07-20T00:00:00',b'2022-07-21T23:59:59',b'Amsterdam Netherlands ',"b'Jul 12, 2022'","b'Jul 15, 2022'",,b'education' b'oral history' b'memory' b'collective identity' ,"b""\nCollective Memory & Oral tradition: Explorations and Interpretations\r International Conference\r20-21 July 2022\r(Zoom sessions:2 days-Virtual platform:5 days)\r Thematic Approach\r GIRES is committed to creating a welcoming space for discussion, collaboration, and exploration of oral history\xe2\x80\x99s potential as a tool for local, national, and international projects that would enrich and even revise chapters of history. \r Our new international conference seeks to promote the importance of oral history as a valuable and unique source of information. For decades, oral history was considered less than scholarly, leading to its exclusion from several history books; thus valuable first-hand experiences and information that could alter historical truth were neglected and ultimately lost to oblivion. We wish to challenge the pervading view that oral testimony can lead to false representation of historical events; and underline the significant support they can provide to historical research, especially in lieu of written documentation. \r We also hope to focus on the connections between oral history, collective memory, and individual memory. Whether from a historical, social, or even psychological approach we wish to engage scholars in a multidimensional and interdisciplinary approach in order to deeply explore all aspects of this valuable and fascinating discipline. \r We invite scholars from different fields including history, philosophy, religion, sociology, international relations, literature, art, space studies, peace studies, cultural studies, minority studies, war and/or genocide studies, journalism, immigration studies, psychology and psychiatry, political and social studies, and those working in archives, museums and NGOs. \r Proposed Topics \r -Oral history throughout history\r-Oral historian: a public historian? Oral history as a form of social and communal activity;\r-Conducting oral history research: Methodologies and techniques\r-Re-examining and re-writing history through the lens of oral history\r-Epistemological and ethical dilemmas in oral history\r-Collective/Individual memory and oral tradition\r-Manipulation of memory and the role of oral history\r-Oral history and trauma\r-Oral history as a tool of revealing/reliving a dictatorship/suppressing regime\r-Altering, exaggerating or forgetting memories; the psychology of a survivor\r-Oral history in teaching and teaching oral history\r Proposed Formats (Lingua franca: English)\r-Individual papers (GIRES will included it in a panel)\r-Panels (up to 4 presentations-chaired by one of the presenters or appointed by GIRES)\r-Roundtable presentations (chaired by one of the presenters or appointed by GIRES)\r-Poster presentations\r-Student presentations (one paper presented by up to 3 young scholars)\r-Keynote speech (depending on the time availability)\r-Pre-recorder presentation (s) (Asynchronous Platform)\r-Pre-recorder presentation (s) (Synchronous-live- Sessions: live participation of presenter (s) during the Q&A sessions)\r Publication Opportunity \rThe Organizing Committee and GIRES Press will publish the most powerful and dynamic presentations of the conference and include them\rin a collective volume in the form of short articles and/or long essays. For more information please contact us\r Live Sessions & Recording\rAll speakers are offered up to 30 minutes to present their work. All speakers have the option to have their presentations recorded (during live sessions) in HD quality.\rThe recordings will be uploaded to GIRES media for unlimited access and dissemination.\r Asynchronous Options\rAll participants have the option to have their presentations (video/audio/text) uploaded to our Virtual Platform. All  registered participants will have access to the material for 5 days.\r   PROPOSAL SUBMISSION  (Please use our online application form found in the conference's webpage)\rDEADLINE FOR PROPOSALS: July 12,  2022\rACCEPTANCE NOTIFICATION: July 15, 2022\rPUBLICATION: GIRES PRESS \rACCREDITATION: Official Certificate Issued by GIRES \r ----------------------------------------------------------------------------------------------------------------------------------------------\rGenerating dialogue is of primary importance for our scholarly community and thus GIRES wishes to create a friendly and welcoming environment for all of our colleagues and offer all the tools to present their work in the best possible way.\r----------------------------------------------------------------------------------------------------------------------------------------------\r Our proposed topics & formats are not restrictive and we invite additional germane ideas\rDue to the restrictions of Corona Crisis our event (for the time being) will take place virtually\r Contact Info: \rGIRES-GLOBAL INSTITUTE FOR RESEARCH, EDUCATION & SCHOLARSHIP (Amsterdam, The Netherlands)\rwww.gires.org (Dr. Konstantinos D. Karatzas-Director & Chloe Matias, Communication Officer)\r Contact Email: \rinfo@gires.org\rURL: \rhttps://www.gires.org/activities/conferences/collective-memory-and-oral-tradition-explorations-and-interpretations-4/\r\n""","b'<div align=""left"" class=""cfp"">\n<table align=""center"" cellpadding=""0"" cellspacing=""0px"" width=""100%"">\n<tr valign=""top"">\n<td>\n<table align=""center"" cellpadding=""4"" cellspacing=""3"" width=""100%"">\n<tr><td>\n<a href=""/cfp/servlet/event.showcfp?eventid=155149"">IJHAS 2022</a>\xc2\xa0\xc2\xa0\nInternational Journal of Humanities, Art and Social Studies\n</td></tr>\n<tr><td>\n<a href=""/cfp/servlet/event.showcfp?eventid=166197"">MIIP 2023</a>\xc2\xa0\xc2\xa0\nMedical Imaging &amp; Image Processing III\n</td></tr>\n<tr><td>\n<a href=""/cfp/servlet/event.showcfp?eventid=153043"">EDUPT 2022</a>\xc2\xa0\xc2\xa0\nInternational Conference on Education, Pedagogy and Technology\n</td></tr>\n<tr><td>\n<a href=""/cfp/servlet/event.showcfp?eventid=154172"">DISCOLI 2022</a>\xc2\xa0\xc2\xa0\n1st DISCOLI Workshop on DIStributed COLlective Intelligence\n</td></tr>\n<tr><td>\n<a href=""/cfp/servlet/event.showcfp?eventid=154147"">CGDEIJ 2022</a>\xc2\xa0\xc2\xa0\nComputer Game Development and Education: An International Journal\n</td></tr>\n<tr><td>\n<a href=""/cfp/servlet/event.showcfp?eventid=149593"">MDPI-SI on DT &amp; FIE in Ed--Scopus,JCI 2023</a>\xc2\xa0\xc2\xa0\nMDPI Education Sciences Journal - Special Issue on Digital Twins and Future Intelligent Educational Environments\n</td></tr>\n<tr><td>\n<a href=""/cfp/servlet/event.showcfp?eventid=160926"">Computing &amp; AI in Digital Therapeutics 2022</a>\xc2\xa0\xc2\xa0\nJournal Special Issue (Frontiers in Medicine &amp; Frontiers in Digital Health ): Computing and Artificial Intelligence in Digital Therapeutics\n</td></tr>\n<tr><td>\n<a href=""/cfp/servlet/event.showcfp?eventid=166826"">SPIE DCS 2023</a>\xc2\xa0\xc2\xa0\nSPIE Defense + Commercial Sensing 2023\n</td></tr>\n<tr><td>\n<a href=""/cfp/servlet/event.showcfp?eventid=165205"">Uehiro  2023</a>\xc2\xa0\xc2\xa0\nWhat Dreams May Come?: Philosophical Explorations in Dreaming, Suffering, and Death\n</td></tr>\n<tr><td>\n<a href=""/cfp/servlet/event.showcfp?eventid=145683"">IJSC 2022</a>\xc2\xa0\xc2\xa0\nInternational Journal on Soft Computing\n</td></tr>\n</table>\n</td>\n</tr>\n</table>\n</div>'"
b'http://www.wikicfp.com/cfp/servlet/event.showcfp?eventid=164485',b'Cancer Therapeutics 2022',b'Side Effects of Gastrointestinal Cancer Therapeutics',b'https://peerj.com/special-issues/108-gastro-cancer-side-effects',,,,"b'Sep 23, 2022'",,,b'oncology' b'surgery' b'gastroenterology' b'hepatology' ,"b'\nSide Effects of Gastrointestinal Cancer Therapeutics\r \xe2\x80\x9cThe employment of non-surgical treatment options for gastrointestinal cancer has greatly assisted late-stage patients. However, we need to further investigate the impacts of these options to reduce unwanted side effects and improve the quality of life for patients.\xe2\x80\x9d Special Issue Editor Dr. Jian Zhang, Attending Surgeon, Senior researcher, Sun Yat-Sen University of Medical Sciences\r Gastrointestinal cancer is a leading cause of cancer death worldwide, especially in some regions of Asia. Major advances in cancer therapeutics have led to a remarkable reduction in gastrointestinal cancer mortality. However, these improvements come with the limitation of a range of side effects, that affect most patients with varying severity, and that clinicians and researchers need to treat and investigate. With the emergence of new therapeutics, such as immunotherapy, improving our understanding of therapy-related side effects is a vital and meaningful goal.\r \xe2\x80\x9cNew results are emerging in the field of non-surgical treatment of gastrointestinal tumors, but the application of these results is limited due to the existence of side effects of treatment. It is hoped that this special issue will enable us to make a systematic summary of related fields and inspire future research.\xe2\x80\x9d Special Issue Editor Dr Dongjie Yang, Consultant, First Affiliated Hospital of Sun Yat-sen University\r For this Special Issue, we particularly encourage the submission of manuscripts dealing with any aspect of side effect analyses for gastrointestinal cancer, including, but not limited to, acute and chronic side effects, immunotherapy, chemotherapy, radiotherapy et al. We welcome manuscripts in the form of original research or literature reviews.\r Topics\r Including, but not limited to:\r Gastric Cancer\rColorectal Cancer\rCancer Biology\rImmunotherapy\rChemotherapy\rRadiotherapy\rCardiotoxicity\rNeuropathy\rFatigue\rGastrointestinal\rNephrotoxicity\rImmune-Related\rSexual Dysfunction\rCognitive Changes\rRisk Factors And Risk Prediction\rPharmacogenetics/Pharmacogenomics\r For more information and to submit your abstract, please visit:  https://peerj.com/special-issues/108-gastro-cancer-side-effects\r \xe2\x80\x94\xe2\x80\x94\xe2\x80\x94\xe2\x80\x93\n\t'","b'<div align=""left"" class=""cfp"">\n<table align=""center"" cellpadding=""0"" cellspacing=""0px"" width=""100%"">\n<tr valign=""top"">\n<td>\n<table align=""center"" cellpadding=""4"" cellspacing=""3"" width=""100%"">\n<tr><td>\n<a href=""/cfp/servlet/event.showcfp?eventid=160926"">Computing &amp; AI in Digital Therapeutics 2022</a>\xc2\xa0\xc2\xa0\nJournal Special Issue (Frontiers in Medicine &amp; Frontiers in Digital Health ): Computing and Artificial Intelligence in Digital Therapeutics\n</td></tr>\n<tr><td>\n<a href=""/cfp/servlet/event.showcfp?eventid=166662"">DLTCI 2023</a>\xc2\xa0\xc2\xa0\nSpecial Issue on: Deep Learning Techniques for Cancer Imaging\n</td></tr>\n<tr><td>\n<a href=""/cfp/servlet/event.showcfp?eventid=154473"">i-Women Health 2022</a>\xc2\xa0\xc2\xa0\n2nd International Women Health and Breast Cancer Conference\n</td></tr>\n<tr><td>\n<a href=""/cfp/servlet/event.showcfp?eventid=156537"">IJCAI-AIofAI 2022</a>\xc2\xa0\xc2\xa0\n2nd Workshop on Adverse Impacts and Collateral Effects of AI Technologies\n</td></tr>\n<tr><td>\n<a href=""/cfp/servlet/event.showcfp?eventid=159177"">PRASAE 2022</a>\xc2\xa0\xc2\xa0\nPeer-Review, Peer-Assessment, and Self-Assessment in Education, 8th International Workshop\n</td></tr>\n<tr><td>\n<a href=""/cfp/servlet/event.showcfp?eventid=157388"">HOPE 2022</a>\xc2\xa0\xc2\xa0\nACM SIGPLAN Workshop on Higher-Order Programming with Effects\n</td></tr>\n<tr><td>\n<a href=""/cfp/servlet/event.showcfp?eventid=156347"">IEETeL 2022</a>\xc2\xa0\xc2\xa0\n13th International Workshop on Interactive Environments and Emerging Technologies for eLearning\n</td></tr>\n<tr><td>\n<a href=""/cfp/servlet/event.showcfp?eventid=151687"">COSADE 2022</a>\xc2\xa0\xc2\xa0\nConstructive Side-Channel Analysis and Secure Design\n</td></tr>\n<tr><td>\n<a href=""/cfp/servlet/event.showcfp?eventid=152840"">SELSE 2022</a>\xc2\xa0\xc2\xa0\nSilicon Errors in Logic - System Effects\n</td></tr>\n</table>\n</td>\n</tr>\n</table>\n</div>'"
b'http://www.wikicfp.com/cfp/servlet/event.showcfp?eventid=164486',b'Catalysis Conference 2023',b'International Conference on Catalysis and Chemical Engineering',b'https://scisynopsisconferences.com/catalysis/',b'2023-03-20T00:00:00',b'2023-03-21T23:59:59',"b'Rome,Italy'","b'Oct 31, 2022'","b'Jul 31, 2022'","b'Oct 31, 2022'",b'chemistry' b'chemical engineering' b'catalysis' b'industries' ,b'\n\xe2\x80\xa2 Catalysis for chemical synthesis\r\xe2\x80\xa2 Chemical Engineering\r\xe2\x80\xa2 Catalysis and Energy\r\xe2\x80\xa2 Organocatalysis\r\xe2\x80\xa2 Catalysis and Zeolites\r\xe2\x80\xa2 Catalysis and pyrolysis\r\xe2\x80\xa2 Organometallics Chemistry\r\xe2\x80\xa2 Catalysis in Nanotechnology\r\xe2\x80\xa2 Catalysis and Applications\r\xe2\x80\xa2 Biocatalysis and Biotransformation\r\xe2\x80\xa2 Computational Catalysis\r\xe2\x80\xa2 Surface and Colloidal Phenomena\r\xe2\x80\xa2 Photo catalysis and Electrochemistry\r\xe2\x80\xa2 Enzymes and Biocatalysts\r\xe2\x80\xa2 Fluid dynamics & its Phenomena\r\xe2\x80\xa2 Catalysis for Renewable sources\r\xe2\x80\xa2 Polymer Science and Technology\r\xe2\x80\xa2 Thermal catalysis\r\xe2\x80\xa2 Catalysis in Oil & Gas and Petrochemical\rEngineering\r\xe2\x80\xa2 Environmental catalysis\r\xe2\x80\xa2 Catalytic Materials & Mechanisms\r\xe2\x80\xa2 Enantioselective catalysis\r\xe2\x80\xa2 Industrial Catalysis\r\xe2\x80\xa2 Simulation and modeling in catalysis\r\n',"b'<div align=""left"" class=""cfp"">\n<table align=""center"" cellpadding=""0"" cellspacing=""0px"" width=""100%"">\n<tr valign=""top"">\n<td>\n<table align=""center"" cellpadding=""4"" cellspacing=""3"" width=""100%"">\n<tr><td>\n<a href=""/cfp/servlet/event.showcfp?eventid=151483"">IJNGN 2022</a>\xc2\xa0\xc2\xa0\nInternational Journal of Next - Generation Networks\n</td></tr>\n<tr><td>\n<a href=""/cfp/servlet/event.showcfp?eventid=161097"">NANOMAT 2022</a>\xc2\xa0\xc2\xa0\nInternational Conference on Functional Nanomaterials and Nanodevices 2022 \n</td></tr>\n<tr><td>\n<a href=""/cfp/servlet/event.showcfp?eventid=151985"">ICFMCE 2022</a>\xc2\xa0\xc2\xa0\n2022 International Conference on Functional Materials and Chemical Engineering(ICFMCE 2022)\n</td></tr>\n<tr><td>\n<a href=""/cfp/servlet/event.showcfp?eventid=118176"">JCICE 2023</a>\xc2\xa0\xc2\xa0\n2023 6th International Joint Conference on Information and Communication Engineering (JCICE 2023\n</td></tr>\n<tr><td>\n<a href=""/cfp/servlet/event.showcfp?eventid=151039"">ADEIJ 2022</a>\xc2\xa0\xc2\xa0\nAdvances in Engineering: an International Journal \n</td></tr>\n<tr><td>\n<a href=""/cfp/servlet/event.showcfp?eventid=153409"">IJOE 2022</a>\xc2\xa0\xc2\xa0\nInternational Journal on Organic Electronics\n</td></tr>\n<tr><td>\n<a href=""/cfp/servlet/event.showcfp?eventid=166667"">ESEC/FSE 2023</a>\xc2\xa0\xc2\xa0\nThe ACM Joint European Software Engineering Conference and Symposium on the Foundations of Software Engineering\n</td></tr>\n<tr><td>\n<a href=""/cfp/servlet/event.showcfp?eventid=166826"">SPIE DCS 2023</a>\xc2\xa0\xc2\xa0\nSPIE Defense + Commercial Sensing 2023\n</td></tr>\n<tr><td>\n<a href=""/cfp/servlet/event.showcfp?eventid=163010"">ACM IMIP 2023</a>\xc2\xa0\xc2\xa0\nACM--2023 5th International Conference on Intelligent Medicine and Image Processing (IMIP 2023)\n</td></tr>\n<tr><td>\n<a href=""/cfp/servlet/event.showcfp?eventid=162766"">ICCES--EI, Scopus 2023</a>\xc2\xa0\xc2\xa0\nThe 29th International Conference on Computational &amp; Experimental Engineering and Sciences\n</td></tr>\n</table>\n</td>\n</tr>\n</table>\n</div>'"
