identifier,title,description,source,startDate,endDate,locality,Submission Deadline,Notification Due,Final Version Due,Categories,Call For Papers,Related Resources
b'http://www.wikicfp.com/cfp/servlet/event.showcfp?eventid=163559',b'ICSCA--Ei 2023',b'2023 12th International Conference on Software and Computer Applications (ICSCA 2023)',b'http://www.icsca.org',b'2023-02-23T00:00:00',b'2023-02-25T23:59:59',"b'Kuantan, Malaysia'","b'Oct 5, 2022'",,,b'cloud computing' b'computer engineering' b'computational intelligence' b'computer graphics' ,"b'\nICSCA 2023_Software and Computer Applications Conference / Ei Compendex and Scopus\r 2023 12th International Conference on Software and Computer Applications (ICSCA 2023)\rEvent Acronym: ICSCA 2023\r23-25 February, 2023\rKuantan, Malaysia\rWebsite: http://www.icsca.org\r we are proud to bring you to Kuantan, Malaysia to attend 2023 12th International Conference on Software and Computer Applications (ICSCA 2023)  during 23-25 February, 2023.\rIt is co-organized by Universiti Malaysia Pahang (UMP), Universiti Malaysia Perlis (UniMAP), FH JOANNEUM University of Applied Sciences (Austria) and Kuala Lumpur ACM Chapter.\rICSCA provides a platform for academicians, researchers, students, engineers as well as industrial professionals from all over the world to present their research results and development activities in Software and Computer Applications.\r \xe2\x98\x9b CALL FOR PAPERS | For more topics, please visit http://www.icsca.org/cfp.html \r Topics of interest for submission include, but are not limited to:\rTrack 1. Software Engineering\rRequirements Engineering\rSoftware Architecture and Design\rSoftware Quality Assurance and Usability Issues\rEmpirical Software Engineering\rFormal Methods\rModern Programming Techniques\rSoftware Applications for I4.0\rMobile Applications\rAugmented Reality\rDistributed and parallel software systems\rEmbedded and real-time software systems\r Track 2. Computer Applications\rOperating Systems\rCyber-Physical Systems\rIoT and Cloud Computing \rInformation Systems\rBlockchain Technology\rInformation Security and Forensics\rComputer-based Educational Technologies\rSocial Networks\rBio-informatics\rEconomic and Financial Systems\r Track 3. Computational Intelligence and AI techniques\rAlgorithms and Protocols\rBig Data\rMeta-heuristics Algorithms\rHigh Performance Computing\rNatural Language Processing\rImage Processing\rIntelligent Human Computer Interaction\rRobotics\rScientific Computing\rCost Modeling and analysis\r  \xe2\x98\x9b PUBLICATION \rAccepted and presented papers in ICSCA 2023 will be published in the International Conference Proceedings Series and archived in ACM Online Digital Library, which will be indexed by Ei Compendex and Scopus.\r ICSCA has very credible publication index records: http://www.icsca.org/history.html \rICSCA 2022 | ISBN: 978-1-4503-8577-0 | ACM Digital Library | Scopus & Ei-Compendex Index\rICSCA 2021 | ISBN: 978-1-4503-8882-5 | ACM Digital Library | Scopus & Ei-Compendex Index\rICSCA 2020 | ISBN: 978-1-4503-7665-5 | ACM Digital Library | Scopus & Ei-Compendex Index\rICSCA 2019 | ISBN: 978-1-4503-6573-4 | ACM Digital Library | Scopus & Ei-Compendex Index\rICSCA 2018 | ISBN: 978-1-4503-5414-1 | ACM Digital Library | Scopus & Ei-Compendex Index\rICSCA 2017 | ISBN: 978-1-4503-4857-7 | ACM Digital Library | Scopus & Ei-Compendex Index\r \xe2\x98\x9b SUBMISSION\r 1. Full Paper (Publication and Presentation)\r2. Abstract (Presentation Only)\r \xe2\x80\xbb For full paper(.pdf), please upload to https://www.zmeeting.org/submission/icsca2023\r\xe2\x80\xbb For abstract, please send it to icsca_general@163.com\rMore details about submission, please visit http://www.icsca.org/author.html\r   \xe2\x98\x9b CONFERENCE SCHEDULE\r February 23, 2023---Sign-in\rFebruary 24, 2023---(Morning)----Openning Ceremony & Keynote Speeches & Group Photo\r                               (Afternoon)----Parallel Sessions\rFebruary 25, 2023---Parallel Sessions & Tutorial &Closing Ceremony\r  \xe2\x98\x9b CONTACT\rFreda C. Lee (conference secretary)\rEmail: icsca_general@163.com\rContact Number: 86-132-7777-7770\n\t'","b'<div align=""left"" class=""cfp"">\n<table align=""center"" cellpadding=""0"" cellspacing=""0px"" width=""100%"">\n<tr valign=""top"">\n<td>\n<table align=""center"" cellpadding=""4"" cellspacing=""3"" width=""100%"">\n<tr><td>\n<a href=""/cfp/servlet/event.showcfp?eventid=163568"">CETA 2023</a>\xc2\xa0\xc2\xa0\n2023 2nd International Conference on Computer Engineering, Technologies and Applications (CETA 2023)\n</td></tr>\n<tr><td>\n<a href=""/cfp/servlet/event.showcfp?eventid=115414"">ACM-EI/Scopus-ACAI 2022</a>\xc2\xa0\xc2\xa0\n2022 5th International Conference on Algorithms, Computing and Artificial Intelligence (ACAI 2022)-EI Compendex\n</td></tr>\n<tr><td>\n<a href=""/cfp/servlet/event.showcfp?eventid=163569"">CETA--Ei 2023</a>\xc2\xa0\xc2\xa0\n2023 2nd International Conference on Computer Engineering, Technologies and Applications (CETA 2023)\n</td></tr>\n<tr><td>\n<a href=""/cfp/servlet/event.showcfp?eventid=121887"">IOP, EI, Scopus-PRECE 2022</a>\xc2\xa0\xc2\xa0\n2022 International Conference on Power, Renewable Energy and Control Engineering (PRECE 2022)-EI Compendex\n</td></tr>\n<tr><td>\n<a href=""/cfp/servlet/event.showcfp?eventid=165455"">ICCTA 2023</a>\xc2\xa0\xc2\xa0\n2023 9th International Conference on Computer Technology Applications (ICCTA 2023)\n</td></tr>\n<tr><td>\n<a href=""/cfp/servlet/event.showcfp?eventid=149128"">IJCSA 2022</a>\xc2\xa0\xc2\xa0\nInternational Journal on Computational Science &amp; Applications\n</td></tr>\n<tr><td>\n<a href=""/cfp/servlet/event.showcfp?eventid=167692"">ICDIP--Ei 2023</a>\xc2\xa0\xc2\xa0\n2023 The 15th International Conference on Digital Image Processing (ICDIP 2023)\n</td></tr>\n<tr><td>\n<a href=""/cfp/servlet/event.showcfp?eventid=151700"">IJCI 2022</a>\xc2\xa0\xc2\xa0\nInternational Journal on Cybernetics &amp; Informatics\n</td></tr>\n<tr><td>\n<a href=""/cfp/servlet/event.showcfp?eventid=163564"">IEEE ICICSE 2023</a>\xc2\xa0\xc2\xa0\nIEEE--2023 the 3rd International Conference on Information Communication and Software Engineering (ICICSE 2023)\n</td></tr>\n<tr><td>\n<a href=""/cfp/servlet/event.showcfp?eventid=153920"">ICCPR 2022</a>\xc2\xa0\xc2\xa0\nACM--2022 11th International Conference on Computing and Pattern Recognition (ICCPR 2022)\n</td></tr>\n</table>\n</td>\n</tr>\n</table>\n</div>'"
b'http://www.wikicfp.com/cfp/servlet/event.showcfp?eventid=163560',b'ICAIE 2023',b'2023 3rd International Conference on Artificial Intelligence in Education (ICAIE 2023)',b'http://www.icaie.org/',b'2023-03-16T00:00:00',b'2023-03-18T23:59:59',"b'Chongqing, China'","b'Nov 1, 2022'",,,b'artificial intelligence' b'education' b'e-learning ' b'machine learning' ,"b""\nICAIE2023-2023 3rd International Conference on Artificial Intelligence in Education-Ei Compendex and Scopus\r \xe2\x98\x85 Full name: 2023 3rd International Conference on Artificial Intelligence in Education (ICAIE 2023)\r\xe2\x98\x85 Abbreviation: ICAIE 2023\r\xe2\x98\x85 Website: http://www.icaie.org/\r\xe2\x98\x85 Date: March 16-18, 2023\r\xe2\x98\x85 Held in: Chongqing, China\r ICAIE 2023, 2023 3rd International Conference on Artificial Intelligence in Education, will be held in Chongqing, China during March 16-18, 2023. It's the third year of ICAIE conference, but it will witness the development of the field in artificial intelligence in education. ICAIE will keep working on itself as an event whose aim is to provide this chance and platform for the researchers from academia, industry, and government institutions to exchange and present the novel research on artificial intelligence in education.\r The conference is an annual event held every year to make it an ideal platform for people to share views and experiences in artificial intelligence in education and related areas. The primary goal of the conference is to promote research and developmental activities in artificial intelligence in education and another goal is to promote scientific information interchange between researchers, developers, engineers, students, and practitioners working all around the world.\r - Call for Papers - For more topics, please visit at: http://www.icaie.org/cfp.html\rTopics of interest for submission include, but are not limited to:\r- Basic theory and applied technology of artificial intelligence\rMachine Learning Processing\rMachine Perception and Virtual Reality\rNatural Language Processing and Understanding\rNeural Network and Deep Learning\r - Artificial intelligence and education\rArtificial intelligence algorithms in education\rArtificial neural networks in education\rEducational robotics\rKnowledge Science and Knowledge Engineering\r - Publication -\rSubmitted papers will be peer-reviewed by the technical program committees. Accepted and presented papers in ICAIE 2023 will be published in the Conference Proceedings, which will be indexed by Ei Compendex and Scopus.\r  - Submission -\r1. The official language is English. The submitted paper should be no less than 4 full pages and prepared carefully according to the conference template.\r2. Abstract submission is acceptable but it will be accepted for presentation only.\r * Welcome to submit the paper or abstract by Electronic Submission System:\rhttps://www.zmeeting.org/submission/icaie2023\rMore details about submission, please visit at http://www.icaie.org/sub.html\r - Conference Program -\rMarch 16, 2023 | Sign in and Collect Conference Materials & Online Zoom Test\rMarch 17, 2023 | Opening Ceremony & Keynote Speech & Parallel Sessions\rMarch 18, 2023 | Online Parallel Sessions\r - Contact -\rConference Secretary: Ms. Sylvia\rEmail: icaie_conf@163.com\rTel: +86-180 3055 9376\r \n""","b'<div align=""left"" class=""cfp"">\n<table align=""center"" cellpadding=""0"" cellspacing=""0px"" width=""100%"">\n<tr valign=""top"">\n<td>\n<table align=""center"" cellpadding=""4"" cellspacing=""3"" width=""100%"">\n<tr><td>\n<a href=""/cfp/servlet/event.showcfp?eventid=149593"">MDPI-SI on DT &amp; FIE in Ed--Scopus,JCI 2023</a>\xc2\xa0\xc2\xa0\nMDPI Education Sciences Journal - Special Issue on Digital Twins and Future Intelligent Educational Environments\n</td></tr>\n<tr><td>\n<a href=""/cfp/servlet/event.showcfp?eventid=166563"">ACM ICHMI 2023</a>\xc2\xa0\xc2\xa0\nACM--2023 3rd International Conference on Human\xe2\x80\x93Machine Interaction (ICHMI 2023)\n</td></tr>\n<tr><td>\n<a href=""/cfp/servlet/event.showcfp?eventid=137130"">MLDM 2023</a>\xc2\xa0\xc2\xa0\n18th International Conference on Machine Learning and Data Mining\n</td></tr>\n<tr><td>\n<a href=""/cfp/servlet/event.showcfp?eventid=166560"">IEEE CCAI 2023</a>\xc2\xa0\xc2\xa0\nIEEE--2023 3rd International Conference on Computer Communication and Artificial Intelligence (CCAI 2023)\n</td></tr>\n<tr><td>\n<a href=""/cfp/servlet/event.showcfp?eventid=166561"">CCAI 2023</a>\xc2\xa0\xc2\xa0\nIEEE--2023 3rd International Conference on Computer Communication and Artificial Intelligence (CCAI 2023)\n</td></tr>\n<tr><td>\n<a href=""/cfp/servlet/event.showcfp?eventid=146828"">NLPTA 2022</a>\xc2\xa0\xc2\xa0\n3rd International Conference on NLP Techniques and Applications\n</td></tr>\n<tr><td>\n<a href=""/cfp/servlet/event.showcfp?eventid=155978"">IEEE ICA 2022</a>\xc2\xa0\xc2\xa0\nThe 6th IEEE International Conference on Agents\n</td></tr>\n</table>\n</td>\n</tr>\n</table>\n</div>'"
b'http://www.wikicfp.com/cfp/servlet/event.showcfp?eventid=163561',b'ICAIE--Ei 2023',b'2023 3rd International Conference on Artificial Intelligence in Education (ICAIE 2023)',b'http://www.icaie.org/',b'2023-03-16T00:00:00',b'2023-03-18T23:59:59',"b'Chongqing, China'","b'Nov 1, 2022'",,,b'intelligent systems' b'computer engineering' b'computational intelligence' b'e-education' ,"b""\nICAIE2023-2023 3rd International Conference on Artificial Intelligence in Education-Ei Compendex and Scopus\r \xe2\x98\x85 Full name: 2023 3rd International Conference on Artificial Intelligence in Education (ICAIE 2023)\r\xe2\x98\x85 Abbreviation: ICAIE 2023\r\xe2\x98\x85 Website: http://www.icaie.org/\r\xe2\x98\x85 Date: March 16-18, 2023\r\xe2\x98\x85 Held in: Chongqing, China\r ICAIE 2023, 2023 3rd International Conference on Artificial Intelligence in Education, will be held in Chongqing, China during March 16-18, 2023. It's the third year of ICAIE conference, but it will witness the development of the field in artificial intelligence in education. ICAIE will keep working on itself as an event whose aim is to provide this chance and platform for the researchers from academia, industry, and government institutions to exchange and present the novel research on artificial intelligence in education.\r The conference is an annual event held every year to make it an ideal platform for people to share views and experiences in artificial intelligence in education and related areas. The primary goal of the conference is to promote research and developmental activities in artificial intelligence in education and another goal is to promote scientific information interchange between researchers, developers, engineers, students, and practitioners working all around the world.\r - Call for Papers - For more topics, please visit at: http://www.icaie.org/cfp.html\rTopics of interest for submission include, but are not limited to:\r- Basic theory and applied technology of artificial intelligence\rMachine Learning Processing\rMachine Perception and Virtual Reality\rNatural Language Processing and Understanding\rNeural Network and Deep Learning\r - Artificial intelligence and education\rArtificial intelligence algorithms in education\rArtificial neural networks in education\rEducational robotics\rKnowledge Science and Knowledge Engineering\r - Publication -\rSubmitted papers will be peer-reviewed by the technical program committees. Accepted and presented papers in ICAIE 2023 will be published in the Conference Proceedings, which will be indexed by Ei Compendex and Scopus.\r  - Submission -\r1. The official language is English. The submitted paper should be no less than 4 full pages and prepared carefully according to the conference template.\r2. Abstract submission is acceptable but it will be accepted for presentation only.\r * Welcome to submit the paper or abstract by Electronic Submission System:\rhttps://www.zmeeting.org/submission/icaie2023\rMore details about submission, please visit at http://www.icaie.org/sub.html\r - Conference Program -\rMarch 16, 2023 | Sign in and Collect Conference Materials & Online Zoom Test\rMarch 17, 2023 | Opening Ceremony & Keynote Speech & Parallel Sessions\rMarch 18, 2023 | Online Parallel Sessions\r - Contact -\rConference Secretary: Ms. Sylvia\rEmail: icaie_conf@163.com\rTel: +86-180 3055 9376\r \n""","b'<div align=""left"" class=""cfp"">\n<table align=""center"" cellpadding=""0"" cellspacing=""0px"" width=""100%"">\n<tr valign=""top"">\n<td>\n<table align=""center"" cellpadding=""4"" cellspacing=""3"" width=""100%"">\n<tr><td>\n<a href=""/cfp/servlet/event.showcfp?eventid=149593"">MDPI-SI on DT &amp; FIE in Ed--Scopus,JCI 2023</a>\xc2\xa0\xc2\xa0\nMDPI Education Sciences Journal - Special Issue on Digital Twins and Future Intelligent Educational Environments\n</td></tr>\n<tr><td>\n<a href=""/cfp/servlet/event.showcfp?eventid=115414"">ACM-EI/Scopus-ACAI 2022</a>\xc2\xa0\xc2\xa0\n2022 5th International Conference on Algorithms, Computing and Artificial Intelligence (ACAI 2022)-EI Compendex\n</td></tr>\n<tr><td>\n<a href=""/cfp/servlet/event.showcfp?eventid=166563"">ACM ICHMI 2023</a>\xc2\xa0\xc2\xa0\nACM--2023 3rd International Conference on Human\xe2\x80\x93Machine Interaction (ICHMI 2023)\n</td></tr>\n<tr><td>\n<a href=""/cfp/servlet/event.showcfp?eventid=161160"">ICMLT 2023</a>\xc2\xa0\xc2\xa0\n2023 8th International Conference on Machine Learning Technologies (ICMLT 2023)\n</td></tr>\n<tr><td>\n<a href=""/cfp/servlet/event.showcfp?eventid=166560"">IEEE CCAI 2023</a>\xc2\xa0\xc2\xa0\nIEEE--2023 3rd International Conference on Computer Communication and Artificial Intelligence (CCAI 2023)\n</td></tr>\n<tr><td>\n<a href=""/cfp/servlet/event.showcfp?eventid=149128"">IJCSA 2022</a>\xc2\xa0\xc2\xa0\nInternational Journal on Computational Science &amp; Applications\n</td></tr>\n<tr><td>\n<a href=""/cfp/servlet/event.showcfp?eventid=166561"">CCAI 2023</a>\xc2\xa0\xc2\xa0\nIEEE--2023 3rd International Conference on Computer Communication and Artificial Intelligence (CCAI 2023)\n</td></tr>\n<tr><td>\n<a href=""/cfp/servlet/event.showcfp?eventid=151700"">IJCI 2022</a>\xc2\xa0\xc2\xa0\nInternational Journal on Cybernetics &amp; Informatics\n</td></tr>\n<tr><td>\n<a href=""/cfp/servlet/event.showcfp?eventid=166554"">AIRC--EI 2023</a>\xc2\xa0\xc2\xa0\n2023 the 4th International Conference on Artificial Intelligence, Robotics and Control (AIRC 2023)\n</td></tr>\n<tr><td>\n<a href=""/cfp/servlet/event.showcfp?eventid=166556"">ICMAS--EI 2023</a>\xc2\xa0\xc2\xa0\n2023 the 4th International Conference on Mechanical and Aerospace Systems (ICMAS 2023)\n</td></tr>\n</table>\n</td>\n</tr>\n</table>\n</div>'"
b'http://www.wikicfp.com/cfp/servlet/event.showcfp?eventid=163562',b'ICEIT 2023',b'2023 12th International Conference on Educational and Information Technology (ICEIT 2023)',b'http://www.iceit.org/',b'2023-03-16T00:00:00',b'2023-03-18T23:59:59',"b'Chongqing, China'","b'Nov 1, 2022'",,,b'information technology' b'education' b'e-learning ' b'machine learning' ,"b'\n*ICEIT 2023 \xe2\x80\x94 2023 12th International Conference on Educational and Information Technology | Ei Compendex and Scopus\r \xe2\x98\x85Full name:  2023 12th International Conference on Educational and Information Technology (ICEIT 2023)\r\xe2\x98\x85Short name: ICEIT 2023\r\xe2\x98\x85Website\xef\xbc\x9ahttp://www.iceit.org/\r\xe2\x98\x85Time\xef\xbc\x9aMarch 16-18, 2023\r\xe2\x98\x85Place\xef\xbc\x9aChongqing, China\r We are glad to announce that the 2023 12th International Conference on Educational and Information Technology (ICEIT 2023) which will be held March 16-18, 2023 in Chongqing, China. \r Following the successes of the previous ICEIT conferences in Toronto of Canada, Florence of Italy, Paris of France, University of Cambridge, and University of Oxford of UK. We invite authors to submit original research papers and original work-in-progress reports on educational and information technology.\r ICEIT will have a special focus on educational and information technology, and seeks to address multidisciplinary challenges. The event includes Oral Presentation, Poster Presentation and Workshop (A meeting at which a group of people engage in intensive discussion and activity on a particular subject or project.), keynote talk given by experts on state-of-the-art topics, and invited speech, with the aim of complementing the regular program with emerging topics of particular interest to the educational and information technology.\r  \xe2\x98\x85Call for paper\xe2\x98\x85 For details about topics, please visit at http://www.iceit.org/cfp.html \r - Computer Engineering and Information Technology\r\xe2\x80\xa2 Artificial Intelligence in Education\r\xe2\x80\xa2 Computer Application\r\xe2\x80\xa2 Database Technology\r\xe2\x80\xa2 Digital Libraries\r - Educational Models and Methods\r\xe2\x80\xa2 Active learning\r\xe2\x80\xa2 Blend learning\r\xe2\x80\xa2 Collaborative Learning\r\xe2\x80\xa2 Community Building\r - Inclusive Learning\r\xe2\x80\xa2 Accessibility to Disabled Users\r\xe2\x80\xa2 Assistive Technologies\r\xe2\x80\xa2 Behavioral Problems\r\xe2\x80\xa2 ICT and Dyslexic Students\r \xe2\x98\x85 Publication\rAll accepted papers must be written in English and will be published into ICEIT 2023 Conference Proceedings. The Conference content will be submitted for inclusion into Online Xplore and indexed by Ei Compendex and Scopus.\r Excellent papers will be selected and recommended to the SCI journals:\r1. International Journal of Computers Communications & Control\r2. Internationl Journal of Simulation Modelling\r \xe2\x98\x85Submission\xe2\x98\x85\rA. Full Paper (for Presentation and Publication) \rAccepted full paper will be invited to give the oral presentation at the conference and be publsihed into conference proceedings.\r B. Abstract (Presentation only)\rAccepted abstract will be invited to give the oral presentation at the conference, the presentation will not be published.\r For submission, please upload it to the Electronic Submission System (.pdf) :\rhttps://www.easychair.org/conferences/?conf=iceit2023 \rFull paper template: http://www.iceit.org/instruct8.5x11x2.doc \rOfficial language is English in paper writing and presenting. Full paper should be at least full 4 pages and at most 12 pages under the format.\r More detail about submission, please visit at http://www.iceit.org/sub.html\r \xe2\x98\x85\xe2\x98\x85Conference Schedule\xe2\x98\x85\xe2\x98\x85\rDay 1, March 16, 2023 - 10:00 \xe2\x80\x93 17:00: Registration,collecting conference materials \rDay 2, March 17, 2023 - 09:00 \xe2\x80\x93 18:00: Opening Remark & Keynote Speeches & Parallel Sessions\rDay 3, March 18, 2023 - 09:00 \xe2\x80\x93 17:00: Parallel Sessions\r \xe2\x98\x85\xe2\x98\x85Conference Venue\xe2\x98\x85\xe2\x98\x85\rChongqing is the largest municipality in southwest China. It is a modern port city on the upper reaches of the Yangtze River at the confluence of the Yangtze and Jialing Rivers. Chongqing is famous for its hot Sichuan cuisine and world-famous hot pot. Various brands of hot pot restaurants can be found throughout the city. The food is delicious even in very small restaurants. Street vendors as well as restaurants feature exciting spicy delicacies for the gourmets. Bayi Food Street in the city center is the best place to taste the spicy local snacks.\r \xe2\x98\x85\xe2\x98\x85Contact:\rMs. Gretchen Liu (Conference Secretary)\rE-mail: iceit_conf@outlook.com\r\n'","b'<div align=""left"" class=""cfp"">\n<table align=""center"" cellpadding=""0"" cellspacing=""0px"" width=""100%"">\n<tr valign=""top"">\n<td>\n<table align=""center"" cellpadding=""4"" cellspacing=""3"" width=""100%"">\n<tr><td>\n<a href=""/cfp/servlet/event.showcfp?eventid=137130"">MLDM 2023</a>\xc2\xa0\xc2\xa0\n18th International Conference on Machine Learning and Data Mining\n</td></tr>\n<tr><td>\n<a href=""/cfp/servlet/event.showcfp?eventid=163563"">ICEIT--Ei 2023</a>\xc2\xa0\xc2\xa0\n2023 12th International Conference on Educational and Information Technology (ICEIT 2023)\n</td></tr>\n<tr><td>\n<a href=""/cfp/servlet/event.showcfp?eventid=152256"">IJCNN 2023</a>\xc2\xa0\xc2\xa0\nInternational Joint Conference on Neural Networks\n</td></tr>\n<tr><td>\n<a href=""/cfp/servlet/event.showcfp?eventid=166806"">ACBT--EI 2023</a>\xc2\xa0\xc2\xa0\n2023 Asia Conference on Blockchain Technologies (ACBT 2023)\n</td></tr>\n<tr><td>\n<a href=""/cfp/servlet/event.showcfp?eventid=166808"">ITIOT 2023</a>\xc2\xa0\xc2\xa0\n2023 8th International Conference on Information Technology and Internet of Things (ITIOT 2023)\n</td></tr>\n</table>\n</td>\n</tr>\n</table>\n</div>'"
