identifier,title,description,source,startDate,endDate,locality,Submission Deadline,Notification Due,Final Version Due,Categories,Call For Papers,Related Resources
b'http://www.wikicfp.com/cfp/servlet/event.showcfp?eventid=163512',b'ICBDA 2023',b'IEEE--2023 the 8th International Conference on Big Data Analytics (ICBDA 2023)',b'http://www.icbda.org',b'2023-03-03T00:00:00',b'2023-03-05T23:59:59',"b'Harbin, China'","b'Oct 20, 2022'",,,b'big data' b'information technology' b'cloud computing' b'blockchain' ,"b""\n\xe2\x98\x85Full Name: IEEE--2023 the 8th International Conference on Big Data Analytics (ICBDA 2023)\r\xe2\x98\x85Abbreviation: ICBDA 2023\r\xe2\x98\x85Dates: March 3-5, 2023 \r\xe2\x98\x85Place: Harbin, China\r\xe2\x98\x85Website: http://www.icbda.org\r \xe2\x98\x85Co-Sponsored by: Research Institute of Big Data Analytics, Xi'an Jiaotong-Liverpool University, China and Harbin Institute of Technology, China.\r \xe2\x98\x85Publication: IEEE Conference Proceeding, indexed by EI compendex and Scopus.\r   ICBDA2022 - IEEE | ISBN: 978-1-6654-7937-0 \r  ICBDA2021 - IEEE | ISBN: 978-0-7381-3166-5 | IEEE Xplore | Ei-Compendex & Scopus\r  ICBDA2020 - IEEE | ISBN: 978-1-7281-6077-1 | IEEE Xplore | Ei-Compendex & Scopus & CPCI-S\r  ICBDA2019 - IEEE | ISBN: 978-1-7281-1282-4 | IEEE Xplore | Ei-Compendex & Scopus & CPCI-S\r  ICBDA2018 - IEEE | ISBN: 978-1-5386-4793-6 | IEEE Xplore | Ei-Compendex & Scopus\r  ICBDA2017 - IEEE | ISBN: 978-1-5090-3618-9 | IEEE Xplore | Ei-Compendex & Scopus & CPCI-S\r  ICBDA2016 - IEEE | ISBN: 978-1-4673-9590-8 | IEEE Xplore | Ei-Compendex & Scopus & CPCI-S\r  (Kindly find more publication information on http://www.icbda.org/html/publication.html)\r \xe2\x98\x85Submission Methods&Deadline: \r1. Conference system: https://easychair.org/conferences/?conf=icbda2023 ( .pdf only);\r2. Email Submission: submit full paper or abstract to: icbda2016@vip.163.com;\r \xe2\x98\x85Submission Core Topics:\r  Big Data Models and Algorithms\r  Big Data Architectures\r  Big Data Management\r  Big Data Protection, Integrity and Privacy\r  Security Applications of Big Data\r  Big Data Search and Mining\r  Big Data for Enterprise, Government and Society\r  Blockchain\r  (Looking for more topics, please visit at http://www.icbda.org/html/cfp.html)\r \xe2\x98\x85ICBDA Awards\r   Young Scientist Awards---Selected by the TPC during the conference\r  For doctors within the age of 40 by March 03, 2023  \r  Award Application Deadline: February 01, 2023\r   Best Student Paper Award---Selected by the Program Committees during the conference\r  For university students only and should be the first author then do the oral presentation during the conference.\r   Best Oral Presentation Award---Selected by the Session Chair during the conference\r \xe2\x98\x85Contact Us\r  Conference Secretary: Ms. Greta Shen\r  Tel: +86-15928616367\r  Email: icbda2016@vip.163.com\r  Wechat: iconf-cs\n\t""","b'<div align=""left"" class=""cfp"">\n<table align=""center"" cellpadding=""0"" cellspacing=""0px"" width=""100%"">\n<tr valign=""top"">\n<td>\n<table align=""center"" cellpadding=""4"" cellspacing=""3"" width=""100%"">\n<tr><td>\n<a href=""/cfp/servlet/event.showcfp?eventid=163498"">IEEE ICCCBDA 2023</a>\xc2\xa0\xc2\xa0\nIEEE--2023 the 8th International Conference on Cloud Computing and Big Data Analytics (ICCCBDA 2023)\n</td></tr>\n<tr><td>\n<a href=""/cfp/servlet/event.showcfp?eventid=163497"">ICCCBDA 2023</a>\xc2\xa0\xc2\xa0\nIEEE--2023 the 8th International Conference on Cloud Computing and Big Data Analytics (ICCCBDA 2023)\n</td></tr>\n<tr><td>\n<a href=""/cfp/servlet/event.showcfp?eventid=152340"">IEEE SSCI 2023</a>\xc2\xa0\xc2\xa0\n2023 IEEE Symposium Series on Computational Intelligence\n</td></tr>\n<tr><td>\n<a href=""/cfp/servlet/event.showcfp?eventid=115414"">ACM-EI/Scopus-ACAI 2022</a>\xc2\xa0\xc2\xa0\n2022 5th International Conference on Algorithms, Computing and Artificial Intelligence (ACAI 2022)-EI Compendex\n</td></tr>\n<tr><td>\n<a href=""/cfp/servlet/event.showcfp?eventid=163513"">IEEE ICBDA 2023</a>\xc2\xa0\xc2\xa0\nIEEE--2023 the 8th International Conference on Big Data Analytics (ICBDA 2023)\n</td></tr>\n<tr><td>\n<a href=""/cfp/servlet/event.showcfp?eventid=166548"">ICCSN 2023</a>\xc2\xa0\xc2\xa0\nIEEE--2023 15th International Conference on Communication Software and Networks (ICCSN 2023)\n</td></tr>\n<tr><td>\n<a href=""/cfp/servlet/event.showcfp?eventid=149128"">IJCSA 2022</a>\xc2\xa0\xc2\xa0\nInternational Journal on Computational Science &amp; Applications\n</td></tr>\n</table>\n</td>\n</tr>\n</table>\n</div>'"
b'http://www.wikicfp.com/cfp/servlet/event.showcfp?eventid=163513',b'IEEE ICBDA 2023',b'IEEE--2023 the 8th International Conference on Big Data Analytics (ICBDA 2023)',b'http://www.icbda.org',b'2023-03-03T00:00:00',b'2023-03-05T23:59:59',"b'Harbin, China'","b'Oct 20, 2022'",,,b'internet of things' b'internet' b'information science' b'information management' ,"b""\n\xe2\x98\x85Full Name: IEEE--2023 the 8th International Conference on Big Data Analytics (ICBDA 2023)\r\xe2\x98\x85Abbreviation: ICBDA 2023\r\xe2\x98\x85Dates: March 3-5, 2023 \r\xe2\x98\x85Place: Harbin, China\r\xe2\x98\x85Website: http://www.icbda.org\r \xe2\x98\x85Co-Sponsored by: Research Institute of Big Data Analytics, Xi'an Jiaotong-Liverpool University, China and Harbin Institute of Technology, China.\r \xe2\x98\x85Publication: IEEE Conference Proceeding, indexed by EI compendex and Scopus.\r   ICBDA2022 - IEEE | ISBN: 978-1-6654-7937-0 \r  ICBDA2021 - IEEE | ISBN: 978-0-7381-3166-5 | IEEE Xplore | Ei-Compendex & Scopus\r  ICBDA2020 - IEEE | ISBN: 978-1-7281-6077-1 | IEEE Xplore | Ei-Compendex & Scopus & CPCI-S\r  ICBDA2019 - IEEE | ISBN: 978-1-7281-1282-4 | IEEE Xplore | Ei-Compendex & Scopus & CPCI-S\r  ICBDA2018 - IEEE | ISBN: 978-1-5386-4793-6 | IEEE Xplore | Ei-Compendex & Scopus\r  ICBDA2017 - IEEE | ISBN: 978-1-5090-3618-9 | IEEE Xplore | Ei-Compendex & Scopus & CPCI-S\r  ICBDA2016 - IEEE | ISBN: 978-1-4673-9590-8 | IEEE Xplore | Ei-Compendex & Scopus & CPCI-S\r  (Kindly find more publication information on http://www.icbda.org/html/publication.html)\r \xe2\x98\x85Submission Methods&Deadline: \r1. Conference system: https://easychair.org/conferences/?conf=icbda2023 ( .pdf only);\r2. Email Submission: submit full paper or abstract to: icbda2016@vip.163.com;\r \xe2\x98\x85Submission Core Topics:\r  Big Data Models and Algorithms\r  Big Data Architectures\r  Big Data Management\r  Big Data Protection, Integrity and Privacy\r  Security Applications of Big Data\r  Big Data Search and Mining\r  Big Data for Enterprise, Government and Society\r  Blockchain\r  (Looking for more topics, please visit at http://www.icbda.org/html/cfp.html)\r \xe2\x98\x85ICBDA Awards\r   Young Scientist Awards---Selected by the TPC during the conference\r  For doctors within the age of 40 by March 03, 2023  \r  Award Application Deadline: February 01, 2023\r   Best Student Paper Award---Selected by the Program Committees during the conference\r  For university students only and should be the first author then do the oral presentation during the conference.\r   Best Oral Presentation Award---Selected by the Session Chair during the conference\r \xe2\x98\x85Contact Us\r  Conference Secretary: Ms. Greta Shen\r  Tel: +86-15928616367\r  Email: icbda2016@vip.163.com\r  Wechat: iconf-cs\n\t""","b'<div align=""left"" class=""cfp"">\n<table align=""center"" cellpadding=""0"" cellspacing=""0px"" width=""100%"">\n<tr valign=""top"">\n<td>\n<table align=""center"" cellpadding=""4"" cellspacing=""3"" width=""100%"">\n<tr><td>\n<a href=""/cfp/servlet/event.showcfp?eventid=163498"">IEEE ICCCBDA 2023</a>\xc2\xa0\xc2\xa0\nIEEE--2023 the 8th International Conference on Cloud Computing and Big Data Analytics (ICCCBDA 2023)\n</td></tr>\n<tr><td>\n<a href=""/cfp/servlet/event.showcfp?eventid=115414"">ACM-EI/Scopus-ACAI 2022</a>\xc2\xa0\xc2\xa0\n2022 5th International Conference on Algorithms, Computing and Artificial Intelligence (ACAI 2022)-EI Compendex\n</td></tr>\n<tr><td>\n<a href=""/cfp/servlet/event.showcfp?eventid=163497"">ICCCBDA 2023</a>\xc2\xa0\xc2\xa0\nIEEE--2023 the 8th International Conference on Cloud Computing and Big Data Analytics (ICCCBDA 2023)\n</td></tr>\n<tr><td>\n<a href=""/cfp/servlet/event.showcfp?eventid=155751"">InWeS 2022</a>\xc2\xa0\xc2\xa0\n13th International Conference on Internet Engineering &amp; Web Services\n</td></tr>\n<tr><td>\n<a href=""/cfp/servlet/event.showcfp?eventid=152340"">IEEE SSCI 2023</a>\xc2\xa0\xc2\xa0\n2023 IEEE Symposium Series on Computational Intelligence\n</td></tr>\n<tr><td>\n<a href=""/cfp/servlet/event.showcfp?eventid=116286"">IEEE-Ei/Scopus-CISDS 2022</a>\xc2\xa0\xc2\xa0\n2022 International Conference on Frontiers of Communications, Information System and Data Science (CISDS 2022)-EI Compendex\n</td></tr>\n<tr><td>\n<a href=""/cfp/servlet/event.showcfp?eventid=166548"">ICCSN 2023</a>\xc2\xa0\xc2\xa0\nIEEE--2023 15th International Conference on Communication Software and Networks (ICCSN 2023)\n</td></tr>\n<tr><td>\n<a href=""/cfp/servlet/event.showcfp?eventid=146984"">EEIEJ 2022</a>\xc2\xa0\xc2\xa0\nEmerging Trends in Electrical, Electronics &amp; Instrumentation Engineering: An international Journal\n</td></tr>\n<tr><td>\n<a href=""/cfp/servlet/event.showcfp?eventid=166240"">IEEE ICAIBD 2023</a>\xc2\xa0\xc2\xa0\n2023 IEEE The 6th International Conference on Artificial Intelligence and Big Data (ICAIBD 2023)\n</td></tr>\n<tr><td>\n<a href=""/cfp/servlet/event.showcfp?eventid=150019"">EEIJ 2022</a>\xc2\xa0\xc2\xa0\nElectrical Engineering: An International Journal \n</td></tr>\n</table>\n</td>\n</tr>\n</table>\n</div>'"
b'http://www.wikicfp.com/cfp/servlet/event.showcfp?eventid=163514',b'ICIAI--Ei 2023',b'2023 the 7th International Conference on Innovation in Artificial Intelligence (ICIAI 2023)',b'http://www.iciai.org',b'2023-03-03T00:00:00',b'2023-03-05T23:59:59',"b'Harbin, China'","b'Oct 20, 2022'",,,b'artificial intelligence' b'computer science' b'computing' b'software engineering' ,"b'\nFull Name: 2023 the 7th International Conference on Innovation in Artificial Intelligence (ICIAI 2023)\rAbbreviation: ICIAI 2023\rHarbin, China\rMarch 3-5, 2023\r Official Website: http://www.iciai.org\r  The 7th International Conference on Innovation in Artificial Intelligence will be held in Harbin, China during March 3-5, 2023. The aim of ICIAI2023 is to present the latest research and results of scientists related to Innovation in Artificial Intelligence topics. This conference provides opportunities for the different areas delegates to exchange new ideas and application experiences face to face, to establish business or research relations and to find global partners for future collaboration. We hope that the conference results constituted significant contribution to the knowledge in these up to date scientific field. We sincerely welcome the submissions all over the world.\r Previous ICIAI:\rICIAI 2017 was successfully held in Singapore.\rPapers of ICIAI2017 are indexed by Ei Compendex and Scopus !\r ICIAI 2018 was successfully held in Shanghai, China .\rPapers of ICIAI2018 were published by ACM and proceedings of ICIAI2018 is already indexed successfully! \rICIAI2018-ACM, ISBN: 978-1-4503-6345-7\r ICIAI2019 was successfully held in Suzhou, China.\rPapers of ICIAI2019 were published by ACM and proceedings of ICIAI2019 is already indexed successfully! \rICIAI2019-ACM, ISBN: 978-1-4503-6128-6\r ICIAI2020 was successfully held in Xiamen, China in Virtual Form.\rPapers of ICIAI2020 were published by ACM and proceedings of ICIAI2020 is already indexed successfully! \rICIAI2020-ACM, ISBN: 978-1-4503-7658-7\r ICIAI2021 was successfully held in Xiamen, China in Virtual Form.\rPapers of ICIAI2021 were published by ACM and proceedings of ICIAI2021 is already indexed successfully! \rICIAI2021-ACM, ISBN:  978-1-4503-8863-4\r ICIAI2022 was successfully held in Guangzhou, China in Virtual Form.\rPapers of ICIAI2022 were published by ACM and proceedings of ICIAI2022 will be online soon! \rICIAI2022-ACM, ISBN:  978-1-4503-9550-2\r  All the registered and presented papers will be published in Conference Proceedings ; Conference content will be submitted for inclusion into Ei Compendex and Scopus.\r Submissions Methods:\rMuch attention should be paid to write your paper according to the publication\'s request and submit the paper at: iciai2018@vip.163.com\rOR you could log in Iconf.org and submit the paper, linkage could be seen on website: WWW.ICIAI.ORG\r  Conference Schedule: (The actual arrangement shall follow the program)\r March 3, 2023\t09:00-16:00  \tRegistration, collecting conference materials\rMarch 4, 2023 \t09:00-12:00               Opening Remarks & Keynote Speeches \r                                13:30-18:00 \tParallel Sessions \rMarch 5, 2023\t10:00-16:00\tVisit / Tour \r   For any inquiry about the conference, please feel free to contact:\r Ms. Ashley Liu\r Email: iciai2018@vip.163.com\r Hotline: +86-139-8089-4300\r WeChat: iconf-ras (Please leave message ""ICIAI2023"")\r\n'","b'<div align=""left"" class=""cfp"">\n<table align=""center"" cellpadding=""0"" cellspacing=""0px"" width=""100%"">\n<tr valign=""top"">\n<td>\n<table align=""center"" cellpadding=""4"" cellspacing=""3"" width=""100%"">\n<tr><td>\n<a href=""/cfp/servlet/event.showcfp?eventid=166554"">AIRC--EI 2023</a>\xc2\xa0\xc2\xa0\n2023 the 4th International Conference on Artificial Intelligence, Robotics and Control (AIRC 2023)\n</td></tr>\n<tr><td>\n<a href=""/cfp/servlet/event.showcfp?eventid=166556"">ICMAS--EI 2023</a>\xc2\xa0\xc2\xa0\n2023 the 4th International Conference on Mechanical and Aerospace Systems (ICMAS 2023)\n</td></tr>\n<tr><td>\n<a href=""/cfp/servlet/event.showcfp?eventid=167437"">ISDEA--Ei 2023</a>\xc2\xa0\xc2\xa0\n2023 2nd International Conference on Intelligent Systems Design and Engineering Applications (ISDEA 2023)\n</td></tr>\n<tr><td>\n<a href=""/cfp/servlet/event.showcfp?eventid=155978"">IEEE ICA 2022</a>\xc2\xa0\xc2\xa0\nThe 6th IEEE International Conference on Agents\n</td></tr>\n<tr><td>\n<a href=""/cfp/servlet/event.showcfp?eventid=115414"">ACM-EI/Scopus-ACAI 2022</a>\xc2\xa0\xc2\xa0\n2022 5th International Conference on Algorithms, Computing and Artificial Intelligence (ACAI 2022)-EI Compendex\n</td></tr>\n</table>\n</td>\n</tr>\n</table>\n</div>'"
b'http://www.wikicfp.com/cfp/servlet/event.showcfp?eventid=163515',b'ICIAI 2023',b'2023 the 7th International Conference on Innovation in Artificial Intelligence (ICIAI 2023)',b'http://www.iciai.org',b'2023-03-03T00:00:00',b'2023-03-05T23:59:59',"b'Harbin, China'","b'Oct 20, 2022'",,,b'intelligent systems' b'robotics' b'automation' b'control' ,"b'\nFull Name: 2023 the 7th International Conference on Innovation in Artificial Intelligence (ICIAI 2023)\rAbbreviation: ICIAI 2023\rHarbin, China\rMarch 3-5, 2023\r Official Website: http://www.iciai.org\r  The 7th International Conference on Innovation in Artificial Intelligence will be held in Harbin, China during March 3-5, 2023. The aim of ICIAI2023 is to present the latest research and results of scientists related to Innovation in Artificial Intelligence topics. This conference provides opportunities for the different areas delegates to exchange new ideas and application experiences face to face, to establish business or research relations and to find global partners for future collaboration. We hope that the conference results constituted significant contribution to the knowledge in these up to date scientific field. We sincerely welcome the submissions all over the world.\r Previous ICIAI:\rICIAI 2017 was successfully held in Singapore.\rPapers of ICIAI2017 are indexed by Ei Compendex and Scopus !\r ICIAI 2018 was successfully held in Shanghai, China .\rPapers of ICIAI2018 were published by ACM and proceedings of ICIAI2018 is already indexed successfully! \rICIAI2018-ACM, ISBN: 978-1-4503-6345-7\r ICIAI2019 was successfully held in Suzhou, China.\rPapers of ICIAI2019 were published by ACM and proceedings of ICIAI2019 is already indexed successfully! \rICIAI2019-ACM, ISBN: 978-1-4503-6128-6\r ICIAI2020 was successfully held in Xiamen, China in Virtual Form.\rPapers of ICIAI2020 were published by ACM and proceedings of ICIAI2020 is already indexed successfully! \rICIAI2020-ACM, ISBN: 978-1-4503-7658-7\r ICIAI2021 was successfully held in Xiamen, China in Virtual Form.\rPapers of ICIAI2021 were published by ACM and proceedings of ICIAI2021 is already indexed successfully! \rICIAI2021-ACM, ISBN:  978-1-4503-8863-4\r ICIAI2022 was successfully held in Guangzhou, China in Virtual Form.\rPapers of ICIAI2022 were published by ACM and proceedings of ICIAI2022 will be online soon! \rICIAI2022-ACM, ISBN:  978-1-4503-9550-2\r  All the registered and presented papers will be published in Conference Proceedings ; Conference content will be submitted for inclusion into Ei Compendex and Scopus.\r Submissions Methods:\rMuch attention should be paid to write your paper according to the publication\'s request and submit the paper at: iciai2018@vip.163.com\rOR you could log in Iconf.org and submit the paper, linkage could be seen on website: WWW.ICIAI.ORG\r  Conference Schedule: (The actual arrangement shall follow the program)\r March 3, 2023\t09:00-16:00  \tRegistration, collecting conference materials\rMarch 4, 2023 \t09:00-12:00               Opening Remarks & Keynote Speeches \r                                13:30-18:00 \tParallel Sessions \rMarch 5, 2023\t10:00-16:00\tVisit / Tour \r   For any inquiry about the conference, please feel free to contact:\r Ms. Ashley Liu\r Email: iciai2018@vip.163.com\r Hotline: +86-139-8089-4300\r WeChat: iconf-ras (Please leave message ""ICIAI2023"")\r\n'","b'<div align=""left"" class=""cfp"">\n<table align=""center"" cellpadding=""0"" cellspacing=""0px"" width=""100%"">\n<tr valign=""top"">\n<td>\n<table align=""center"" cellpadding=""4"" cellspacing=""3"" width=""100%"">\n<tr><td>\n<a href=""/cfp/servlet/event.showcfp?eventid=155978"">IEEE ICA 2022</a>\xc2\xa0\xc2\xa0\nThe 6th IEEE International Conference on Agents\n</td></tr>\n<tr><td>\n<a href=""/cfp/servlet/event.showcfp?eventid=163514"">ICIAI--Ei 2023</a>\xc2\xa0\xc2\xa0\n2023 the 7th International Conference on Innovation in Artificial Intelligence (ICIAI 2023)\n</td></tr>\n<tr><td>\n<a href=""/cfp/servlet/event.showcfp?eventid=164468"">AI-DH 2022</a>\xc2\xa0\xc2\xa0\nMDPI Big Data and Cognitive Computing - Special Issue on Artificial Intelligence in Digital Humanities\n</td></tr>\n<tr><td>\n<a href=""/cfp/servlet/event.showcfp?eventid=166046"">FLAIRS-36</a>\xc2\xa0\xc2\xa0\n36th International Florida Artificial Intelligence Research Society Conference\n</td></tr>\n<tr><td>\n<a href=""/cfp/servlet/event.showcfp?eventid=121887"">IOP, EI, Scopus-PRECE 2022</a>\xc2\xa0\xc2\xa0\n2022 International Conference on Power, Renewable Energy and Control Engineering (PRECE 2022)-EI Compendex\n</td></tr>\n</table>\n</td>\n</tr>\n</table>\n</div>'"
b'http://www.wikicfp.com/cfp/servlet/event.showcfp?eventid=163516',b'ACMAE--Ei 2022',b'2022 The 13th Asia Conference on Mechanical and Aerospace Engineering (ACMAE 2022)',b'http://www.acmae.com',b'2022-12-22T00:00:00',b'2022-12-24T23:59:59',"b'Chengdu, China'","b'Aug 25, 2022'",,,b'engineering' b'robotics' b'aerospace' b'mechanical engineering' ,"b'\nACMAE 2022\r2022 The 13th Asia Conference on Mechanical and Aerospace Engineering (ACMAE 2022)\rhttp://www.acmae.com\r The 13th Asia Conference on Mechanical and Aerospace Engineering (ACMAE 2022), the sister conference of ICMAE, will be held in Chengdu, Sichuan, China during December 22-24, 2022, following the successful conferences in Nanjing last year, online in 2020, Bangkok, Thailand in 2019, Singapore in 2018 and Yokohama, Japan in 2017.\rACMAE 2022 is sponsored by University of Electronic Science and Technology of China, Science and Engineering Institute, co-sponsored by Nanjing University of Science and Technology, Moscow Bauman State Technical University, technically supported by Capitol Technology University, Washington University in St. Louis.\r  \xe2\x97\x8fPublication:\rAccepted and registered papers will be included in the conference proceedings - Journal of Physics: Conference Series (JPCS). which can be indexed by EI Compendex, SCOPUS, etc.\r ACMAE 2021 |  IOP Conferences Proceedings | EI Compendex, SCOPUS successfully\rACMAE 2020 |  IOP Conferences Proceedings | EI Compendex, SCOPUS successfully within one months after online.\rACMAE 2019 |  IOP Conferences Proceedings | EI Compendex, SCOPUS successfully.\rACMAE 2018 |  IOP Conferences Proceedings | EI Compendex, SCOPUS successfully.\rACMAE 2017 | Matec, ISSN: 2261-236X, Vol. 151 | EI Compendex, SCOPUS successfully.\r \xe2\x97\x8fCall for Paper:\rAerospace Mechatronics and Avionics Systems\rAerospace Communications\rMechanical Engineering in Aerospace\rElectronic Systems\rAerospace Engineering and Management\rAircraft Navigation\rAntennas\rAstronomical Image Processing\rAtmospheric Measurement\rAttitude maneuver control\rAutonomous flight control\rBallistic tracking\rBistatic SAR processing\rCommunications techniques\rControl design\rMore topics, please visit: http://acmae.com/calls.html\r \xe2\x97\x8fSubmission\r1. By online system: https://www.zmeeting.org/submission/amae2022\r2. By Email: secretary_acmae@icmae.org\r \xe2\x97\x8fContacts:\rMs. Ashily Qi\rE-mail: secretary_acmae@icmae.org\rTel: +86 18108245450\n\t'","b'<div align=""left"" class=""cfp"">\n<table align=""center"" cellpadding=""0"" cellspacing=""0px"" width=""100%"">\n<tr valign=""top"">\n<td>\n<table align=""center"" cellpadding=""4"" cellspacing=""3"" width=""100%"">\n<tr><td>\n<a href=""/cfp/servlet/event.showcfp?eventid=151972"">CAMME 2023</a>\xc2\xa0\xc2\xa0\n2023 7th International Conference on Aerospace, Mechanical and Mechatronic Engineering (CAMME 2023)\n</td></tr>\n<tr><td>\n<a href=""/cfp/servlet/event.showcfp?eventid=118204"">CAMME 2023</a>\xc2\xa0\xc2\xa0\n2023 7th International Conference on Aerospace, Mechanical and Mechatronic Engineering (CAMME 2023)\n</td></tr>\n<tr><td>\n<a href=""/cfp/servlet/event.showcfp?eventid=166556"">ICMAS--EI 2023</a>\xc2\xa0\xc2\xa0\n2023 the 4th International Conference on Mechanical and Aerospace Systems (ICMAS 2023)\n</td></tr>\n</table>\n</td>\n</tr>\n</table>\n</div>'"
b'http://www.wikicfp.com/cfp/servlet/event.showcfp?eventid=163517',b'ACMAE 2022',b'2022 The 13th Asia Conference on Mechanical and Aerospace Engineering (ACMAE 2022)',b'http://www.acmae.com',b'2022-12-22T00:00:00',b'2022-12-24T23:59:59',"b'Chengdu, China'","b'Aug 25, 2022'",,,b'artificial intelligence' b'automation' b'control' b'mechatronics' ,"b'\nACMAE 2022\r2022 The 13th Asia Conference on Mechanical and Aerospace Engineering (ACMAE 2022)\rhttp://www.acmae.com\r The 13th Asia Conference on Mechanical and Aerospace Engineering (ACMAE 2022), the sister conference of ICMAE, will be held in Chengdu, Sichuan, China during December 22-24, 2022, following the successful conferences in Nanjing last year, online in 2020, Bangkok, Thailand in 2019, Singapore in 2018 and Yokohama, Japan in 2017.\rACMAE 2022 is sponsored by University of Electronic Science and Technology of China, Science and Engineering Institute, co-sponsored by Nanjing University of Science and Technology, Moscow Bauman State Technical University, technically supported by Capitol Technology University, Washington University in St. Louis.\r  \xe2\x97\x8fPublication:\rAccepted and registered papers will be included in the conference proceedings - Journal of Physics: Conference Series (JPCS). which can be indexed by EI Compendex, SCOPUS, etc.\r ACMAE 2021 |  IOP Conferences Proceedings | EI Compendex, SCOPUS successfully\rACMAE 2020 |  IOP Conferences Proceedings | EI Compendex, SCOPUS successfully within one months after online.\rACMAE 2019 |  IOP Conferences Proceedings | EI Compendex, SCOPUS successfully.\rACMAE 2018 |  IOP Conferences Proceedings | EI Compendex, SCOPUS successfully.\rACMAE 2017 | Matec, ISSN: 2261-236X, Vol. 151 | EI Compendex, SCOPUS successfully.\r \xe2\x97\x8fCall for Paper:\rAerospace Mechatronics and Avionics Systems\rAerospace Communications\rMechanical Engineering in Aerospace\rElectronic Systems\rAerospace Engineering and Management\rAircraft Navigation\rAntennas\rAstronomical Image Processing\rAtmospheric Measurement\rAttitude maneuver control\rAutonomous flight control\rBallistic tracking\rBistatic SAR processing\rCommunications techniques\rControl design\rMore topics, please visit: http://acmae.com/calls.html\r \xe2\x97\x8fSubmission\r1. By online system: https://www.zmeeting.org/submission/amae2022\r2. By Email: secretary_acmae@icmae.org\r \xe2\x97\x8fContacts:\rMs. Ashily Qi\rE-mail: secretary_acmae@icmae.org\rTel: +86 18108245450\n\t'","b'<div align=""left"" class=""cfp"">\n<table align=""center"" cellpadding=""0"" cellspacing=""0px"" width=""100%"">\n<tr valign=""top"">\n<td>\n<table align=""center"" cellpadding=""4"" cellspacing=""3"" width=""100%"">\n<tr><td>\n<a href=""/cfp/servlet/event.showcfp?eventid=151972"">CAMME 2023</a>\xc2\xa0\xc2\xa0\n2023 7th International Conference on Aerospace, Mechanical and Mechatronic Engineering (CAMME 2023)\n</td></tr>\n<tr><td>\n<a href=""/cfp/servlet/event.showcfp?eventid=118204"">CAMME 2023</a>\xc2\xa0\xc2\xa0\n2023 7th International Conference on Aerospace, Mechanical and Mechatronic Engineering (CAMME 2023)\n</td></tr>\n<tr><td>\n<a href=""/cfp/servlet/event.showcfp?eventid=166555"">ICMAS 2023</a>\xc2\xa0\xc2\xa0\n2023 the 4th International Conference on Mechanical and Aerospace Systems (ICMAS 2023)\n</td></tr>\n</table>\n</td>\n</tr>\n</table>\n</div>'"
