identifier,title,description,source,startDate,endDate,locality,Submission Deadline,Notification Due,Final Version Due,Categories,Call For Papers,Related Resources
b'http://www.wikicfp.com/cfp/servlet/event.showcfp?eventid=164103',b'BBH 2022',"b'BANDUNG-BELGRADE-HAVANA IN GLOBAL HISTORY AND PERSPECTIVE: What Dreams, What Challenges, What Projects for a Global Future?'",b'https://bandungspirit.org/',b'2022-11-07T00:00:00',b'2022-11-13T23:59:59',b'Indonesia',"b'Jun 30, 2022'","b'Jul 15, 2022'","b'Aug 31, 2022'",b'global history' b'post-colonial history' b'international relations' b'geopolitical economy' ,"b'\nBANDUNG-BELGRADE-HAVANA IN GLOBAL HISTORY AND PERSPECTIVE:\rWhat Dreams, What Challenges, What Projects for a Global Future?\r INTERNATIONAL, INTER-AND-TRANS-DISCIPLINARY CONFERENCE\r66th Anniversary of the Bandung Asian-African Conference\r60th Anniversary of the Belgrade Non-Alignment Conference\r55th Anniversary of the Havana Tricontinental Conference\rJakarta-Bandung-Surabaya-Bali, Indonesia, November 7-13, 2022\rIn Conjunction with the G20 Summit, Bali, November 15-16, 2022\rGeneral information: https://bandungspirit.org/\rInquiry: secretariat-bbh@e-group.bandungspirit.org\rAddress for abstract submission: https://forms.gle/aWVKdMkDWgAf8LMYA\r Following the change of dates of the G20 Summit in Bali, Indonesia, from October 30-31 to November 15-16, 2022, we have rescheduled our conference to November 7-13, 2022, so that the end of our conference be close to the beginning of the G20 Summit.\r Under the theme of ""What dreams, what challenges, what projects for a global future?"", the conference is open to proposals of paper to be presented in the conference and to be selected for publication. The conference welcomes proposals dealing with dreams, challenges and projects in diverse fields (culture, ecology, economy, politic, religion...) and higlighted under diverse academic disciplines (humanities, history, literature, anthropology, politics, economics, sociology, gender studies, area studies, urban studies...). Here are examples of issues to be discussed in the conference:\r- Gender and Women\xe2\x80\x99s issues\r- Ecology/Global Health/Biodiversity/Sustainability (Human and Nature)\r- Demography/Migration/Rural-Urban Issues\r- Digital Transformation/Culture/Business\r- Geopolitical Economy/International Trade/WTO/Finance/Dedollarisation/Delinking\r- Revolutions/Decolonisation/Social Movements/Rehabilitation-Enhancement of Indigenous Rights\r- National Sovereignty/Global Interdependency/Global & Regional Security/Arms control\r- Counter Hegemony/BRICS & NAM Synergy\r- South-South & North-South Exchanges and Cooperation/Africa-Asia-Latin America Exchanges-Cooperation-Solidarity\r- Interfaith/Interreligious/Intercultural/Exogenous-Endogenous Dialogue/Syncretism/Eclectism/Fusion/Integration\r- Bandungism and Bandung School of Global Studies\r- Cybernetic strategic economic planning at the service of the people\r NEW DEADLINE OF ABSTRACTS SUBMISSION: June 30, 2022.\rThe papers presented in the conference will be considered for a publication in a journal partner of the conference or in a book of selected papers. You find the guidelines for abstract submission and other information at https://bandungspirit.org/\r COORDINATORS:\rDarwis Khudori, Indonesia/France (Universit\xc3\xa9 Le Havre Normandie, France, Faculty of International Affairs, GRIC Research Group on Identities and Cultures, Director of Master\'s Degree in Exchanges with Asia)\rIsaac Bazi\xc3\xa9, Burkina Faso/Canada (Universit\xc3\xa9 du Qu\xc3\xa9bec \xc3\xa0 Montr\xc3\xa9al, Canada, Director of LAFI Laboratoire des Afriques Innovantes, President of CAAS Canadian Association of African Studies, Chief Editor of Journal Afroglobe African Issues, in local and global Perspectives)\r Contact Info: \rDarwis Khudori, Faculty of International Affairs, University Le Havre Normandy, France\rContact Email: secretariat-bbh@e-group.bandungspirit.org\rURL: https://bandungspirit.org/\n\t'","b'<div align=""left"" class=""cfp"">\n<table align=""center"" cellpadding=""0"" cellspacing=""0px"" width=""100%"">\n<tr valign=""top"">\n<td>\n<table align=""center"" cellpadding=""4"" cellspacing=""3"" width=""100%"">\n<tr><td>\n<a href=""/cfp/servlet/event.showcfp?eventid=149900"">Call for Papers 2022</a>\xc2\xa0\xc2\xa0\nCall for Papers Historical Yearbook 2022\n</td></tr>\n<tr><td>\n<a href=""/cfp/servlet/event.showcfp?eventid=165898"">Art and Design Session, TGSW 2022</a>\xc2\xa0\xc2\xa0\nArt and Design Session in Tsukuba Science Global Week 2022\n</td></tr>\n<tr><td>\n<a href=""/cfp/servlet/event.showcfp?eventid=154564"">JPS 2022</a>\xc2\xa0\xc2\xa0\nJournal of Political Science (JPS)\n</td></tr>\n<tr><td>\n<a href=""/cfp/servlet/event.showcfp?eventid=158895"">GIRES BLV2022</a>\xc2\xa0\xc2\xa0\nBlack Lives Matter: Lessons from a Global Movement\n</td></tr>\n<tr><td>\n<a href=""/cfp/servlet/event.showcfp?eventid=164999"">MS - 22/2 (2022) 2022</a>\xc2\xa0\xc2\xa0\nCfP: International Studies journal (Winter 2022, including special thematic interest: International Relations after 2022)\n</td></tr>\n<tr><td>\n<a href=""/cfp/servlet/event.showcfp?eventid=164336"">ICACNIS 2022</a>\xc2\xa0\xc2\xa0\nThe 2022 International Conference on Advanced Creative Networks and Intelligent Systems\n</td></tr>\n<tr><td>\n<a href=""/cfp/servlet/event.showcfp?eventid=166883"">GSC 2023</a>\xc2\xa0\xc2\xa0\nGlobal Strategy Conference 2023\n</td></tr>\n<tr><td>\n<a href=""/cfp/servlet/event.showcfp?eventid=162758"">FCS 2023</a>\xc2\xa0\xc2\xa0\nEurope at a Crossroads: 52nd Annual Frank Church Symposium\n</td></tr>\n<tr><td>\n<a href=""/cfp/servlet/event.showcfp?eventid=155969"">CCIA 2022</a>\xc2\xa0\xc2\xa0\n20TH SCIENTIFIC CONFERENCE ON ENGINEERING AND ARCHITECTURE\n</td></tr>\n<tr><td>\n<a href=""/cfp/servlet/event.showcfp?eventid=165126"">EMERGE 2022</a>\xc2\xa0\xc2\xa0\nInternational Conference: Digital Society Now\n</td></tr>\n</table>\n</td>\n</tr>\n</table>\n</div>'"
b'http://www.wikicfp.com/cfp/servlet/event.showcfp?eventid=164110',b'REX-IO 2022',b'2nd Workshop on Re-envisioning Extreme-Scale I/O for Emerging Hybrid HPC Workloads @ IEEE Cluster 2022',b'https://sites.google.com/view/rexio/',b'2022-09-06T00:00:00',b'2022-09-06T23:59:59',"b'Heidelberg, Germany'","b'Jul 10, 2022'","b'Jul 21, 2022'","b'Jul 25, 2022'",b'parallel i/o' b'HPC' b'parallel storage' b'file systems' ,"b'\n*********************************************************************\r Call for Papers\r REX-IO 2022: 2nd Workshop on Re-envisioning Extreme-Scale I/O for\rEmerging Hybrid HPC Workloads\r Held in conjunction with IEEE Cluster 2022, Heidelberg, Germany.\r Workshop Date: September 6, 2022\r (https://sites.google.com/view/rexio/)\r *********************************************************************\r ================================\rScope, Aims, and Topics\r================================\rHigh Performance Computing (HPC) applications are evolving to include not only traditional scale-up modeling and simulation bulk-synchronous workloads but also scale-out workloads like artificial intelligence (AI), data analytics methods, deep learning, big data and complex multi-step workflows. Exascale workflows are projected to include multiple different components from both scale-up and scale-out communities operating together to drive scientific discovery and innovation. With the often conflicting design choices between optimizing for write-intensive vs. read-intensive, having flexible I/O systems will be crucial to support these hybrid workloads. Another performance aspect is the intensifying complexity of parallel file and storage systems in large-scale cluster environments. Storage system designs are advancing beyond the traditional two-tiered file system and archive model by introducing new tiers of temporary, fast storage close to the computing resources with distinctly different performance characteristics. \r The changing landscape of emerging hybrid HPC workloads along with the ever increasing gap between the compute and storage performance capabilities reinforces the need for an in-depth understanding of extreme-scale I/O and for rethinking existing data storage and management techniques. Traditional approaches of managing data might fail to address the challenges of extreme-scale hybrid workloads. Novel I/O optimization and management techniques integrating machine learning and AI algorithms, such as intelligent load balancing and I/O pattern prediction, are needed to ease the handling of the exponential growth of data as well as the complex hierarchies in the storage and file systems. Furthermore, user-friendly, transparent and innovative approaches are essential to adapt to the needs of different HPC I/O workloads while easing the scientific and commercial code development and efficiently utilizing extreme-scale parallel I/O and storage resources.\r Established at IEEE Cluster 2021, the Re-envisioning Extreme-Scale I/O for Emerging Hybrid HPC Workloads (REX-IO) workshop has created a forum for experts, researchers, and engineers in the parallel I/O and storage, compute facility operation, and HPC application domains. REX-IO solicits novel work that characterizes I/O behavior and identifies the challenges in scientific data and storage management for emerging HPC workloads, introduces potential solutions to alleviate some of these challenges, and demonstrates the effectiveness of the proposed solutions to improve I/O performance for the exascale supercomputing era and beyond. We envision that this workshop will contribute to the community and further drive discussions between storage and I/O researchers, HPC application users and the data analytics community to give a better in-depth understanding of the impact on the storage and file systems induced by emerging HPC applications.\r Topics of interest include, but are not limited to:\r- Understanding I/O inefficiencies in emerging workloads such as complex multi-step workflows, in-situ analysis, AI, and data analytics methods  \r- New I/O optimization techniques, including how ML and AI algorithms might be adapted for intelligent load balancing and I/O pattern prediction of complex, hybrid application workloads\r- Performance benchmarking, resource management, and I/O behavior studies of emerging workloads\r- New possibilities for the I/O optimization of emerging application workloads and their I/O subsystems\r- Efficient tools for the monitoring of metadata and storage hardware statistics at runtime, dynamic storage resource management, and I/O load balancing\r- Parallel file systems, metadata management, and complex data management\r- Understanding and efficiently utilizing complex storage hierarchies beyond the traditional two-tiered file system and archive model\r- User-friendly tools and techniques for managing data movement among compute and storage nodes\r- Use of staging areas, such as burst buffers or other private or shared acceleration tiers for managing intermediate data between computation tasks\r- Application of emerging big data frameworks towards scientific computing and analysis\r- Alternative data storage models, including object and key-value stores, and scalable software architectures for data storage and archive\r- Data movement for HPC on edge devices\r- Position papers on related topics\r ================================\rSubmission Guidelines\r================================\rAll papers must be original and not simultaneously submitted to another journal or conference. Indicate all authors and affiliations. All papers will be peer-reviewed using a single-blind peer-review process by at least three members of the program committee. Submissions should be a complete manuscript. Full paper submissions should not exceed 6 single-spaced, double-column pages using 10-point size font on 8.5 X 11 inch pages (IEEE conference style, https://www.ieee.org/conferences/publishing/templates.html) including everything excluding references.\r Papers are to be submitted electronically in PDF format through EasyChair. Submitted papers should not have appeared in or be under consideration for a different workshop, conference or journal. It is also expected that all accepted papers will be presented at the workshop by one of the authors.\r All accepted papers (subject to post-review revisions) will be published in the IEEE Cluster 2022 proceedings.\r Submission Link: https://easychair.org/conferences/?conf=rexio22\r ================================\rImportant Dates\r================================\r- Submissions open: May 3, 2022\r- Submission deadline: July 10, 2022, 11:59PM AoE (FINAL EXTENSION)\r- Notification to authors: July 21, 2022\r- Camera-ready paper due: July 25, 2025\r- Workshop date: September 6, 2022 \r ================================\rWorkshop Committees\r================================\rWorkshop Co-Chairs:\r- Arnab K. Paul (BITS Pilani, K K Birla Goa Campus, India) (arnabp AT goa DOT bits-pilani DOT ac DOT in) \r- Sarah M. Neuwirth (Goethe-University Frankfurt, Germany) (s.neuwirth AT em DOT uni-frankfurt DOT de)\r- Jay Lofstead (Sandia National Laboratories, USA) (gflofst AT sandia DOT gov)\r Program Committee:\r- Ali Anwar (University of Minnesota, USA)\r- Scott Atchley (Oak Ridge National Laboratory, USA)\r- Jean Luca Bez (Lawrence Berkeley National Laboratory, USA)\r- Thomas Boenisch (High-Performance Computing Center Stuttgart (HLRS), Germany)\r- Suren Byna (Lawrence Berkeley National Laboratory, USA)\r- Phil Carns (Argonne National Laboratory, USA)\r- Yue Cheng (Goerge Mason University, USA)\r- Wei Der Chien (The University of Edinburgh, UK)\r- Hariharan Devarajan (Lawrence Livermore National Laboratory, USA)\r- Awais Khan (Oak Ridge National Laboratory, USA)\r- Youngjae Kim (Sogang University, South Korea)\r- Julian Kunkel (Georg-August-Universit\xc3\xa4t G\xc3\xb6ttingen/GWDG, Germany)\r- Ricardo Macedo (INESC TEC & University of Minho, Portugal)\r- Houjun Tang (Lawrence Berkeley National Laboratory, USA)\r- Bing Xie (Oak Ridge National Laboratory, USA)\r- Nannan Zhao (Northwestern Polytechnical University, China)\r- Mai Zheng (Iowa State University, USA)\n\t'","b'<div align=""left"" class=""cfp"">\n<table align=""center"" cellpadding=""0"" cellspacing=""0px"" width=""100%"">\n<tr valign=""top"">\n<td>\n<table align=""center"" cellpadding=""4"" cellspacing=""3"" width=""100%"">\n<tr><td>\n<a href=""/cfp/servlet/event.showcfp?eventid=62259"">OpenSuCo @ ISC HPC 2017</a>\xc2\xa0\xc2\xa0\n2017 International Workshop on Open Source Supercomputing\n</td></tr>\n<tr><td>\n<a href=""/cfp/servlet/event.showcfp?eventid=157175"">DFM 2022</a>\xc2\xa0\xc2\xa0\nInternational Workshop on Data-Flow Models for extreme-scale computing\n</td></tr>\n<tr><td>\n<a href=""/cfp/servlet/event.showcfp?eventid=165682"">MNHACK 2022</a>\xc2\xa0\xc2\xa0\nCFP: 4th MARENOSTRUM HACKATHON\n</td></tr>\n<tr><td>\n<a href=""/cfp/servlet/event.showcfp?eventid=161028"">XLOOP 2022</a>\xc2\xa0\xc2\xa0\n4th Annual Workshop on Extreme-scale Experiment-in-the-Loop Computing\n</td></tr>\n<tr><td>\n<a href=""/cfp/servlet/event.showcfp?eventid=154549"">CSI 2022</a>\xc2\xa0\xc2\xa0\nInternational Conference on Connected Systems &amp; Intelligence\n</td></tr>\n<tr><td>\n<a href=""/cfp/servlet/event.showcfp?eventid=163440"">Metaverse 2022</a>\xc2\xa0\xc2\xa0\nInternational Conference on Metaverse\n</td></tr>\n<tr><td>\n<a href=""/cfp/servlet/event.showcfp?eventid=145163"">MDPI-Electronics-SI-QualRiskDistribSys 2022</a>\xc2\xa0\xc2\xa0\nMDPI Electronics Special Issue on Quality Assurance and Risk Mitigation in Large-Scale Distributed Systems\n</td></tr>\n<tr><td>\n<a href=""/cfp/servlet/event.showcfp?eventid=156034"">VLSI-SOC  2022</a>\xc2\xa0\xc2\xa0\n30th IFIP/IEEE International Conference on Very Large Scale Integration\n</td></tr>\n<tr><td>\n<a href=""/cfp/servlet/event.showcfp?eventid=138235"">SI_ConnSci_MAICT 2022</a>\xc2\xa0\xc2\xa0\nSpecial Issue on Mobile Applications and Information Communication Technologies for Connecting People in Normal and Extreme Situations\n</td></tr>\n<tr><td>\n<a href=""/cfp/servlet/event.showcfp?eventid=158853"">FlexScience 2022</a>\xc2\xa0\xc2\xa0\n12th Workshop on AI and Scientific Computing at Scale using Flexible Computing Infrastructures\n</td></tr>\n</table>\n</td>\n</tr>\n</table>\n</div>'"
b'http://www.wikicfp.com/cfp/servlet/event.showcfp?eventid=164111',b'WAISC 2022',b'Workshop on AI & Digital Twins for Smart Cities',b'https://waisc2022.dfki.de/',b'2022-09-20T00:00:00',b'2022-09-20T23:59:59',"b'Germany, Trier'","b'Jul 15, 2022'","b'Aug 1, 2022'","b'Aug 20, 2022'",b'digital twins' b'smart cities' b'agent-based systems' b'computer science' ,"b'\nWORKSHOP ON AI & DIGITAL TWINS FOR SMART CITIES\rWorkshop at KI2022 in Trier, Germany\rSeptember 19\xe2\x80\x9323, 2022\r   Workshop Website:   https://waisc2022.dfki.de/\r  Conference Website: https://ki2022.gi.de/\r  Smart cities are a collective term for the use of information technology in urban context. As a subfield, digital twins for cities is a promising topic with unexplored potential. Both topics are influenced by different spheres of AI: acquisition and evaluation of big data, semantic technologies, agent-based modeling/distributed simulation, but also the human-computer interaction challenges that arise from the work with digital twins. As such, both topics are deeply nested in the context of the KI2022 conference. In this workshop, we aim to examine the different angles, challenges and technologies from which the smart city concept can benefit from AI and digital twins. We call for extended abstracts on past works and experience, demonstrations of implemented systems and presentations of novel research questions and ideas to promote a joint discussion on how the use of digital twins for smart cities can be advanced by means of AI to address future challenges.\r Topics include but are not limited to:\r  - What constitutes a digital twin for a smart city, and how can this information be represented adequately in order to allow the application of AI while at the same time protecting the rights and interests of citizens and society?\r  - Is a digital twin in a smart city just a simulation or a semantic data space?\r  - What are online and offline properties of smart city applications?\r  - What are successful implementations of digital twins for smart cities, esp. with a focus on AI?\r  - How can aspects of transparency and explainability be supported?\r  - Which organizational structures are required to design, build, and use a digital twin for smart cities?\r  - How do citizens interact with smart city applications? What is required to ensure their broad acceptance?\r Submission:\r  - Extended abstracts may consist of up to 3 pages (excl. references) \r  - Presentation of extended abstracts and panel discussions\r  - Joint publication of postproceedings in thematic groups\r Format and schedule:\rThe workshop is planned to be a physical event. All accepted submissions will be grouped into related topic blocks, during which each participant presents their contribution in a 10 minute presentation. Each block is concluded by a panel talk, summarizing common findings, experiences and problems encountered in this topic block.\r Organizers:\r  Falco Nogatz, Veronika Kurchyna, Ingo J. Timm, \r  Benjamin Weyers, Fabian Lorig, Martin Memmel\r Workshop website:\r  https://waisc2022.dfki.de/\r\n'","b'<div align=""left"" class=""cfp"">\n<table align=""center"" cellpadding=""0"" cellspacing=""0px"" width=""100%"">\n<tr valign=""top"">\n<td>\n<table align=""center"" cellpadding=""4"" cellspacing=""3"" width=""100%"">\n<tr><td>\n<a href=""/cfp/servlet/event.showcfp?eventid=149593"">MDPI-SI on DT &amp; FIE in Ed--Scopus,JCI 2023</a>\xc2\xa0\xc2\xa0\nMDPI Education Sciences Journal - Special Issue on Digital Twins and Future Intelligent Educational Environments\n</td></tr>\n<tr><td>\n<a href=""/cfp/servlet/event.showcfp?eventid=146828"">NLPTA 2022</a>\xc2\xa0\xc2\xa0\n3rd International Conference on NLP Techniques and Applications\n</td></tr>\n<tr><td>\n<a href=""/cfp/servlet/event.showcfp?eventid=160926"">Computing &amp; AI in Digital Therapeutics 2022</a>\xc2\xa0\xc2\xa0\nJournal Special Issue (Frontiers in Medicine &amp; Frontiers in Digital Health ): Computing and Artificial Intelligence in Digital Therapeutics\n</td></tr>\n<tr><td>\n<a href=""/cfp/servlet/event.showcfp?eventid=115414"">ACM-EI/Scopus-ACAI 2022</a>\xc2\xa0\xc2\xa0\n2022 5th International Conference on Algorithms, Computing and Artificial Intelligence (ACAI 2022)-EI Compendex\n</td></tr>\n<tr><td>\n<a href=""/cfp/servlet/event.showcfp?eventid=153664"">AIAA 2022</a>\xc2\xa0\xc2\xa0\n12th International Conference on Artificial Intelligence, Soft Computing and Applications\n</td></tr>\n<tr><td>\n<a href=""/cfp/servlet/event.showcfp?eventid=164468"">AI-DH 2022</a>\xc2\xa0\xc2\xa0\nMDPI Big Data and Cognitive Computing - Special Issue on Artificial Intelligence in Digital Humanities\n</td></tr>\n<tr><td>\n<a href=""/cfp/servlet/event.showcfp?eventid=121887"">IOP, EI, Scopus-PRECE 2022</a>\xc2\xa0\xc2\xa0\n2022 International Conference on Power, Renewable Energy and Control Engineering (PRECE 2022)-EI Compendex\n</td></tr>\n<tr><td>\n<a href=""/cfp/servlet/event.showcfp?eventid=166238"">SSCt 2023</a>\xc2\xa0\xc2\xa0\nSustainable Smart Cities and Territories International Conference\n</td></tr>\n<tr><td>\n<a href=""/cfp/servlet/event.showcfp?eventid=149056"">BIOS 2022</a>\xc2\xa0\xc2\xa0\n8th International Conference on Bioinformatics &amp; Biosciences \n</td></tr>\n<tr><td>\n<a href=""/cfp/servlet/event.showcfp?eventid=161074"">Smart Cities 2022</a>\xc2\xa0\xc2\xa0\nSmart Cities: Enabling Technologies and Applications\n</td></tr>\n</table>\n</td>\n</tr>\n</table>\n</div>'"
