identifier,title,description,source,startDate,endDate,locality,Submission Deadline,Notification Due,Final Version Due,Categories,Call For Papers,Related Resources
b'http://www.wikicfp.com/cfp/servlet/event.showcfp?eventid=163657',b'MLE 2022',b'4th International Workshop on Modeling Language Engineering (MLE)',b'https://mleworkshop.github.io/editions/mle2022/',b'2022-10-23T00:00:00',b'2022-10-25T23:59:59',"b'Montreal, Canada'","b'Jul 20, 2022'","b'Aug 19, 2022'","b'Aug 26, 2022'",b'domain-specific languages' b'software language engineering' b'model-driven engineering' b'software engineering' ,"b'\n-----------------------------------------------------------------------\rCall for Papers:\r4th International Workshop on Modeling Language Engineering (MLE)\rco-located with MODELS 2022,\r23-25 October, 2022,\rMontr\xc3\xa9al, Canada\rhttps://mleworkshop.github.io/editions/mle2022\r-----------------------------------------------------------------------\r  ---------------------------\rAbout the conference\r---------------------------\r  Software-intensive systems are complicated, driven by the need to integrate across multiple concerns. Consequently, the development of such systems requires the integration of different concerns and skills. These concerns can be covered by different domain-specific modeling languages, with specific concepts, technologies, and abstraction levels. This multiplication of languages eases the development related to each individual specific concern but raises language and technology integration problems at the different stages of the software life cycle. To reason about the global system as a whole, it is necessary to explicitly describe the different kinds of relationships that exist between the different languages used in its development. To support effective language integration, there is a pressing need to reify and classify these relationships, as well as the language interactions that the relationships enable. Equally, the proliferation of domain-specific modeling languages required increases the need for effective and efficient techniques for engineering languages and their support infrastructures (transformations, analysis tools, editors, execution infrastructure, debuggers, \xe2\x80\xa6).\r The Modeling Language Engineering (MLE) workshop aims at bringing together researchers and practitioners working on modeling-language and software-language engineering. It is a meeting opportunity for Software Language Engineering (SLE) enthusiasts within the software-modeling community.\r ---------------------------\rTopics\r---------------------------\r The topics of interest for MLE 2022 include:\r  - Methodologies, languages, techniques, and methods for designing and implementing modeling languages\r- Composition, extension, and reuse of modeling languages and model execution tools\r- Heterogeneous modeling, simulation, and execution\r- Customization of modeling languages\r- Integration of modeling languages and programming languages\r- Semantics-aware model transformations and code generation\r- Scalability of model execution and execution-based model analysis\r- Execution of partial and underspecified models\r- Model execution in the presence of non-determinism and concurrency\r- Tracing model executions and analyzing model execution traces\r- Model execution tools for the (dynamic) validation, verification, and testing of systems (e.g., model animation, debugging, simulation, trace exploration, model checking, symbolic execution)\r- Live modeling and exploratory modeling techniques\r- Automation techniques for the development of modeling and model execution tools\r- Evolution in the context of executable modeling (e.g.} evolution of executable modeling languages, execution semantics, executable models, model execution tools)\r- Verification of semantic conformance (e.g., among executable modeling languages, executable models, model execution tools)\r- Integration challenges for languages, from requirements to design, for analysis and simulation, during runtime, etc.\r- Case studies and experience reports on the successful or failed adoption of modeling in different application domains and application contexts\r- Surveys and benchmarks of different approaches for the development of modeling languages, model execution, and execution-based model analysis\r Submissions describing practical and industrial experience related to the use of modeling languages are also encouraged, particularly in the following application domains:\rCyber-Physical Systems, Smart Manufacturing, Industry 4.0;  Internet of Services, Internet of Things; Smart City, Smart Building, Home automation; Smart and Learning systems.\r ---------------------------\rWorkshop Format\r---------------------------\r This full-day workshop will prioritize discussions over presentations. We plan to open with a keynote in the morning, followed by paper presentations. The afternoon will then be spent primarily in discussions inspired by topics raised by the keynotes and paper presentations.  Where there is sufficient divergence in the topics raised, we will create break-out groups of participants interested in each sub-topic. The goal of these discussions is to identify commonalities and connections between different topics, support research networking, cross-pollination, and informal knowledge transfer. The final session of the workshop will be focused on summarising the key topics and ideas discussed at the workshop to help identify the next steps that may be followed up by workshop participants.\r  ---------------------------\rSubmission and Publication\r---------------------------\r We expect early research results about the aforementioned topics, descriptions of problems, case studies, experience reports, or solutions related to the topics of interest.\r Each contribution must be described in a short paper of 5 pages or a full paper of 10 pages, in ACM format (acmart). Two more pages containing only references are permitted.\r Papers that describe use cases or novel approaches can be accompanied by concrete artifacts, such as models (requirements, design, analysis, transformation, composition, etc.), stored in a public repository. Artifacts should illustrate any experience with the conjoint use of different modeling languages.\r All submissions have to follow the ACM format (acmart) and must be submitted electronically in PDF format [via Easychair](https://easychair.org/my/conference?conf=mle2022). They will be evaluated by at least three members of the program committee regarding novelty, correctness, significance, readability, and alignment with the workshop call. Furthermore, all submissions must be original work and must not have been previously published or being under review elsewhere. The accepted papers will be included in the joint workshop proceedings published in the ACM Digital Library and indexed in DBLP and Scopus.\r   ---------------------------\rImportant Dates\r---------------------------\r - Abstract submission deadline: July 13, 2022\r- Paper submission deadline: July 20, 2022\r- Notification of acceptance: August 19, 2022\r- Camera-ready deadline: August 26, 2022\r  ---------------------------\rOrganization committee\r---------------------------\r  - Erwan Bousse (Nantes University)\r- Faezeh Khorram (IMT Atlantique)\r- Juha-Pekka Tolvanen (MetaCase)\r  ---------------------------\rProgram Committee\r---------------------------\r TBA\n\t'","b'<div align=""left"" class=""cfp"">\n<table align=""center"" cellpadding=""0"" cellspacing=""0px"" width=""100%"">\n<tr valign=""top"">\n<td>\n<table align=""center"" cellpadding=""4"" cellspacing=""3"" width=""100%"">\n<tr><td>\n<a href=""/cfp/servlet/event.showcfp?eventid=156554"">IEEE ICSTE 2022</a>\xc2\xa0\xc2\xa0\nIEEE--2022 12th International Conference on Software Technology and Engineering (ICSTE 2022)\n</td></tr>\n<tr><td>\n<a href=""/cfp/servlet/event.showcfp?eventid=152145"">MLDS 2022</a>\xc2\xa0\xc2\xa0\n3rd International Conference on Machine Learning Techniques and Data Science\n</td></tr>\n<tr><td>\n<a href=""/cfp/servlet/event.showcfp?eventid=162766"">ICCES--EI, Scopus 2023</a>\xc2\xa0\xc2\xa0\nThe 29th International Conference on Computational &amp; Experimental Engineering and Sciences\n</td></tr>\n<tr><td>\n<a href=""/cfp/servlet/event.showcfp?eventid=152067"">AISO 2022</a>\xc2\xa0\xc2\xa0\n8th International Conference on Artificial Intelligence and Soft Computing\n</td></tr>\n<tr><td>\n<a href=""/cfp/servlet/event.showcfp?eventid=156614"">Mathematics (MDPI) 2022</a>\xc2\xa0\xc2\xa0\nMathematics Special Issue - Analysis and Mathematical Modeling of Control Engineering and Path Planning\n</td></tr>\n<tr><td>\n<a href=""/cfp/servlet/event.showcfp?eventid=156556"">IEEE--ISCMI 2022</a>\xc2\xa0\xc2\xa0\nIEEE--2022 9th Intl. Conference on Soft Computing &amp; Machine Intelligence (ISCMI 2022)--SCIE\n</td></tr>\n<tr><td>\n<a href=""/cfp/servlet/event.showcfp?eventid=158224"">NATP  2022</a>\xc2\xa0\xc2\xa0\n9th International Conference on Natural Language Processing\n</td></tr>\n<tr><td>\n<a href=""/cfp/servlet/event.showcfp?eventid=166974"">AAMAS  2023</a>\xc2\xa0\xc2\xa0\nThe 22nd International Conference on Autonomous Agents and Multiagent Systems\n</td></tr>\n</table>\n</td>\n</tr>\n</table>\n</div>'"
b'http://www.wikicfp.com/cfp/servlet/event.showcfp?eventid=163659',b'WPES 2022',b'Workshop on Privacy in the Electronic Society',b'https://arc.encs.concordia.ca/wpes22/index.html',b'2022-11-07T00:00:00',b'2022-11-07T23:59:59',"b'Los Angeles, USA (and online)'","b'Aug 1, 2022'","b'Aug 31, 2022'","b'Sep 10, 2022'",b'privacy' b'anonymity' b'computer security' ,"b""\nThe need for privacy-aware policies, regulations, and techniques has been widely recognized. This workshop discusses the problems of privacy in the global interconnected societies and possible solutions. The 2022 Workshop, held in conjunction with the ACM CCS conference, is the twenty-first in a yearly forum for papers on all the different aspects of privacy in today's electronic society.\r The workshop seeks submissions from academia, industry, and government presenting novel research on all theoretical and practical aspects of electronic privacy, as well as experimental studies of fielded systems. We encourage submissions from other communities such as law and business that present these communities' perspectives on technological issues. Topics of interest include, but are not limited to:\r - access and query privacy\r- anonymization and transparency\r- crowdsourcing for privacy and security\r- data correlation and leakage attacks\r- data and computations integrity in emerging scenarios\r- electronic communication privacy\r- electronic communication privacy\r- information dissemination control\r- insider-threat protection\r- models, languages, and techniques for big data protection\r- anonymization of text, unstructured data and multimedia\r- anonymization of longitudinal data and streams\r- statistical disclosure control\r- theory of data anonymization\r- privacy models\r- network privacy\r- personally identifiable information\r- privacy-aware access control\r- privacy and anonymity on the Web\r- privacy in big data\r- privacy in biometric systems\r- privacy in cloud and grid systems\r- privacy and data mining\r- privacy in the digital business\r- privacy in the Internet of Things\r- privacy enhancing technologies\r- privacy in health care and public administration\r- privacy and human rights\r- privacy metrics\r- privacy in mobile systems\r- privacy in outsourced scenarios\r- privacy in sensor networks\r- privacy in surveillance systems\r- privacy policies\r- privacy of provenance data\r- privacy in social networks\r- privacy threats\r- privacy and virtual identity\r- user privacy\r- wireless privacy\r  ------------------------\rSUBMISSION INSTRUCTIONS\r------------------------\rSubmitted papers must not substantially overlap papers that have been published or that are simultaneously submitted to a journal or a conference with proceedings. Submissions should be no more than 12 pages in the ACM double-column format, excluding the bibliography and well-marked appendix. Committee members are not required to read the appendices, and so the paper should be intelligible without them. Submissions should not be anonymized. The workshop will also consider short submissions of up to 4 pages for results that are preliminary or that simply require few pages to describe. Authors of regular submitted papers will indicate at the time of submission whether they would like their paper to also be considered for publication as a short paper (4 proceedings pages).\r Submissions are to be made to the submission website at EasyChair. Only PDF files will be accepted. Submissions not meeting these guidelines risk rejection without consideration of their merits. Papers must be received by the deadline of July 16, 2022 (11:59 PM American Samoa time) to be considered. Notification of acceptance or rejection will be sent to authors by August 31, 2022.\r Authors of accepted papers must guarantee that their paper will be presented at the workshop.\n\t""","b'<div align=""left"" class=""cfp"">\n<table align=""center"" cellpadding=""0"" cellspacing=""0px"" width=""100%"">\n<tr valign=""top"">\n<td>\n<table align=""center"" cellpadding=""4"" cellspacing=""3"" width=""100%"">\n<tr><td>\n<a href=""/cfp/servlet/event.showcfp?eventid=157177"">NordSec 2022</a>\xc2\xa0\xc2\xa0\nThe 27th Nordic Conference on Secure IT Systems\n</td></tr>\n<tr><td>\n<a href=""/cfp/servlet/event.showcfp?eventid=165775"">WPES 2022</a>\xc2\xa0\xc2\xa0\nDeadline Extended: 21st Workshop on Privacy in the Electronic Society\n</td></tr>\n<tr><td>\n<a href=""/cfp/servlet/event.showcfp?eventid=165178"">ACNS 2023</a>\xc2\xa0\xc2\xa0\n21st International Conference on Applied Cryptography and Network Security\n</td></tr>\n<tr><td>\n<a href=""/cfp/servlet/event.showcfp?eventid=150592"">EvoCompAISecurity&amp;Privacy 2022</a>\xc2\xa0\xc2\xa0\nEvolutionary Computing for AI-Driven Security and Privacy: Advancing the state-of-the-art applications\n</td></tr>\n<tr><td>\n<a href=""/cfp/servlet/event.showcfp?eventid=167676"">IEEE CCNC STP-CPS 2023</a>\xc2\xa0\xc2\xa0\n5th International Workshop on Security Trust Privacy for Cyber-Physical Systems (STP-CPS\'23) with IEEE CCNC 2023, 8-11 January, Las Vegas, NV, USA\n</td></tr>\n<tr><td>\n<a href=""/cfp/servlet/event.showcfp?eventid=157122"">SPACE  2022</a>\xc2\xa0\xc2\xa0\n12th International Conference on Security, Privacy and Applied Cryptographic Engineering (SPACE 2022)\n</td></tr>\n<tr><td>\n<a href=""/cfp/servlet/event.showcfp?eventid=163221"">IEEE PriComp 2022</a>\xc2\xa0\xc2\xa0\nThe 2022 IEEE International Conference on Privacy Computing\n</td></tr>\n<tr><td>\n<a href=""/cfp/servlet/event.showcfp?eventid=155829"">Electronics SI 2022</a>\xc2\xa0\xc2\xa0\n Electronics: Special Issue on Cybersecurity and Privacy Issues in Cyber-Physical Systems and Industrial Control Systems\n</td></tr>\n<tr><td>\n<a href=""/cfp/servlet/event.showcfp?eventid=163030"">CyberHunt 2022</a>\xc2\xa0\xc2\xa0\nIEEE BigData Workshop on Cyber Threat Intelligence and Hunting\n</td></tr>\n<tr><td>\n<a href=""/cfp/servlet/event.showcfp?eventid=166252"">EICC 2023</a>\xc2\xa0\xc2\xa0\nEuropean Interdisciplinary Cybersecurity Conference (EICC 2023)\n</td></tr>\n</table>\n</td>\n</tr>\n</table>\n</div>'"
b'http://www.wikicfp.com/cfp/servlet/event.showcfp?eventid=163684',b'CommNet  2022',b'The 5th International Conference on Advanced Communication Technologies and Networking',b'http://www.commnet-conf.org/',b'2022-12-12T00:00:00',b'2022-12-14T23:59:59',b'RABAT',"b'Sep 15, 2022'","b'Nov 1, 2022'","b'Nov 7, 2022'",b'computer science' b'machine learning' b'artificial intelligence' b'security' ,"b'\nThe 5th International Conference on Advanced Communication Technologies and Networking (CommNet 2022) is a forum for scientists, engineers, and practitioners to present their latest research results, ideas, developments, and applications in all areas of advanced communication systems and networking.\r  CommNet 2022 will be held as on a hybrid in-person/virtual mode on December 12-14, 2022.\r \n'","b'<div align=""left"" class=""cfp"">\n<table align=""center"" cellpadding=""0"" cellspacing=""0px"" width=""100%"">\n<tr valign=""top"">\n<td>\n<table align=""center"" cellpadding=""4"" cellspacing=""3"" width=""100%"">\n<tr><td>\n<a href=""/cfp/servlet/event.showcfp?eventid=167518"">WoWMoM 2023</a>\xc2\xa0\xc2\xa0\n24th IEEE International Symposium on a World of Wireless, Mobile and Multimedia Networks\n</td></tr>\n<tr><td>\n<a href=""/cfp/servlet/event.showcfp?eventid=146828"">NLPTA 2022</a>\xc2\xa0\xc2\xa0\n3rd International Conference on NLP Techniques and Applications\n</td></tr>\n<tr><td>\n<a href=""/cfp/servlet/event.showcfp?eventid=163565"">ICICSE 2023</a>\xc2\xa0\xc2\xa0\nIEEE--2023 the 3rd International Conference on Information Communication and Software Engineering (ICICSE 2023)\n</td></tr>\n<tr><td>\n<a href=""/cfp/servlet/event.showcfp?eventid=137130"">MLDM 2023</a>\xc2\xa0\xc2\xa0\n18th International Conference on Machine Learning and Data Mining\n</td></tr>\n<tr><td>\n<a href=""/cfp/servlet/event.showcfp?eventid=151807"">Sensors journal 2022</a>\xc2\xa0\xc2\xa0\nSpecial Issue on Energy-Efficient Communication Networks and Systems\n</td></tr>\n<tr><td>\n<a href=""/cfp/servlet/event.showcfp?eventid=149056"">BIOS 2022</a>\xc2\xa0\xc2\xa0\n8th International Conference on Bioinformatics &amp; Biosciences \n</td></tr>\n<tr><td>\n<a href=""/cfp/servlet/event.showcfp?eventid=167537"">VTC-Spring 2023</a>\xc2\xa0\xc2\xa0\nIEEE 97th Vehicular Technology Conference\n</td></tr>\n<tr><td>\n<a href=""/cfp/servlet/event.showcfp?eventid=153664"">AIAA 2022</a>\xc2\xa0\xc2\xa0\n12th International Conference on Artificial Intelligence, Soft Computing and Applications\n</td></tr>\n<tr><td>\n<a href=""/cfp/servlet/event.showcfp?eventid=165451"">ICTC--Ei 2023</a>\xc2\xa0\xc2\xa0\n2023 4th Information Communication Technologies Conference (ICTC 2023)\n</td></tr>\n<tr><td>\n<a href=""/cfp/servlet/event.showcfp?eventid=150707"">CSML 2023</a>\xc2\xa0\xc2\xa0\nInternational Conference on Computer Science and Machine Learning \n</td></tr>\n</table>\n</td>\n</tr>\n</table>\n</div>'"
b'http://www.wikicfp.com/cfp/servlet/event.showcfp?eventid=163685',b'ROSS 2022',b'International Workshop on Runtime and Operating Systems for Supercomputers',b'https://events.cels.anl.gov/ross/2022/',b'2022-11-13T00:00:00',b'2022-11-13T23:59:59',"b'Dallas, Texas, USA'","b'Aug 8, 2022'","b'Sep 9, 2022'","b'Oct 10, 2022'",b'operating systems' b'runtime systems' b'parallel computing' b'high-performance computing' ,"b'\nInternational Workshop on Runtime and Operating Systems for Supercomputers\r                           ***  ROSS 2022  ***\r Held in conjunction with SC22: The International Conference for High\rPerformance Computing, Networking, Storage and Analysis,\rDallas, Texas, USA, November 13, 2022\r ==========================================================================\r                  https://events.cels.anl.gov/ross/2022/\r==========================================================================\r The complexity of node architectures in supercomputers increases as we\rcross milestones on the way towards Exascale and beyond. Increasing levels\rof parallelism in multi- and many-core chips and emerging heterogeneity of\rcomputational resources coupled with energy and memory constraints force a\rreevaluation of our approaches towards operating systems and runtime\renvironments.\r The ROSS workshop, to be held as a half-day event in conjunction with the\rSC22 conference, focuses on principles and techniques to design,\rimplement, optimize, or operate runtime and operating systems for\rmassively parallel supercomputers and cloud environments for\rhigh-performance computing.\r In addition to typical workshop publications, we encourage novel and\rpossibly immature ideas, provided that they are interesting and on-topic.\rWell argued position papers are also welcome.\r  TOPICS OF INTEREST:\r-------------------\r - OS and runtime system scalability on many-node and multi/many-core systems\r- management of heterogeneous and reconfigurable compute resources, including FPGAs, GPUs, etc.\r- distributed/hybrid/partitioned OSes and runtime systems for Supercomputing\r- system noise analysis and prevention\r- runtime and operating systems for resource disaggregation\r- modeling and performance analysis of runtime systems\r- the use of machine learning and AI techniques in the autotuning of system software\r- OS and runtime considerations for large-volume, high-performance I/O\r- memory management and emerging memory technologies\r- OS and runtime aspects of HPC in the cloud, convergence of Supercomputing and cloud environments\r- infrastructure for cloud functions and serverless computing in the context of HPC\r- virtualization in HPC, including virtual machines and application containers\r- the role of OS and runtime system in minimizing power usage\r SUBMISSION PROCEDURE:\r----------------------------------\r The ROSS workshop proceedings will be published electronically via the IEEE\rComputer Society Digital Library.  Submitted manuscripts should be\rformatted using the IEEE template conference mode.  The maximum paper\rlength is 8 pages, not including references and other appendices.  All\rpapers must be in English. Please visit the workshop website for further\rinstructions and the submission link.\r WORKSHOP CHAIRS:\r----------------\r Balazs Gerofi        RIKEN, Japan\rTorsten Hoefler      ETH Zurich, Switzerland\rKamil Iskra          Argonne National Laboratory, USA\r PROGRAM COMMITTEE:\r------------------\r Patrick Bridges, University of New Mexico, USA\rBronis R. de Supinski, Lawrence Livermore National Laboratory, USA\rMaya Gokhale, Lawrence Livermore National Laboratory, USA\rKyle Hale, Illinois Institute of Technology, USA\rJohn Lange, Oak Ridge National Laboratory and University of Pittsburgh, USA\rBernd Mohr, Juelich Supercomputing Centre, Germany\rYoonho Park, IBM Research, USA\rKevin Pedretti, Sandia National Laboratories, USA\rMiquel Pericas, Chalmers University of Technology, Sweden\rRolf Riesen, Intel, USA\rCarsten Weinhold, Barkhausen Institute, Germany\r Contact us at sc-ws-ross@info.supercomputing.org if you have any questions.\n\t'","b'<div align=""left"" class=""cfp"">\n<table align=""center"" cellpadding=""0"" cellspacing=""0px"" width=""100%"">\n<tr valign=""top"">\n<td>\n<table align=""center"" cellpadding=""4"" cellspacing=""3"" width=""100%"">\n<tr><td>\n<a href=""/cfp/servlet/event.showcfp?eventid=160915"">PDCAT 2022</a>\xc2\xa0\xc2\xa0\nThe 23rd International Conference on Parallel and Distributed Computing, Applications and Technologies\n</td></tr>\n<tr><td>\n<a href=""/cfp/servlet/event.showcfp?eventid=143168"">OSDI 2022</a>\xc2\xa0\xc2\xa0\n16th USENIX Symposium on Operating Systems Design and Implementation\n</td></tr>\n<tr><td>\n<a href=""/cfp/servlet/event.showcfp?eventid=167021"">HPCC 2022</a>\xc2\xa0\xc2\xa0\nIEEE HPCC-2022 International Conference on High Performance Computing and Communications\n</td></tr>\n<tr><td>\n<a href=""/cfp/servlet/event.showcfp?eventid=137525"">ASPLOS 2022</a>\xc2\xa0\xc2\xa0\n27th International Conference on Architectural Support for Programming Languages and Operating Systems\n</td></tr>\n<tr><td>\n<a href=""/cfp/servlet/event.showcfp?eventid=153580"">IJFLS 2022</a>\xc2\xa0\xc2\xa0\nInternational Journal of Fuzzy Logic Systems\n</td></tr>\n<tr><td>\n<a href=""/cfp/servlet/event.showcfp?eventid=165213"">ASPLOS 2023</a>\xc2\xa0\xc2\xa0\nArchitectural Support for Programming Languages and Operating Systems\n</td></tr>\n<tr><td>\n<a href=""/cfp/servlet/event.showcfp?eventid=164438"">PDAA 2022</a>\xc2\xa0\xc2\xa0\n14th International Workshop on Parallel and Distributed Algorithms and Applications\n</td></tr>\n<tr><td>\n<a href=""/cfp/servlet/event.showcfp?eventid=137245"">PPoPP 2022</a>\xc2\xa0\xc2\xa0\nThe 27th ACM SIGPLAN Annual Symposium on Principles and Practice of Parallel Programming\n</td></tr>\n<tr><td>\n<a href=""/cfp/servlet/event.showcfp?eventid=167676"">IEEE CCNC STP-CPS 2023</a>\xc2\xa0\xc2\xa0\n5th International Workshop on Security Trust Privacy for Cyber-Physical Systems (STP-CPS\'23) with IEEE CCNC 2023, 8-11 January, Las Vegas, NV, USA\n</td></tr>\n</table>\n</td>\n</tr>\n</table>\n</div>'"
