identifier,title,description,source,startDate,endDate,locality,Submission Deadline,Notification Due,Final Version Due,Categories,Call For Papers,Related Resources
b'http://www.wikicfp.com/cfp/servlet/event.showcfp?eventid=164245',b'ARCS 2022',b'International Conference on Architecture of Computing Systems',b'https://arcs-conference.org/',b'2022-09-13T00:00:00',b'2022-09-15T23:59:59',"b'Heilbronn, Germany'","b'Jul 27, 2022'","b'Aug 21, 2022'","b'Sep 4, 2022'",b'computer architecture' b'computer engineering' b'memory technologies' b'operating systems' ,"b'\n=========================================================================\r                 35th GI/ITG INTERNATIONAL CONFERENCE ON\r                 ARCHITECTURE OF COMPUTING SYSTEMS (ARCS)\r                            Heilbronn, Germany\r                         September 13 \xe2\x80\x93 15, 2022\r                      https://arcs-conference.org/\r                     C A L L   F O R   P A P E R S\r THIS YEAR\xe2\x80\x99S FOCUS:  Quantum Computing: The Dawning of a new Age?\r  =========================================================================\rOverview:\r The ARCS conferences series has over 30 years of tradition reporting\rleading edge research in computer architecture and operating systems. The\rfocus of the 2022 conference will be on quantum computing and its impact\ron the whole system stack spanning from hardware layer to the software\rlayer. This includes hardware architectures, programming models, runtime\renvironments, cross-sectional topics, and real-world use cases. In\raddition to the main conference, ARCS will host workshops and special\rtracks comprising topics like Organic Computing, operating systems and\rmiddleware for emerging system, or fault tolerance. More information on\rthe workshops can be found on the ARCS web page.\rThe proceedings of ARCS 2022 are planned to be published in the Springer\rLecture Notes on Computer Science (LNCS) series. A best paper and best\rpresentation award will be presented at the conference. This year the\rconference will be again a physical meeting with a social program. To\rensure a safest possible meeting for all participants, we will monitor\rthe Corona situation closely and will take all necessary protection steps\rfollowing government guidelines as well as extra measures as needed.\r  =========================================================================\rImportant Dates:\r Abstract registration deadline: July 20, 2022 (extended)\rPaper submission deadline:      July 27, 2022 (extended)\rNotification of acceptance:     August 21, 2022\rCamera-ready papers:            September 4, 2022\rConference:                     September 13 \xe2\x80\x93 15, 2022\r  =========================================================================\rTopics of interest are on a wide range of HW/SW aspects of ""Advanced\rComputing Architectures"" include (but are not limited to):\r Hardware Architectures\r* Control architectures for Quantum Computers\r* (3D) System-on-chip\r* Distributed systems\r* Multi- and many-core architectures\r* Heterogeneous computing\r* (Runtime) reconfigurable architectures\r* Advanced computing architectures\r Emerging memory technologies\r* Programming Models and Runtime Environments\r* Quantum programming languages, quantum compilers and optimizers\r* Domain-specific languages and programming models\r* Operating systems, hypervisors and middleware for homogeneous and\r  heterogeneous multi-/many-core computing platforms\r* System management including but not limited to scheduling, memory\r  management, power/thermal management, and RTOS\r* Architecture specific code generation and optimization\r* New tools for architectural simulation\r Cross-sectional Topics\r* Adaptive systems (energy aware, self-x technologies)\r* Pervasive systems\r* Autonomous systems\r* Mixed-criticality systems\r* Organic Computing\r* Approximate Computing\r* Support for safety and security\r  =========================================================================\rSubmission guidelines:\r Authors are invited to submit original, unpublished research papers via\rEasyChair: https://easychair.org/conferences/?conf=arcs2022\rARCS 2022 uses a double-blind reviewing system. Manuscripts must not\ridentify authors or their affiliation. When citing own work, it must be\rdone in a neutral form (i.e. avoiding ""our"", ""we"", ""previous work"" etc.).\rPapers must be submitted in PDF format, formatted according to Springer\rLNCS style and must not exceed 15 pages, including references, appendices\rand figures.\rDetails: https://arcs-conference.org/submission\r =========================================================================\rOrganizing Committee:\r General Co-Chairs\rCarsten Trinitis, Technical University of Munich Heilbronn, Germany\rMartin Schulz, Technical University of Munich, Germany\r Program Co-Chairs\rNikela Papadopoulou, Chalmers University of Technology, Sweden\rThilo Pionteck, Otto von Guericke University Magdeburg, Germany\r Workshop and Special Session Co-Chairs:\rStefan Lankes, RWTH Aachen, Germany\rJens Breitbart, Bosch Driver Assistance, Stuttgart, Germany\r Web and Publicity Chair\rLars Bauer, Karlsruhe Institute of Technology (KIT), Germany\r Publication Chair\rThilo Pionteck, Otto von Guericke University Magdeburg, Germany\r\n'","b'<div align=""left"" class=""cfp"">\n<table align=""center"" cellpadding=""0"" cellspacing=""0px"" width=""100%"">\n<tr valign=""top"">\n<td>\n<table align=""center"" cellpadding=""4"" cellspacing=""3"" width=""100%"">\n<tr><td>\n<a href=""/cfp/servlet/event.showcfp?eventid=164997"">DDECS 2023</a>\xc2\xa0\xc2\xa0\n26th International Symposium on Design and Diagnostics of Electronic Circuits and Systems, IEEE\n</td></tr>\n<tr><td>\n<a href=""/cfp/servlet/event.showcfp?eventid=115414"">ACM-EI/Scopus-ACAI 2022</a>\xc2\xa0\xc2\xa0\n2022 5th International Conference on Algorithms, Computing and Artificial Intelligence (ACAI 2022)-EI Compendex\n</td></tr>\n<tr><td>\n<a href=""/cfp/servlet/event.showcfp?eventid=163569"">CETA--Ei 2023</a>\xc2\xa0\xc2\xa0\n2023 2nd International Conference on Computer Engineering, Technologies and Applications (CETA 2023)\n</td></tr>\n<tr><td>\n<a href=""/cfp/servlet/event.showcfp?eventid=149128"">IJCSA 2022</a>\xc2\xa0\xc2\xa0\nInternational Journal on Computational Science &amp; Applications\n</td></tr>\n<tr><td>\n<a href=""/cfp/servlet/event.showcfp?eventid=166546"">ICWOC--Ei 2023</a>\xc2\xa0\xc2\xa0\n2023 11th International Conference on Intelligent Computing and Wireless Optical Communications (ICWOC 2023)\n</td></tr>\n<tr><td>\n<a href=""/cfp/servlet/event.showcfp?eventid=62259"">OpenSuCo @ ISC HPC 2017</a>\xc2\xa0\xc2\xa0\n2017 International Workshop on Open Source Supercomputing\n</td></tr>\n<tr><td>\n<a href=""/cfp/servlet/event.showcfp?eventid=151807"">Sensors journal 2022</a>\xc2\xa0\xc2\xa0\nSpecial Issue on Energy-Efficient Communication Networks and Systems\n</td></tr>\n<tr><td>\n<a href=""/cfp/servlet/event.showcfp?eventid=163173"">ICMV 2022</a>\xc2\xa0\xc2\xa0\nSPIE--2022 The 15th International Conference on Machine Vision (ICMV 2022)\n</td></tr>\n<tr><td>\n<a href=""/cfp/servlet/event.showcfp?eventid=166561"">CCAI 2023</a>\xc2\xa0\xc2\xa0\nIEEE--2023 3rd International Conference on Computer Communication and Artificial Intelligence (CCAI 2023)\n</td></tr>\n<tr><td>\n<a href=""/cfp/servlet/event.showcfp?eventid=153920"">ICCPR 2022</a>\xc2\xa0\xc2\xa0\nACM--2022 11th International Conference on Computing and Pattern Recognition (ICCPR 2022)\n</td></tr>\n</table>\n</td>\n</tr>\n</table>\n</div>'"
b'http://www.wikicfp.com/cfp/servlet/event.showcfp?eventid=164270',b'ACM SUI 2022',b'ACM Symposium on Spatial User Interaction (SUI) 2022',b'https://sui.acm.org/2022/',b'2022-12-01T00:00:00',b'2022-12-02T23:59:59',b'Virtual',"b'Aug 8, 2022'","b'Sep 21, 2022'","b'Oct 14, 2022'",,"b'\nCall for Papers: ACM Symposium on Spatial User Interaction (SUI) 2022\r Virtual Conference, December 1-2, 2022 (http://sui.acm.org/2022/)\r *** Paper submissions due August 8, 2022 (23:59 AoE)\r We invite you to participate in the ACM Symposium on Spatial User Interaction 2022 (SUI). SUI will be held December 1-2, 2022 (virtually). We seek original, unpublished papers documenting research contributions, practice and experience, or systems and novel applications, from all areas of spatial user interaction. User interface evaluations are strongly encouraged for every publication in this venue. Specific topics of interest include:\rSpatial interaction techniques\rSpatial user interface metaphors\rSpatial input devices and technology\rInteraction in mixed, augmented, and virtual reality\rEvaluation methods for spatial user interaction\rCollaborative interaction in 3D space\rDesign and user experience (UX) for spatial user interaction\rApplications of human spatial perception to interaction\rAdaptive and perceptual-inspired spatial user interaction\rApplications of spatial UIs, such as games, entertainment, CAD, education\rGesture-based spatial interaction\rTangible spatial user interaction\rMulti-touch technologies for spatial user interaction\rDesktop interfaces for spatial interaction\rMultisensory and other novel forms of spatial user interaction\rSystem Contributions - We invite many types of research contributions, including interactive systems. However, evaluating systems that are built using existing techniques can be difficult. For example, a system can be built using a known machine learning technique but it can enable entirely new functionality. In this case, reviewers will need to judge the novelty of the new functionality that the system enables without penalizing the work for leveraging an existing technique. For reference, here\xe2\x80\x99s a paper about evaluating interactive systems that reviewers and authors may want to familiarize themselves with: James Fogarty (2017): Code and Contribution in Interactive Systems Research (https://homes.cs.washington.edu/~jfogarty/publications/workshop-chi2017-codeandcontribution.pdf)\r Important Dates\r All deadlines are 23:59 AoE.\rSubmission deadline: 8 August 2022\rNotification: 21 September 2022 \rCamera Ready: 14 October 2022\r Submission Instructions\r The symposium invites full and short paper submissions. Papers are of variable length, which should match the level of detail of description for the research contribution.\rFull papers (normally 8 pages, maximum 10; excluding references) should describe research or design work within the scope of spatial user interaction.\rShort papers (up to 4 pages; excluding references) should address the same topic, but may include preliminary results or conceptual ideas.\rFor submission, please follow these instructions:\rSubmissions must not be previously published or accepted for publication elsewhere and must not be under review by any other publication venue during SUI 2022\xe2\x80\x99s reviewing period. Double submissions will be desk-rejected without review. In doubt, contact the program chairs or include a properly anonymized version of the competitive manuscript as supplementary materials.\r All submissions should be prepared in the ACM SIG Proceedings format (https://www.acm.org/publications/proceedings-template). For the Latex version, please use the sigconf template. We accept submissions in either dual-column or single-column ACM format; the page limits above are stated in dual-column format.\r Submitted papers must be anonymous for the double blind reviewing process. We strongly encourage you to not anonymize citations to your own works. These should not be omitted, but referenced in 3rd person. For example, you can write ""In a study by Jones et al. [1]..."" and reference your own paper, instead of ""In my previous work [1]..."", with the reference listed as ""[1] Blank for review.""\r Highly relevant references to accepted, but still unavailable (i.e., ""in press"") publications may be used, but should be included with author\xe2\x80\x99s permission as supplementary materials. These also must be anonymized!\r Submissions must be made through the online submission system. Please specify the following submission options:\rSociety: SIGCHI, Conference/Journal: SUI 2022, Track: SUI 2022 Papers\r(https://new.precisionconference.com/sui21a/)\r When designing and presenting user evaluations, please consider the following:\rUser interface evaluations using non-representative or homogeneous participant populations can lead to biased results and inaccurate conclusions.\r When performing user experiments, researchers should strive to use samples that are representative of the population for which the technology is being designed.\rIf non-representative samples are not possible to collect, the limitations of the population studied should be clearly discussed within the paper. \rIf non-representative samples are not possible to collect, care must be taken when making claims about the work.\r When reporting on user studies participant demographic information must be included so that future researchers understand the results based on the population studied. \r Publication\r Accepted work will be archived in the ACM Digital Library, and will be provided as open-access for the first month following the symposium. Please note that at least one author of each accepted submission will be required to register to present at the symposium. If no author is registered by the early registration deadline, the accepted work will be withdrawn from the proceedings and digital libraries.\r Please be informed of the following messages from ACM:\rBy submitting your article to an ACM Publication, you are hereby acknowledging that you and your co-authors are subject to all ACM Publications Policies, including ACM\'s new Publications Policy on Research Involving Human Participants and Subjects. Alleged violations of this policy or any ACM Publications Policy will be investigated by ACM and may result in a full retraction of your paper, in addition to other potential penalties, as per ACM Publications Policy.\r Please ensure that you and your co-authors obtain an ORCID ID, so you can complete the publishing process for your accepted paper. ACM has been involved in ORCID from the start and we have recently made a commitment to collect ORCID IDs from all of our published authors. The collection process has started and will roll out as a requirement throughout 2022. We are committed to improve author discoverability, ensure proper attribution and contribute to ongoing community efforts around name normalization; your ORCID ID will help in these efforts.\r Please visit https://sui.acm.org for the most up-to-date submission instructions and deadlines.\r Contact:\r Questions should be directed to the SUI 2022 Program Chair through email: \rprogram@sui.acm.org\rTabitha Peck, Davidson College, USA\rThammathip Piumsomboon, University of Canterbury, New Zealand\rBenjamin Weyers, University of Trier, Germany\rBest regards,\rTabitha, Tham, and Benni\r    \n'","b'<div align=""left"" class=""cfp"">\n<table align=""center"" cellpadding=""0"" cellspacing=""0px"" width=""100%"">\n<tr valign=""top"">\n<td>\n<table align=""center"" cellpadding=""4"" cellspacing=""3"" width=""100%"">\n<tr><td>\n<a href=""/cfp/servlet/event.showcfp?eventid=166563"">ACM ICHMI 2023</a>\xc2\xa0\xc2\xa0\nACM--2023 3rd International Conference on Human\xe2\x80\x93Machine Interaction (ICHMI 2023)\n</td></tr>\n<tr><td>\n<a href=""/cfp/servlet/event.showcfp?eventid=166564"">ICHMI 2023</a>\xc2\xa0\xc2\xa0\nACM--2023 3rd International Conference on Human\xe2\x80\x93Machine Interaction (ICHMI 2023)\n</td></tr>\n<tr><td>\n<a href=""/cfp/servlet/event.showcfp?eventid=166668"">PLDI 2023</a>\xc2\xa0\xc2\xa0\nThe 44th ACM SIGPLAN Conference on Programming Language Design and Implementation\n</td></tr>\n<tr><td>\n<a href=""/cfp/servlet/event.showcfp?eventid=158633"">ACM--ICAIP 2022</a>\xc2\xa0\xc2\xa0\nACM--2022 6th International Conference on Advances in Image Processing (ICAIP 2022)\n</td></tr>\n<tr><td>\n<a href=""/cfp/servlet/event.showcfp?eventid=166667"">ESEC/FSE 2023</a>\xc2\xa0\xc2\xa0\nThe ACM Joint European Software Engineering Conference and Symposium on the Foundations of Software Engineering\n</td></tr>\n<tr><td>\n<a href=""/cfp/servlet/event.showcfp?eventid=167734"">ACM ESCC 2023</a>\xc2\xa0\xc2\xa0\nACM--2023 European Symposium on Computer and Communications (ESCC 2023)\n</td></tr>\n<tr><td>\n<a href=""/cfp/servlet/event.showcfp?eventid=166671"">SIGMETRICS 2023</a>\xc2\xa0\xc2\xa0\nThe 2023 ACM SIGMETRICS (Winter Deadline)\n</td></tr>\n<tr><td>\n<a href=""/cfp/servlet/event.showcfp?eventid=163009"">IMIP 2023</a>\xc2\xa0\xc2\xa0\nACM--2023 5th International Conference on Intelligent Medicine and Image Processing (IMIP 2023)\n</td></tr>\n<tr><td>\n<a href=""/cfp/servlet/event.showcfp?eventid=165909"">ACM ICIIT 2023</a>\xc2\xa0\xc2\xa0\nACM--2023 8th International Conference on Intelligent Information Technology (ICIIT 2023)\n</td></tr>\n<tr><td>\n<a href=""/cfp/servlet/event.showcfp?eventid=167735"">ESCC 2023</a>\xc2\xa0\xc2\xa0\nACM--2023 European Symposium on Computer and Communications (ESCC 2023)\n</td></tr>\n</table>\n</td>\n</tr>\n</table>\n</div>'"
