identifier,title,description,source,startDate,endDate,locality,Submission Deadline,Notification Due,Final Version Due,Categories,Call For Papers,Related Resources
b'http://www.wikicfp.com/cfp/servlet/event.showcfp?eventid=164022',b'MLSC 2023',b'4th International Conference on Machine Learning and Soft Computing ',b'https://acsty2023.org/mlsc/index',b'2023-01-28T00:00:00',b'2023-01-29T23:59:59',"b'Copenhagen, Denmark'","b'Aug 27, 2022'","b'Oct 29, 2022'","b'Nov 5, 2028'",b'machine learning' b'soft computing' b'software engineering' b'data mining' ,"b'\n4th International Conference on Machine Learning and Soft Computing (MLSC 2023)January 28 ~ 29, 2023, Copenhagen, DenmarkCall for Papers4th International Conference on Machine Learning and Soft Computing (MLSC 2023) will provide an excellent international forum for sharing knowledge and results in theory, methodology and applications Machine learning and Soft Computing. The aim of the conference is to provide a platform to the researchers and practitioners from both academia as well as industry to meet and share cutting-edge development in the field.Authors are solicited to contribute to the conference by submitting articles that illustrate research results, projects, surveying works and industrial experiences that describe significant advances in the following areas, but are not limited to.Topics of Interest Machine Learning Analogical learning methods\rAutomated knowledge acquisition\rCase based methods\rClustering\rConnectionist networks\rEnsemble methods\rEvolution based methods\rExplanation based learning\rHybrid learning algorithms\rInductive logic programming\rLearning decision\rLearning from instruction\rLearning in integrated architectures\rMachine learning and information retrieval\rMachine learning and natural language processing\rMachine learning Applications\rMulti strategy, Multi agent learning\rProbabilistic networks\rRegression trees\rReinforcement learning\rStatistical models\rVisualization of patterns in data Soft Computing Data Mining & Information Retrieval\rData mining for Social Network Data\rExpert Systems\rFuzzy, Stochastic and Probabilistic computing\rIntelligent Software Agent Systems and Architectures\rIntelligent Systems\rMorphic Computing\rMulti objective optimization\rNeural computing\rPattern recognition\rPerception Based Intelligent Decision Systems\rSoft Computing and Agents\rSoft Computing and Pattern Recognition\rSoft Computing Applications\rSoft Computing for Big Data\rSoft Computing Fundamental and Optimization\rSoft Computing in Bio-mimetic Pattern Recognition\rSoft Computing in Computer Graphics, Animation\rSoft Computing Modeling for Perception and Intelligence\rAdvanced Soft Computing and Multi-Objective Evolutionary ComputingPaper SubmissionAuthors are invited to submit papers through the Conference  Submission System by August 27, 2022. Submissions must be  original and should not have been published previously or be under  consideration for publication while being evaluated for this conference. The proceedings of the conference will be published by Computer Science Conference Proceedings in Computer Science & Information Technology (CS&IT) series(Confirmed).Selected papers from MLSC 2023, after further revisions, will be published in the special issue of the following journalsMachine Learning and Applications: An International Journal (MLAIJ)International Journal on Soft Computing (IJSC)Information Technology in Industry (ITII)Important DatesSubmission Deadline: August 27, 2022Authors Notification: October 29, 2022Final Manuscript Due:  November 05, 2022'","b'<div align=""left"" class=""cfp"">\n<table align=""center"" cellpadding=""0"" cellspacing=""0px"" width=""100%"">\n<tr valign=""top"">\n<td>\n<table align=""center"" cellpadding=""4"" cellspacing=""3"" width=""100%"">\n<tr><td>\n<a href=""/cfp/servlet/event.showcfp?eventid=137130"">MLDM 2023</a>\xc2\xa0\xc2\xa0\n18th International Conference on Machine Learning and Data Mining\n</td></tr>\n<tr><td>\n<a href=""/cfp/servlet/event.showcfp?eventid=152256"">IJCNN 2023</a>\xc2\xa0\xc2\xa0\nInternational Joint Conference on Neural Networks\n</td></tr>\n<tr><td>\n<a href=""/cfp/servlet/event.showcfp?eventid=146828"">NLPTA 2022</a>\xc2\xa0\xc2\xa0\n3rd International Conference on NLP Techniques and Applications\n</td></tr>\n<tr><td>\n<a href=""/cfp/servlet/event.showcfp?eventid=155978"">IEEE ICA 2022</a>\xc2\xa0\xc2\xa0\nThe 6th IEEE International Conference on Agents\n</td></tr>\n<tr><td>\n<a href=""/cfp/servlet/event.showcfp?eventid=150581"">ACII 2022</a>\xc2\xa0\xc2\xa0\nAdvanced Computational Intelligence: An International Journal\n</td></tr>\n<tr><td>\n<a href=""/cfp/servlet/event.showcfp?eventid=147901"">NLTM 2023</a>\xc2\xa0\xc2\xa0\n3rd International Conference on NLP &amp; Text Mining \n</td></tr>\n<tr><td>\n<a href=""/cfp/servlet/event.showcfp?eventid=163215"">MLDM 2023</a>\xc2\xa0\xc2\xa0\n19th International Conference on Machine Learning and Data Mining\n</td></tr>\n</table>\n</td>\n</tr>\n</table>\n</div>'"
b'http://www.wikicfp.com/cfp/servlet/event.showcfp?eventid=164023',b'SOFE  2023',b'9th International Conference on Software Engineering',b'https://acsty2023.org/sofe/index',b'2023-01-28T00:00:00',b'2023-01-29T23:59:59',"b'Copenhagen, Denmark'","b'Aug 27, 2022'","b'Oct 29, 2022'","b'Nov 5, 2022'",b'software engineering' b'web' b'software' b'software testing' ,"b'\n9th  International Conference on Software Engineering (SOFE 2023) January 28 ~ 29, 2023, Copenhagen, Denmark Due to the current COVID-19 pandemic, registered authors are now able to present their work through our online platforms.Call for Papers9th  International Conference on Software Engineering (SOFE 2023)  will provide an excellent international forum for sharing knowledge and results in theory, methodology and applications of Software Engineering. The goal of this Conference is to bring together researchers and practitioners from academia and industry to focus on understanding Modern software engineering concepts and establishing new collaborations in these areas.Authors are solicited to contribute to the Conference by submitting articles that illustrate research results, projects, surveying works and industrial experiences that describe significant advances in the areas of software engineering & applications.Topics of Interest Advanced Topics in Software Engineering\rKnowledge-based Systems and Formal Methods\rLanguages and Formal Methods\rManaging Software Projects\rMultimedia and Visual Software Engineering\rQuality Management\rSearch Engines and Information Retrieval\rSoftware Engineering Decision Making\rSoftware Engineering Practice\rSoftware Maintenance and Testing\rSoftware Process\rWeb Engineering\rWeb-based Education Systems and Learning Applications\rEmerging Practices in Software Process & Architecture\rDevops Models, Practices, Challenges\rLean & Agile software Development & practices\rSoftware as a Service (Saas)Paper SubmissionAuthors are invited to submit papers through the Conference  Submission System by August 27, 2022. Submissions must be  original and should not have been published previously or be under  consideration for publication while being evaluated for this conference. The proceedings of the conference will be published by Computer Science Conference Proceedings in Computer Science & Information Technology (CS&IT) series(Confirmed).Selected papers from SOFE 2022, after further revisions, will be published in the special issue of the following journals International Journal of Software Engineering & Applications (IJSEA)Advanced Computing: An International Journal (ACIJ)Computer Science & Engineering: An International Journal (CSEIJ)Information Technology in Industry (ITII)Important DatesSubmission Deadline:August 27, 2022Authors Notification: October 29, 2022Final Manuscript Due:  November 05, 2022'","b'<div align=""left"" class=""cfp"">\n<table align=""center"" cellpadding=""0"" cellspacing=""0px"" width=""100%"">\n<tr valign=""top"">\n<td>\n<table align=""center"" cellpadding=""4"" cellspacing=""3"" width=""100%"">\n<tr><td>\n<a href=""/cfp/servlet/event.showcfp?eventid=163568"">CETA 2023</a>\xc2\xa0\xc2\xa0\n2023 2nd International Conference on Computer Engineering, Technologies and Applications (CETA 2023)\n</td></tr>\n<tr><td>\n<a href=""/cfp/servlet/event.showcfp?eventid=116287"">IEEE-Ei/Scopus-FSPSE 2022</a>\xc2\xa0\xc2\xa0\n[IEEE/EI/Scopus]2022 International Conference on Frontiers of Signal Processing and Software Engineering (FSPSE 2022)\n</td></tr>\n<tr><td>\n<a href=""/cfp/servlet/event.showcfp?eventid=166667"">ESEC/FSE 2023</a>\xc2\xa0\xc2\xa0\nThe ACM Joint European Software Engineering Conference and Symposium on the Foundations of Software Engineering\n</td></tr>\n<tr><td>\n<a href=""/cfp/servlet/event.showcfp?eventid=156554"">IEEE ICSTE 2022</a>\xc2\xa0\xc2\xa0\nIEEE--2022 12th International Conference on Software Technology and Engineering (ICSTE 2022)\n</td></tr>\n<tr><td>\n<a href=""/cfp/servlet/event.showcfp?eventid=166547"">IEEE ICCSN 2023</a>\xc2\xa0\xc2\xa0\nIEEE--2023 15th International Conference on Communication Software and Networks (ICCSN 2023)\n</td></tr>\n<tr><td>\n<a href=""/cfp/servlet/event.showcfp?eventid=152145"">MLDS 2022</a>\xc2\xa0\xc2\xa0\n3rd International Conference on Machine Learning Techniques and Data Science\n</td></tr>\n<tr><td>\n<a href=""/cfp/servlet/event.showcfp?eventid=166974"">AAMAS  2023</a>\xc2\xa0\xc2\xa0\nThe 22nd International Conference on Autonomous Agents and Multiagent Systems\n</td></tr>\n<tr><td>\n<a href=""/cfp/servlet/event.showcfp?eventid=166563"">ACM ICHMI 2023</a>\xc2\xa0\xc2\xa0\nACM--2023 3rd International Conference on Human\xe2\x80\x93Machine Interaction (ICHMI 2023)\n</td></tr>\n<tr><td>\n<a href=""/cfp/servlet/event.showcfp?eventid=152067"">AISO 2022</a>\xc2\xa0\xc2\xa0\n8th International Conference on Artificial Intelligence and Soft Computing\n</td></tr>\n<tr><td>\n<a href=""/cfp/servlet/event.showcfp?eventid=166560"">IEEE CCAI 2023</a>\xc2\xa0\xc2\xa0\nIEEE--2023 3rd International Conference on Computer Communication and Artificial Intelligence (CCAI 2023)\n</td></tr>\n</table>\n</td>\n</tr>\n</table>\n</div>'"
b'http://www.wikicfp.com/cfp/servlet/event.showcfp?eventid=164028',b'NIB 2022',b'1st Workshop on New IP and Beyond',b'https://newip-and-beyond.net/beyond22.html',b'2022-10-30T00:00:00',b'2022-11-02T23:59:59',"b'Lexington, Kentucky, USA'","b'Jul 31, 2022'","b'Aug 26, 2022'","b'Sep 8, 2022'",b'protocols' b'network architecture' b'high-precision communication' b'6G' ,"b'\nThere is a need to evolve fixed-network protocols to support 5G, B5G and to complement 6G technological research as the focus on communications shifts from general-purpose to large-scale special-purpose industry verticals, interconnecting different sites, suppliers, and clients. An extremely reliant, intelligent, and lean network will be required to ensure the efficiency of remote operations. It requires tighter integration with machine control applications in the cloud. Protocols for critical infrastructure and preparation for unforeseen events, such as COVID-19, natural disasters, unprecedented surges, and/or security breaches, etc. need to be designed and enhanced.\r We solicit stimulating, original, previously unpublished ideas on completed work, position papers, and/or work-in-progress papers in the form of extended abstracts. We invite submissions of concepts, designs, frameworks, and experiments on a wide range of topics of interest, including, but not limited to:\r - Semantic addressing and routing\r- High Precision Communications\r- Qualitative and/or Semantic Communications\r- Integration of Spatial and Terrestrial Networks\r- Energy Reduction in New IP\r- New Technologies for Networks in the Year 2030 and Beyond\r- Protocol and verification methods for disseminating KPIs for High Precision Communications.\r- Foundational theory, algorithms, and principles in the design of protocols in large-scale multistakeholder network architectures.\r- Theory and algorithms for lossless networking and lossless packet delivery\r- Resource efficiency and usage mechanisms for deterministic, reliable, and lossless data transmission\r- Privacy-preserving approaches\r- Monetization and Business models to be used by service providers\r\n'","b'<div align=""left"" class=""cfp"">\n<table align=""center"" cellpadding=""0"" cellspacing=""0px"" width=""100%"">\n<tr valign=""top"">\n<td>\n<table align=""center"" cellpadding=""4"" cellspacing=""3"" width=""100%"">\n<tr><td>\n<a href=""/cfp/servlet/event.showcfp?eventid=160915"">PDCAT 2022</a>\xc2\xa0\xc2\xa0\nThe 23rd International Conference on Parallel and Distributed Computing, Applications and Technologies\n</td></tr>\n<tr><td>\n<a href=""/cfp/servlet/event.showcfp?eventid=144978"">SWPACA: EO&amp;M Yellow King 2022</a>\xc2\xa0\xc2\xa0\nSpecial Panel: Beyond the Wall of Belief: The Hyper-real Metatextual Occulture of The King in Yellow : Area for Esotericism, Occultism, and Magic at the Southwest Popular/American \n</td></tr>\n<tr><td>\n<a href=""/cfp/servlet/event.showcfp?eventid=161209"">SI CFP IEEE OJ-COMS 2022</a>\xc2\xa0\xc2\xa0\nIntelligent Communication and Perceptual of Smart City Towards 6G: Emerging Trends and Challenges\n</td></tr>\n<tr><td>\n<a href=""/cfp/servlet/event.showcfp?eventid=137130"">MLDM 2023</a>\xc2\xa0\xc2\xa0\n18th International Conference on Machine Learning and Data Mining\n</td></tr>\n<tr><td>\n<a href=""/cfp/servlet/event.showcfp?eventid=165116"">xG Impact on IT and Systems 2022</a>\xc2\xa0\xc2\xa0\nxG Impact on Information Technology and Systems\n</td></tr>\n<tr><td>\n<a href=""/cfp/servlet/event.showcfp?eventid=163215"">MLDM 2023</a>\xc2\xa0\xc2\xa0\n19th International Conference on Machine Learning and Data Mining\n</td></tr>\n<tr><td>\n<a href=""/cfp/servlet/event.showcfp?eventid=167131"">JICT STD 2023</a>\xc2\xa0\xc2\xa0\nSpecial Issue on Cloud Native Security for 5G, 5G-A and 6G\n</td></tr>\n<tr><td>\n<a href=""/cfp/servlet/event.showcfp?eventid=137131"">MDA AI&amp;PR 2023</a>\xc2\xa0\xc2\xa0\n18th International Conference on Mass Data Analysis of Images and Signals with Applications in Medicine, r/g/b Biotechnology, Food Industries and Dietetics, Biometry and Security, \n</td></tr>\n<tr><td>\n<a href=""/cfp/servlet/event.showcfp?eventid=163176"">ICDM 2023</a>\xc2\xa0\xc2\xa0\n23th Industrial Conference on Data Mining\n</td></tr>\n<tr><td>\n<a href=""/cfp/servlet/event.showcfp?eventid=167670"">Social Media during COVID-19 &amp; MonkeyPox 2023</a>\xc2\xa0\xc2\xa0\nSPECIAL ISSUE: The Role of Social Media during the Ongoing Outbreaks of COVID-19 and Monkeypox: Applications, Use-Cases, Analytics, and Beyond\n</td></tr>\n</table>\n</td>\n</tr>\n</table>\n</div>'"
b'http://www.wikicfp.com/cfp/servlet/event.showcfp?eventid=164033',b'MLMHCIHCAMCI 2022',b'Machine Learning Methods in High-Content Imaging and High-Content Analysis for Molecular and Cellular Imaging',b'https://www.frontiersin.org/research-topics/40983/machine-learning-methods-in-high-content-imaging-and-high-content-analysis-for-molecular-and-cellula',,,,"b'Oct 5, 2022'","b'Nov 5, 2022'","b'Dec 5, 2022'",b'molecular imaging' b'cellular image analysis' b'machine learning' b'high-content analysis' ,"b'\nHigh-content imaging (HCI) and high-content analysis (HCA) provide flexible scalability to molecular and cellular research. Particularly, HCA is a method that is used in biological research and drug discovery to identify substances such as small molecules, peptides, or RNAi that alter the phenotype of a cell in a desired manner. Both HCI and HCA feature modules to tackle the specific research including objectives, filters, imaging modes, environmental conditions, etc. Due to the revolution limit, more influential tools are desired for cellular and molecular imaging. On the other hand, the imaging systems are to be supported by modern software tools (including the machine learning tools) with modularity to handle HCIs and HCAs that are characterized by tremendous molecular data.\r The living cell images along with software modules for HCA provide a quantum of cellular assays. These cellular assays increase the HCI\xe2\x80\x99s throughput and enable medical experts to reach new medical findings and conclusions. The advent of novel machine learning (ML) tools and algorithms enables the user to analyse a large volume of data and perform HCA. Successful applications include analysis of stimulated trans-fluor cells, BPAE cells and mitochondria cells, neurite outgrowth segmentation, spheroid segmentation, granular object detection, nuclear puncta cell mask, heterogeneous cell population, focal-adhesion segmentation, cell cycle measuring, neuron detection, etc. Machine learning (ML) is a multi-disciplinary and interdisciplinary science, which uses computers as tools and is committed to simulating human learning methods in real-time. Recently, ML has achieved great success in cellular/molecular analysis.\r This topic aims to report the recent advances in machine learning-guided HCI and HCA for molecular and cellular imaging addressing, but not limited to, the following themes:\r \xe2\x80\xa2 HCI systems\r \xe2\x80\xa2 Machine learning-related techniques in HCA\r \xe2\x80\xa2 Modularity in cellular/molecular imaging modes\r \xe2\x80\xa2 Statistical tools and data analytics in cellular/molecular imaging\r \xe2\x80\xa2 Prediction and classification algorithms for cellular/molecular imaging data\r \xe2\x80\xa2 Clinical diagnosis and treatment\r \xe2\x80\xa2 Neurite outgrowth segmentation\r \xe2\x80\xa2 Cell cycle measuring\r \xe2\x80\xa2 Exploration of cancer immunotherapy targets\r \xe2\x80\xa2 Cell metabolic analysis\r \n'","b'<div align=""left"" class=""cfp"">\n<table align=""center"" cellpadding=""0"" cellspacing=""0px"" width=""100%"">\n<tr valign=""top"">\n<td>\n<table align=""center"" cellpadding=""4"" cellspacing=""3"" width=""100%"">\n<tr><td>\n<a href=""/cfp/servlet/event.showcfp?eventid=137130"">MLDM 2023</a>\xc2\xa0\xc2\xa0\n18th International Conference on Machine Learning and Data Mining\n</td></tr>\n<tr><td>\n<a href=""/cfp/servlet/event.showcfp?eventid=164034"">MLMHCIHCAMCI 2022</a>\xc2\xa0\xc2\xa0\nMachine Learning Methods in High-Content Imaging and High-Content Analysis for Molecular and Cellular Imaging\n</td></tr>\n<tr><td>\n<a href=""/cfp/servlet/event.showcfp?eventid=152256"">IJCNN 2023</a>\xc2\xa0\xc2\xa0\nInternational Joint Conference on Neural Networks\n</td></tr>\n<tr><td>\n<a href=""/cfp/servlet/event.showcfp?eventid=166197"">MIIP 2023</a>\xc2\xa0\xc2\xa0\nMedical Imaging &amp; Image Processing III\n</td></tr>\n<tr><td>\n<a href=""/cfp/servlet/event.showcfp?eventid=151014"">ISIR-eCom 2022</a>\xc2\xa0\xc2\xa0\nINTERACTIVE AND SCALABLE INFORMATION RETRIEVAL METHODS FOR ECOMMERCE ((conjunction with WSDM 2022)\n</td></tr>\n<tr><td>\n<a href=""/cfp/servlet/event.showcfp?eventid=163191"">ECIR 2023</a>\xc2\xa0\xc2\xa0\n45th European Conference on Information Retrieval\n</td></tr>\n<tr><td>\n<a href=""/cfp/servlet/event.showcfp?eventid=146828"">NLPTA 2022</a>\xc2\xa0\xc2\xa0\n3rd International Conference on NLP Techniques and Applications\n</td></tr>\n</table>\n</td>\n</tr>\n</table>\n</div>'"
b'http://www.wikicfp.com/cfp/servlet/event.showcfp?eventid=164034',b'MLMHCIHCAMCI 2022',b'Machine Learning Methods in High-Content Imaging and High-Content Analysis for Molecular and Cellular Imaging',b'https://www.frontiersin.org/research-topics/40983/machine-learning-methods-in-high-content-imaging-and-high-content-analysis-for-molecular-and-cellula',,,,"b'Oct 5, 2022'","b'Nov 5, 2022'","b'Dec 5, 2022'",b'molecular imaging' b'cellular image analysis' b'machine learning' b'high-content analysis' ,"b'\nHigh-content imaging (HCI) and high-content analysis (HCA) provide flexible scalability to molecular and cellular research. Particularly, HCA is a method that is used in biological research and drug discovery to identify substances such as small molecules, peptides, or RNAi that alter the phenotype of a cell in a desired manner. Both HCI and HCA feature modules to tackle the specific research including objectives, filters, imaging modes, environmental conditions, etc. Due to the revolution limit, more influential tools are desired for cellular and molecular imaging. On the other hand, the imaging systems are to be supported by modern software tools (including the machine learning tools) with modularity to handle HCIs and HCAs that are characterized by tremendous molecular data.\r The living cell images along with software modules for HCA provide a quantum of cellular assays. These cellular assays increase the HCI\xe2\x80\x99s throughput and enable medical experts to reach new medical findings and conclusions. The advent of novel machine learning (ML) tools and algorithms enables the user to analyse a large volume of data and perform HCA. Successful applications include analysis of stimulated trans-fluor cells, BPAE cells and mitochondria cells, neurite outgrowth segmentation, spheroid segmentation, granular object detection, nuclear puncta cell mask, heterogeneous cell population, focal-adhesion segmentation, cell cycle measuring, neuron detection, etc. Machine learning (ML) is a multi-disciplinary and interdisciplinary science, which uses computers as tools and is committed to simulating human learning methods in real-time. Recently, ML has achieved great success in cellular/molecular analysis.\r This topic aims to report the recent advances in machine learning-guided HCI and HCA for molecular and cellular imaging addressing, but not limited to, the following themes:\r \xe2\x80\xa2 HCI systems\r\xe2\x80\xa2 Machine learning-related techniques in HCA\r\xe2\x80\xa2 Modularity in cellular/molecular imaging modes\r\xe2\x80\xa2 Statistical tools and data analytics in cellular/molecular imaging\r\xe2\x80\xa2 Prediction and classification algorithms for cellular/molecular imaging data\r\xe2\x80\xa2 Clinical diagnosis and treatment\r\xe2\x80\xa2 Neurite outgrowth segmentation\r\xe2\x80\xa2 Cell cycle measuring\r\xe2\x80\xa2 Exploration of cancer immunotherapy targets\r\xe2\x80\xa2 Cell metabolic analysis\r Participating Journals\r\xe2\x80\xa2 Frontiers in Cell and Developmental Biology\r\xe2\x80\xa2 Frontiers in Big Data\r\xe2\x80\xa2 Frontiers in Artificial Intelligence\r\xe2\x80\xa2 Frontiers in Molecular Biosciences\r\n'","b'<div align=""left"" class=""cfp"">\n<table align=""center"" cellpadding=""0"" cellspacing=""0px"" width=""100%"">\n<tr valign=""top"">\n<td>\n<table align=""center"" cellpadding=""4"" cellspacing=""3"" width=""100%"">\n<tr><td>\n<a href=""/cfp/servlet/event.showcfp?eventid=137130"">MLDM 2023</a>\xc2\xa0\xc2\xa0\n18th International Conference on Machine Learning and Data Mining\n</td></tr>\n<tr><td>\n<a href=""/cfp/servlet/event.showcfp?eventid=164033"">MLMHCIHCAMCI 2022</a>\xc2\xa0\xc2\xa0\nMachine Learning Methods in High-Content Imaging and High-Content Analysis for Molecular and Cellular Imaging\n</td></tr>\n<tr><td>\n<a href=""/cfp/servlet/event.showcfp?eventid=152256"">IJCNN 2023</a>\xc2\xa0\xc2\xa0\nInternational Joint Conference on Neural Networks\n</td></tr>\n<tr><td>\n<a href=""/cfp/servlet/event.showcfp?eventid=166197"">MIIP 2023</a>\xc2\xa0\xc2\xa0\nMedical Imaging &amp; Image Processing III\n</td></tr>\n<tr><td>\n<a href=""/cfp/servlet/event.showcfp?eventid=151014"">ISIR-eCom 2022</a>\xc2\xa0\xc2\xa0\nINTERACTIVE AND SCALABLE INFORMATION RETRIEVAL METHODS FOR ECOMMERCE ((conjunction with WSDM 2022)\n</td></tr>\n<tr><td>\n<a href=""/cfp/servlet/event.showcfp?eventid=163191"">ECIR 2023</a>\xc2\xa0\xc2\xa0\n45th European Conference on Information Retrieval\n</td></tr>\n<tr><td>\n<a href=""/cfp/servlet/event.showcfp?eventid=146828"">NLPTA 2022</a>\xc2\xa0\xc2\xa0\n3rd International Conference on NLP Techniques and Applications\n</td></tr>\n</table>\n</td>\n</tr>\n</table>\n</div>'"
