identifier,title,description,source,startDate,endDate,locality,Submission Deadline,Notification Due,Final Version Due,Categories,Call For Papers,Related Resources
b'http://www.wikicfp.com/cfp/servlet/event.showcfp?eventid=163858',b'IC4E 2022',"b'Online International Conference on E-Education, E-Business, E-Management and E-Learning (IC4E 2022)'",b'http://rppf.42web.io/ic4e-22-8-22/',b'2022-08-22T00:00:00',b'2022-08-22T23:59:59',"b'Frankfurt, Germany (and Online)'","b'Jul 18, 2022'",,,b'e-education' b'e-business' b'e-management' b'e-learning ' ,"b'\nRPPF aims to provide an opportunity to academics and practitioners around the world to discuss and share the contemporary issues of business and social science research.\rIf you are unable to attend the conference, you may still join the community and submit your article for peer review and possible publication, upload an online presentation, and enjoy subscriber access to the journal.\rThe conference welcomes empirical research as well as theoretical/conceptual research papers having potential for field applications and in-depth literature reviews. Broadly defined, but not limited to, tracks of the conference are:\rE-Education: Systems, Design and Technologies | Practices and cases in e-education | Systems and technologies in e-education | Applications and integration of e-education | e-learning evaluation and content | Campus information systems | e-learning technologies, standards and systems | Mobile learning | Computer aided assessments | Knowledge management | Virtual learning environments | Multimedia in e-learning | Marketing and promoting e-learning | Social benefits of e-learning | Organization learning | Technology adoption and diffusion of e-learning | Other relative topics.\rE-Learning: Systems, Design and Technologies | e-Learning platforms | portals and Virtual learning | environments | Course design | Emerging and best practices | Partnerships in e-Learning | Evaluation of e-Learning | Cross-cultural | education | e-Learning strategies | Social benefits of e-Learning | e-Learning effectiveness and outcomes | Web-based learning | Academic participation and freedom | Learner autonomy | Security and confidentiality | Self-learning integrated methodology | Ambient intelligence | Assertive and assistive educational technology | Computer-aided assessment | Learning content management systems | AV-communication and other media | Digital classrooms | Blended learning | Collaborative on-line learning | Content repositories | Data envelopment analysis | Meta data standards | Ontologies | Pedagogical models | Needs analysis | other relative topics e-Commerce | Business-to-business e-commerce | Business-to-consumer e-commerce | E-government, policy and law | Business/Enterprise Architectures | Mobile and pervasive commerce | Electronic Markets and Multiagent Systems | Semantic Web ontologies, rules and services | Digital goods and products | e-Negotiations, auctioning and contracting | B2B, B2C, and C2C models | Agent-mediated e-Commerce | e-Marketplaces, e-Hubs, and portals | Pervasive technologies for eCommerce | Dynamic pricing models | P2P-computing for e-Commerce | e-Payment systems | e-Commerce content management | Consumer protection in eCommerce | User behavior modeling.\rE-Business: Innovative business models | Enterprise application integration | Business process re-engineering | Virtual enterprises and virtual markets | Supply, demand, and value chains | Virtual organizations and coalitions | Customer relationship management | e-Collaboration and e-Services | Inter-organizational systems | Future work environments for e-Business | Business process integration | e-Work | Inter-workflow | Mobile business.\rE-Service: Web Services, Grid Services and Service-Oriented Computing | Semantic Web and Ontology | Web Intelligence, Agents and Personalization | Pervasive, Mobile and Peer-to-Peer Computing Technologies | Context-Aware, Location-based and Autonomous Computing | Security, Privacy, Trust and Reputation for e/m-Services | Payment Technologies for e/m-Services | Middleware for e/m-Services.\n\t'","b'<div align=""left"" class=""cfp"">\n<table align=""center"" cellpadding=""0"" cellspacing=""0px"" width=""100%"">\n<tr valign=""top"">\n<td>\n<table align=""center"" cellpadding=""4"" cellspacing=""3"" width=""100%"">\n<tr><td>\n<a href=""/cfp/servlet/event.showcfp?eventid=167696"">IC4E--Ei 2023</a>\xc2\xa0\xc2\xa0\n2023 14th International Conference on E-Education, E-Business, E-Management and E-Learning (IC4E 2023)\n</td></tr>\n<tr><td>\n<a href=""/cfp/servlet/event.showcfp?eventid=158592"">IJIST 2022</a>\xc2\xa0\xc2\xa0\nInternational Journal of Information Sciences and Techniques\n</td></tr>\n<tr><td>\n<a href=""/cfp/servlet/event.showcfp?eventid=165460"">ACM ICEEG 2023</a>\xc2\xa0\xc2\xa0\nACM--2023 7th International Conference on E-commerce, E-Business and E-Government (ICEEG 2023)\n</td></tr>\n<tr><td>\n<a href=""/cfp/servlet/event.showcfp?eventid=164523"">ICEPS 2023</a>\xc2\xa0\xc2\xa0\n2023 10th International Conference on Education and Psychological Sciences (ICEPS 2023)\n</td></tr>\n<tr><td>\n<a href=""/cfp/servlet/event.showcfp?eventid=167695"">IC4E 2023</a>\xc2\xa0\xc2\xa0\n2023 14th International Conference on E-Education, E-Business, E-Management and E-Learning (IC4E 2023)\n</td></tr>\n<tr><td>\n<a href=""/cfp/servlet/event.showcfp?eventid=157600"">ICETC 2022</a>\xc2\xa0\xc2\xa0\nACM--2022 14th International Conference on Education Technology and Computers (ICETC 2022)\n</td></tr>\n<tr><td>\n<a href=""/cfp/servlet/event.showcfp?eventid=163560"">ICAIE 2023</a>\xc2\xa0\xc2\xa0\n2023 3rd International Conference on Artificial Intelligence in Education (ICAIE 2023)\n</td></tr>\n<tr><td>\n<a href=""/cfp/servlet/event.showcfp?eventid=163562"">ICEIT 2023</a>\xc2\xa0\xc2\xa0\n2023 12th International Conference on Educational and Information Technology (ICEIT 2023)\n</td></tr>\n<tr><td>\n<a href=""/cfp/servlet/event.showcfp?eventid=156670"">IEEE--WAIE 2022</a>\xc2\xa0\xc2\xa0\nIEEE--2022 4th International Workshop on Artificial Intelligence and Education (WAIE 2022)\n</td></tr>\n<tr><td>\n<a href=""/cfp/servlet/event.showcfp?eventid=167439"">ITET 2023</a>\xc2\xa0\xc2\xa0\n2023 4th International Conference on Information Technology and Education Technology (ITET 2023)\n</td></tr>\n</table>\n</td>\n</tr>\n</table>\n</div>'"
b'http://www.wikicfp.com/cfp/servlet/event.showcfp?eventid=163859',b'IEFBC 2022',"b'International Economics, Finance & Business Conference Dubai (IEFBC 2022)'",b'http://enar-conf.rf.gd/iefbc-23-aug-2022/',b'2022-08-23T00:00:00',b'2022-08-23T23:59:59',"b'Dubai, UAE'","b'Jul 19, 2022'",,,b'economics' b'finance' b'business' ,"b'\nCall for papers/Topics\r Eurasian Network for Academic Research (ENAR) invites scholars, researchers, practitioners, and student proposals to submit papers for paper presentations, interactive sessions, virtual talks, or colloquia addressing one of the following tracks & topics. \r If you are unable to attend the conference, you may still join the community and submit your article for peer review and possible publication, upload an online presentation, and enjoy subscriber access to the journal.\r The topic includes but not limited to:\r Economy, Finance, and Business | Accounting | Behavioral Finance | Consumer Behavior | Corporate Finance | Corporate Governance | Derivatives and Financial Engineering | Economics | Financial and Banking | Financial Econometrics | Financial Marketing and Financial | Game Theory | Human Resource Management | Industrial Economics | International Business | International Financial Management | International Trade: Theory and Policy | Labor Economics | Marketing | Mathematical Statistics | Neuroeconomics | Portfolio Theory and Management | Public Economics | Risk Management | Supply Chain Management.\n\t'","b'<div align=""left"" class=""cfp"">\n<table align=""center"" cellpadding=""0"" cellspacing=""0px"" width=""100%"">\n<tr valign=""top"">\n<td>\n<table align=""center"" cellpadding=""4"" cellspacing=""3"" width=""100%"">\n<tr><td>\n<a href=""/cfp/servlet/event.showcfp?eventid=58503"">ICEFS 2022</a>\xc2\xa0\xc2\xa0\n\xe3\x80\x90WOS\xe3\x80\x91\xe3\x80\x90Scopus\xe3\x80\x912022 10th International Conference on Economics, Finance and Statistics\n</td></tr>\n<tr><td>\n<a href=""/cfp/servlet/event.showcfp?eventid=165461"">ICEFR 2023</a>\xc2\xa0\xc2\xa0\n2023 12th International Conference on Economics and Finance Research (ICEFR 2023)\n</td></tr>\n<tr><td>\n<a href=""/cfp/servlet/event.showcfp?eventid=153925"">ICAAF 2022</a>\xc2\xa0\xc2\xa0\n2022 2nd International Conference on Accounting, Auditing and Finance (ICAAF 2022)\n</td></tr>\n<tr><td>\n<a href=""/cfp/servlet/event.showcfp?eventid=155149"">IJHAS 2022</a>\xc2\xa0\xc2\xa0\nInternational Journal of Humanities, Art and Social Studies\n</td></tr>\n<tr><td>\n<a href=""/cfp/servlet/event.showcfp?eventid=167101"">FEMIB 2023</a>\xc2\xa0\xc2\xa0\n5th International Conference on Finance, Economics, Management and IT Business\n</td></tr>\n<tr><td>\n<a href=""/cfp/servlet/event.showcfp?eventid=158771"">EPEAI 2023</a>\xc2\xa0\xc2\xa0\nAI in Business and Economics - The Economic Perspective on Artificial Intelligence\n</td></tr>\n<tr><td>\n<a href=""/cfp/servlet/event.showcfp?eventid=155763"">ICBIF 2022</a>\xc2\xa0\xc2\xa0\n2022 International Conference on Business, Information and Finance \n</td></tr>\n<tr><td>\n<a href=""/cfp/servlet/event.showcfp?eventid=153926"">ICBMG 2022</a>\xc2\xa0\xc2\xa0\n2022 The 10th International Conference on Business, Management and Governance (ICBMG 2022)\n</td></tr>\n<tr><td>\n<a href=""/cfp/servlet/event.showcfp?eventid=165782"">ICMBE 2022</a>\xc2\xa0\xc2\xa0\n11th International Conference on Management, Business and Economics - HIBRID\n</td></tr>\n<tr><td>\n<a href=""/cfp/servlet/event.showcfp?eventid=95801"">ICAS 2022</a>\xc2\xa0\xc2\xa0\n10th International Conference on Asian Studies 2022\n</td></tr>\n</table>\n</td>\n</tr>\n</table>\n</div>'"
b'http://www.wikicfp.com/cfp/servlet/event.showcfp?eventid=163860',b'ICESTM 2022',"b'Engineering, Science, Technology & Management 2022 International Conference (ICESTM)'",b'http://ssr-global.freecluster.eu/icestm-24aug/',b'2022-08-24T00:00:00',b'2022-08-24T23:59:59',"b'Abu Dhabi, UAE'","b'Jul 20, 2022'",,,b'engineering' b'sciences' b'technology' b'management' ,"b'\nSSR Global Conference invites scholars, researchers, practitioners, and students proposals to submit papers for paper presentations, interactive sessions, virtual talks, or colloquia addressing one of the following tracks & topics.\rIf you are unable to attend the conference, you may still join the community and submit your article for peer review and possible publication, upload an online presentation, and enjoy subscriber access to the journal.\rBroadly, the main areas of inquiry include the followings Topics but not limited to:\rThe topic includes but not limited to:\rBasic Science: Advanced Chemistry | Advanced Numerical Algorithms | Applications of Computation as a Scientific Paradigm  | Computational Physics & Biology | Cryptography | Crystal Growth of Advanced Materials | Mathematical Modeling | Quantum computation.\rLife Science Engineering: Advancements in Medical Technology | Bio-Engineering | Bio-medical Engineering | Bio-Nanotechnology | Medical Imaging | Robotics and Rehabilitation.\rCivil Engineering: Bridge and Tunnel Engineering | Building Energy Conservation and Green Architecture | Geotechnical Engineering | High-rise Structure and Large-span Structure | Modern Trends in Civil Engineering  | Municipal Engineering | Town Planning | Transportation Engineering | Water Resource Engineering.\rManagement: Business communication | Business Statistics | E-Commerce Technologies | Enterprise Resource Planning | Financial and Management Accounting | Financial Management | HR Management | Marketing Management | Retail Management | Strategic Management.\rComputer Science and Applications: Algorithms and data structures | Artificial Intelligence | Computational Complexity, Economics, Geometry | Computer Networks | Natural Language Processing | Program semantics and verification | Software Engineering | Theoretical Computer Science & Algebra.\rMechanical Engineering: Automobile Engineering | Avionics | Design and Manufacturing Engineering | Industrial and Systems Engineering | Materials Science and Engineering | Mechatronics and Automation | Production Technology | Textile and Leather Technology.\rElectrical Engineering: Electric Drives and Control | Electrical Machines | Electricity Market in Smart Grid | Instrumentation Engineering | Power Generation, Transmission and Distribution | Power System Engineering & its applications | Renewable Power Generation and its Efficient Utilization | Smart Grids Technologies & Applications.\rOil, Gas, Energy & Mining Engineering: Alternative Energy | Drilling and Completion Technology | Energy Demand & Supply | Energy Sector opportunities & Challenges | Environmental & Health Aspects | Geo-science | Metal Mining | Resource Utilization Issues.\rICT: Cloud Computing | Communication Networks & Security | Information Theory | Machine Learning | Network Management | Next Generation Networks |Parallel and distributed computing | Signal Processing | Software Engineering.\n\t'","b'<div align=""left"" class=""cfp"">\n<table align=""center"" cellpadding=""0"" cellspacing=""0px"" width=""100%"">\n<tr valign=""top"">\n<td>\n<table align=""center"" cellpadding=""4"" cellspacing=""3"" width=""100%"">\n<tr><td>\n<a href=""/cfp/servlet/event.showcfp?eventid=166305"">ICII 2023</a>\xc2\xa0\xc2\xa0\n2023 9th International Conference on Information Management and Industrial Engineering (ICII 2023)\n</td></tr>\n<tr><td>\n<a href=""/cfp/servlet/event.showcfp?eventid=58503"">ICEFS 2022</a>\xc2\xa0\xc2\xa0\n\xe3\x80\x90WOS\xe3\x80\x91\xe3\x80\x90Scopus\xe3\x80\x912022 10th International Conference on Economics, Finance and Statistics\n</td></tr>\n<tr><td>\n<a href=""/cfp/servlet/event.showcfp?eventid=165450"">EEIT 2023</a>\xc2\xa0\xc2\xa0\n2023 3rd International Conference on Engineering Education and Information Technology (EEIT 2023)\n</td></tr>\n<tr><td>\n<a href=""/cfp/servlet/event.showcfp?eventid=153043"">EDUPT 2022</a>\xc2\xa0\xc2\xa0\nInternational Conference on Education, Pedagogy and Technology\n</td></tr>\n<tr><td>\n<a href=""/cfp/servlet/event.showcfp?eventid=166826"">SPIE DCS 2023</a>\xc2\xa0\xc2\xa0\nSPIE Defense + Commercial Sensing 2023\n</td></tr>\n<tr><td>\n<a href=""/cfp/servlet/event.showcfp?eventid=153664"">AIAA 2022</a>\xc2\xa0\xc2\xa0\n12th International Conference on Artificial Intelligence, Soft Computing and Applications\n</td></tr>\n<tr><td>\n<a href=""/cfp/servlet/event.showcfp?eventid=165456"">ICMT 2023</a>\xc2\xa0\xc2\xa0\n2023 International Conference on Metaverse Technology (ICMT 2022)\n</td></tr>\n<tr><td>\n<a href=""/cfp/servlet/event.showcfp?eventid=116286"">IEEE-Ei/Scopus-CISDS 2022</a>\xc2\xa0\xc2\xa0\n2022 International Conference on Frontiers of Communications, Information System and Data Science (CISDS 2022)-EI Compendex\n</td></tr>\n<tr><td>\n<a href=""/cfp/servlet/event.showcfp?eventid=166806"">ACBT--EI 2023</a>\xc2\xa0\xc2\xa0\n2023 Asia Conference on Blockchain Technologies (ACBT 2023)\n</td></tr>\n<tr><td>\n<a href=""/cfp/servlet/event.showcfp?eventid=162766"">ICCES--EI, Scopus 2023</a>\xc2\xa0\xc2\xa0\nThe 29th International Conference on Computational &amp; Experimental Engineering and Sciences\n</td></tr>\n</table>\n</td>\n</tr>\n</table>\n</div>'"
b'http://www.wikicfp.com/cfp/servlet/event.showcfp?eventid=163861',b'Materials  2023',b'4th Edition of International Conference on Materials Science and Engineering',b'https://magnusconferences.com/materials-science/',b'2023-03-13T00:00:00',b'2023-03-15T23:59:59',b'Singapore',b'TBD',,,,"b'\nAfter achieving resounding success in our previous conference, we have colossal delight in inviting you to our \xe2\x80\x9c4th Edition of International Conference on Materials Science and Engineering\xe2\x80\x9d Materials 2023 which is a HYBRID EVENT scheduled on March 13-15, 2023 in Singapore.\rThe Materials Conference deliberations will be on the theme \xe2\x80\x9cShaping Future by Combining Knowledge and Innovations in Material Science.\xe2\x80\x9d\rMaterials research and manufacturing technology innovations are important indicators of the modern high-tech revolution. This International Material Science Conference is focused solely on the development and characterization of novel materials and the latest production process trends. This prestigious materials conference will gather industry experts, academicians, material scientists and researchers of matching interests from across the national and international countries, through panels and lectures, plenary sessions, oral papers and poster presentations, to share their research experiences and research efforts. Materials and engineering conferences are known in the field of materials science for the dissemination of knowledge, the exchange of research ideas of specific methodologies and subjects. Our experienced honorary speakers will present you with the latest information, and you will become more educated and energetic than you possibly imagined.\rReach us at: \rContact Email: materials@magnusconference.com\rPhone: +1 (702) 988-2320\rWhatsApp: +1 (540) 709 1879\rDates: March 13-15, 2023\rVenue: Singapore \rWebsite: https://magnusconferences.com/materials-science/\rAbstract submission: https://magnusconferences.com/materials-science/submit-abstract \rRegistration: https://magnusconferences.com/materials-science/register \r Social Media Link: \rFacebook: https://www.facebook.com/MaterialsConf/ \rTwitter: https://twitter.com/MatScienceEvent \rYouTube: https://www.youtube.com/channel/UCLtH0EIiRfFWaIOwuYL5IEw \r  Organiser:\rMagnus Group LLC - https://www.magnusgroup.org/ \rConference Manager: Amelie Alice\rOrganiser Address: Magnus Group LLC\r                                   150 South Wacker Drive #2400\r                                  Chicago, IL 60606, US\r Materials Science Conferences 2023 | Materials Conference 2023 | Materials Science and Engineering Events 2023 | Materials Congress 2023 | Materials Science Conferences | Materials Conference 2023 | Materials Science Events | Materials 2023 | Materials Science and Engineering Conferences | Material Science Congress | Material Science Conference 2023 | Materials Conference | Metallurgy Congress 2023 | USA Material Science Conference | Metallurgy and Materials Conference | Metallurgy conference 2023 | Minerals conference 2023 | Materials 2023 conference | International Material Science Conference | Material Science and Technology | Minerals conference\r\n'","b'<div align=""left"" class=""cfp"">\n<table align=""center"" cellpadding=""0"" cellspacing=""0px"" width=""100%"">\n<tr valign=""top"">\n<td>\n<table align=""center"" cellpadding=""4"" cellspacing=""3"" width=""100%"">\n<tr><td>\n<a href=""/cfp/servlet/event.showcfp?eventid=162766"">ICCES--EI, Scopus 2023</a>\xc2\xa0\xc2\xa0\nThe 29th International Conference on Computational &amp; Experimental Engineering and Sciences\n</td></tr>\n<tr><td>\n<a href=""/cfp/servlet/event.showcfp?eventid=161050"">FATD 2023</a>\xc2\xa0\xc2\xa0\nInternational Conference on Fatigue Damage of Structural Materials XIII\n</td></tr>\n<tr><td>\n<a href=""/cfp/servlet/event.showcfp?eventid=166563"">ACM ICHMI 2023</a>\xc2\xa0\xc2\xa0\nACM--2023 3rd International Conference on Human\xe2\x80\x93Machine Interaction (ICHMI 2023)\n</td></tr>\n<tr><td>\n<a href=""/cfp/servlet/event.showcfp?eventid=161117"">ICBMC 2023</a>\xc2\xa0\xc2\xa0\n2023 8th International Conference on Building Materials and Construction (ICBMC 2023)\n</td></tr>\n<tr><td>\n<a href=""/cfp/servlet/event.showcfp?eventid=166560"">IEEE CCAI 2023</a>\xc2\xa0\xc2\xa0\nIEEE--2023 3rd International Conference on Computer Communication and Artificial Intelligence (CCAI 2023)\n</td></tr>\n<tr><td>\n<a href=""/cfp/servlet/event.showcfp?eventid=151985"">ICFMCE 2022</a>\xc2\xa0\xc2\xa0\n2022 International Conference on Functional Materials and Chemical Engineering(ICFMCE 2022)\n</td></tr>\n<tr><td>\n<a href=""/cfp/servlet/event.showcfp?eventid=165450"">EEIT 2023</a>\xc2\xa0\xc2\xa0\n2023 3rd International Conference on Engineering Education and Information Technology (EEIT 2023)\n</td></tr>\n<tr><td>\n<a href=""/cfp/servlet/event.showcfp?eventid=161116"">ICBMC--EI, Scopus 2023</a>\xc2\xa0\xc2\xa0\n2023 8th International Conference on Building Materials and Construction (ICBMC 2023)--EI Compendex, Scopus\n</td></tr>\n<tr><td>\n<a href=""/cfp/servlet/event.showcfp?eventid=163508"">ICCMME--Ei 2023</a>\xc2\xa0\xc2\xa0\n2023 The 8th International Conference on Composite Materials and Material Engineering (ICCMME 2023)\n</td></tr>\n<tr><td>\n<a href=""/cfp/servlet/event.showcfp?eventid=163509"">ICCMME 2023</a>\xc2\xa0\xc2\xa0\n2023 The 8th International Conference on Composite Materials and Material Engineering (ICCMME 2023)\n</td></tr>\n</table>\n</td>\n</tr>\n</table>\n</div>'"
