identifier,title,description,source,startDate,endDate,locality,Submission Deadline,Notification Due,Final Version Due,Categories,Call For Papers,Related Resources
b'http://www.wikicfp.com/cfp/servlet/event.showcfp?eventid=164408',b'FATESys 2022',"b'Second ACM SIGEnergy Workshop on Fair, Accountable, Transparent, and Ethical (FATE) AI for Smart Environments and Energy Systems'",b'https://fatesys.github.io/2022/',b'2022-11-09T00:00:00',b'2022-11-10T23:59:59',"b'Boston, Massachusetts, USA'","b'Sep 16, 2022'","b'Sep 30, 2022'","b'Oct 7, 2022'",b'fairness' b'interpretability' b'AI/ML' b'built environments' ,"b'\nWith the advent of IoT, high performance computing, and ubiquitous and smart sensing, the SenSys/BuildSys community is noticing a big shift in the adoption of data-driven black-box modeling (also referred to as AI) to solve problems in the space of smart environments and energy systems. As a result, these AI-enabled systems for smart buildings, smart cities, smart grids, electric transportation, among others are attaining better accuracy and efficiency numbers every year. However, these data-driven black-box solutions are rarely held accountable for the impact of their actions on the human in the loop which significantly impacts their real-world adoption. To truly conceptualize the idea of smart systems for everyone, it is critical to study AI-enabled smart environments and energy systems to enforce energy equity and ensure not just clean and resilient energy systems, but also make them affordable and accessible for all. The second ACM SIGEnergy workshop on Fair, Accountable, Transparent, and Ethical AI for Smart Environments and Energy Systems intends to bring together researchers from diverse backgrounds and discuss key issues, challenges, breakthroughs, and socio-economic impact in developing fair, accountable, transparent and ethical AI techniques for smart environments and energy systems.\r The aim of this workshop is to create a platform for the SenSys/BuildSys community to discuss developing AI-enabled smart environments and energy systems that are not just accurate but also take responsibility for their actions. We invite submissions including, but not limited to:\r - Studies exploring type of biases in energy-related data and their implications\r- Challenges in collecting representative data for fair training of the AI models\r- Studies on eXplainable AI (XAI) for smart environments and energy systems\r- Interpretable and explainable ML/AI models\r- Physics-informed ML for model interpretation\r- Innovative ML/AI models and their key limitations pertaining to FATE\r- Socio-economic impact analysis for energy equity\r- Fair metrics for the evaluation of ML/AI methods\r- Exploring visual analytics for bias evaluation in data and models\r\n'","b'<div align=""left"" class=""cfp"">\n<table align=""center"" cellpadding=""0"" cellspacing=""0px"" width=""100%"">\n<tr valign=""top"">\n<td>\n<table align=""center"" cellpadding=""4"" cellspacing=""3"" width=""100%"">\n<tr><td>\n<a href=""/cfp/servlet/event.showcfp?eventid=138697"">AISTATS 2022</a>\xc2\xa0\xc2\xa0\n25th International Conference on Artificial Intelligence and Statistics\n</td></tr>\n<tr><td>\n<a href=""/cfp/servlet/event.showcfp?eventid=166668"">PLDI 2023</a>\xc2\xa0\xc2\xa0\nThe 44th ACM SIGPLAN Conference on Programming Language Design and Implementation\n</td></tr>\n<tr><td>\n<a href=""/cfp/servlet/event.showcfp?eventid=158633"">ACM--ICAIP 2022</a>\xc2\xa0\xc2\xa0\nACM--2022 6th International Conference on Advances in Image Processing (ICAIP 2022)\n</td></tr>\n<tr><td>\n<a href=""/cfp/servlet/event.showcfp?eventid=161136"">XKDD 2022</a>\xc2\xa0\xc2\xa0\n4th International Workshop on eXplainable Knowledge Discovery in Data Mining\n</td></tr>\n<tr><td>\n<a href=""/cfp/servlet/event.showcfp?eventid=166667"">ESEC/FSE 2023</a>\xc2\xa0\xc2\xa0\nThe ACM Joint European Software Engineering Conference and Symposium on the Foundations of Software Engineering\n</td></tr>\n<tr><td>\n<a href=""/cfp/servlet/event.showcfp?eventid=135873"">ACM-AMLSP 2022</a>\xc2\xa0\xc2\xa0\n2022 4th International Conference on Algorithms, Machine Learning and Signal Processing (AMLSP 2022)\n</td></tr>\n<tr><td>\n<a href=""/cfp/servlet/event.showcfp?eventid=166563"">ACM ICHMI 2023</a>\xc2\xa0\xc2\xa0\nACM--2023 3rd International Conference on Human\xe2\x80\x93Machine Interaction (ICHMI 2023)\n</td></tr>\n<tr><td>\n<a href=""/cfp/servlet/event.showcfp?eventid=166671"">SIGMETRICS 2023</a>\xc2\xa0\xc2\xa0\nThe 2023 ACM SIGMETRICS (Winter Deadline)\n</td></tr>\n<tr><td>\n<a href=""/cfp/servlet/event.showcfp?eventid=165909"">ACM ICIIT 2023</a>\xc2\xa0\xc2\xa0\nACM--2023 8th International Conference on Intelligent Information Technology (ICIIT 2023)\n</td></tr>\n<tr><td>\n<a href=""/cfp/servlet/event.showcfp?eventid=166564"">ICHMI 2023</a>\xc2\xa0\xc2\xa0\nACM--2023 3rd International Conference on Human\xe2\x80\x93Machine Interaction (ICHMI 2023)\n</td></tr>\n</table>\n</td>\n</tr>\n</table>\n</div>'"
b'http://www.wikicfp.com/cfp/servlet/event.showcfp?eventid=164409',b'ICESH  2022',"b'Online International Conference on Education, Social Sciences and Humanities (ICESH 2022)'",b'http://apnconference.rf.gd/icehs-05sep-22/',b'2022-09-05T00:00:00',b'2022-09-05T23:59:59',"b'Colombo, Sri Lanka'","b'Aug 1, 2022'",,,b'education' b'social sciences' b'humanities' ,"b'\nICESH Conference invites scholars, researchers, practitioners, and students proposals to submit papers for paper presentations, interactive sessions, virtual talks, or colloquia addressing one of the following tracks & topics.\r Researchers, scholars, industry practitioners, and students are invited to submit their well-thought research papers for presentations and publication on any of the following tracks, but not limited to;\r Conference tracks & Topics:\r Education: Theory of Education | Assertive and Assistive Educational Technology | Comparative Education | Counseling | Cultural Literacy | Curriculum Studies | Distance Education | Early Education | Educational Change | Educational Policy | Planning and Practice | Educational Psychology | Education and Public Policy | Educational Research and Statistics | E-learning, Health Education | Tertiary Education | Innovative Education | Information & Library Science | International Exchange Programs | Language Education | Liberal Education | Mathematics Education | Medical Education | Physical Education | Science Education | Secondary Education | Special Education and Technology Education\r Social Science & Humanities: Refugees | Globalization | American Studies | African Studies | Asian Studies | European Studies | Middle Eastern Studies | Public Administration | Public Economics & Finance | Public Relations | Public Responsibility & Ethics | Regional Studies | Development Planning & Policy | Educational Management Planning | Philosophy | History | Politics | Taxation | Religion | Law | Sociology | Geography | Anthropology | Psychology | Demography | Social Work | Education | Youth Studies | Gender & Woman Studies | Culture | Language Studies | Literature | Migration | Terrorism | Urbanization | Colonialism & Post-Colonialism | Citizenship & Nationalism | E-society | Social & Civil Services | Racism & Ethnicism | Pension & Social Security | International Relations | Creative Arts | Adult Education | Democracy | Armed Forces | Peace & Conflict | Human Rights | Dramatic Arts | Special Education | Ceramics | Jewellery Design | Graphics | Crime | Tile Art | Painting Arts | Handcrafts | Media & Communications | Public Policy | Distance Education | Humanitarian Affairs | Budgeting & Finance | Power & Identity.\n\t'","b'<div align=""left"" class=""cfp"">\n<table align=""center"" cellpadding=""0"" cellspacing=""0px"" width=""100%"">\n<tr valign=""top"">\n<td>\n<table align=""center"" cellpadding=""4"" cellspacing=""3"" width=""100%"">\n<tr><td>\n<a href=""/cfp/servlet/event.showcfp?eventid=155149"">IJHAS 2022</a>\xc2\xa0\xc2\xa0\nInternational Journal of Humanities, Art and Social Studies\n</td></tr>\n<tr><td>\n<a href=""/cfp/servlet/event.showcfp?eventid=159497"">PSPC 2023</a>\xc2\xa0\xc2\xa0\n13th Poverty and Social Protection Conference\n</td></tr>\n<tr><td>\n<a href=""/cfp/servlet/event.showcfp?eventid=156692"">EJHSS 2022</a>\xc2\xa0\xc2\xa0\nEuropean Journal of Humanities and Social Sciences 5-2022\n</td></tr>\n<tr><td>\n<a href=""/cfp/servlet/event.showcfp?eventid=149593"">MDPI-SI on DT &amp; FIE in Ed--Scopus,JCI 2023</a>\xc2\xa0\xc2\xa0\nMDPI Education Sciences Journal - Special Issue on Digital Twins and Future Intelligent Educational Environments\n</td></tr>\n<tr><td>\n<a href=""/cfp/servlet/event.showcfp?eventid=153043"">EDUPT 2022</a>\xc2\xa0\xc2\xa0\nInternational Conference on Education, Pedagogy and Technology\n</td></tr>\n<tr><td>\n<a href=""/cfp/servlet/event.showcfp?eventid=156924"">Critical Plant Studies Book Series 2022</a>\xc2\xa0\xc2\xa0\nCritical Plant Studies Book Series\n</td></tr>\n<tr><td>\n<a href=""/cfp/servlet/event.showcfp?eventid=143187"">HEC 2022</a>\xc2\xa0\xc2\xa0\nThe Inaugural Honolulu Education Conference\n</td></tr>\n<tr><td>\n<a href=""/cfp/servlet/event.showcfp?eventid=154147"">CGDEIJ 2022</a>\xc2\xa0\xc2\xa0\nComputer Game Development and Education: An International Journal\n</td></tr>\n<tr><td>\n<a href=""/cfp/servlet/event.showcfp?eventid=159706"">ICHW 2023</a>\xc2\xa0\xc2\xa0\n1st International Conference on Happiness and Well-being\n</td></tr>\n<tr><td>\n<a href=""/cfp/servlet/event.showcfp?eventid=159707"">ICHW 2023</a>\xc2\xa0\xc2\xa0\n1st International Conference on Happiness and Well-being\n</td></tr>\n</table>\n</td>\n</tr>\n</table>\n</div>'"
b'http://www.wikicfp.com/cfp/servlet/event.showcfp?eventid=164410',b'ICEES  2022',b'Education and Education of Social Sciences International Conference Muscat (ICEES 2022)',b'http://iferd.epizy.com/icees-sep-6-2022/',b'2022-09-06T00:00:00',b'2022-09-06T23:59:59',"b'Muscat, Oman'","b'Aug 2, 2022'",,,b'education' b'social sciences' ,"b'\nInternational Academic Conference promote international dissemination of knowledge and development of cross-national academic fraternity. The participants come from different backgrounds and countries. They share their researches, experiences and informally create long-lasting bonds.\rThe organizing committee invites Postgraduate candidates Master and PhD to submit Abstract/Full papers to ICEES 2022. ICEES 2022 is a premier forum for presenting of new research findings. This conference brings together avid researchers from local and foreign universities. Topics of interest for submission include, but not limited to:\rDiscover The Topics:\rEducation: Theory of Education | Assertive and Assistive Educational Technology | Comparative Education | Counseling | Cultural Literacy | Curriculum Studies | Distance Education | Early Education | Educational Change | Educational Policy | Planning and Practice | Educational Psychology | Education and Public Policy | Educational Research and Statistics | E-learning, Health Education | Tertiary Education | Innovative Education | Information & Library Science | International Exchange Programs | Language Education | Liberal Education | Mathematics Education | Medical Education | Physical Education | Science Education | Secondary Education | Special Education and Technology Education.\rSocial Sciences: Refugees | Globalization | American Studies | African Studies | Asian Studies | European Studies | Middle Eastern Studies | Public Administration | Public Economics & Finance | Public Relations | Public Responsibility & Ethics | Regional Studies | Development Planning & Policy | Educational Management Planning | Philosophy | History | Politics | Taxation | Religion | Law | Sociology | Geography | Anthropology | Psychology | Demography | Social Work | Education | Youth Studies | Gender & Woman Studies | Culture | Language Studies | Literature | Migration | Terrorism | Urbanization | Colonialism & Post-Colonialism | Citizenship & Nationalism | E-society | Social & Civil Services | Racism & Ethnicism | Pension & Social Security | International Relations | Creative Arts | Adult Education | Democracy | Armed Forces | Peace & Conflict | Human Rights | Dramatic Arts | Special Education | Ceramics | Jewellery Design | Graphics | Crime | Tile Art | Painting Arts | Handcrafts | Media & Communications | Public Policy | Distance Education | Humanitarian Affairs | Budgeting & Finance | Power & Identity.\n\t'","b'<div align=""left"" class=""cfp"">\n<table align=""center"" cellpadding=""0"" cellspacing=""0px"" width=""100%"">\n<tr valign=""top"">\n<td>\n<table align=""center"" cellpadding=""4"" cellspacing=""3"" width=""100%"">\n<tr><td>\n<a href=""/cfp/servlet/event.showcfp?eventid=149593"">MDPI-SI on DT &amp; FIE in Ed--Scopus,JCI 2023</a>\xc2\xa0\xc2\xa0\nMDPI Education Sciences Journal - Special Issue on Digital Twins and Future Intelligent Educational Environments\n</td></tr>\n<tr><td>\n<a href=""/cfp/servlet/event.showcfp?eventid=155149"">IJHAS 2022</a>\xc2\xa0\xc2\xa0\nInternational Journal of Humanities, Art and Social Studies\n</td></tr>\n<tr><td>\n<a href=""/cfp/servlet/event.showcfp?eventid=167076"">ACP 2023</a>\xc2\xa0\xc2\xa0\nThe 13th Asian Conference on Psychology &amp; the Behavioral Sciences (ACP2023)\n</td></tr>\n<tr><td>\n<a href=""/cfp/servlet/event.showcfp?eventid=153043"">EDUPT 2022</a>\xc2\xa0\xc2\xa0\nInternational Conference on Education, Pedagogy and Technology\n</td></tr>\n<tr><td>\n<a href=""/cfp/servlet/event.showcfp?eventid=163560"">ICAIE 2023</a>\xc2\xa0\xc2\xa0\n2023 3rd International Conference on Artificial Intelligence in Education (ICAIE 2023)\n</td></tr>\n<tr><td>\n<a href=""/cfp/servlet/event.showcfp?eventid=154147"">CGDEIJ 2022</a>\xc2\xa0\xc2\xa0\nComputer Game Development and Education: An International Journal\n</td></tr>\n<tr><td>\n<a href=""/cfp/servlet/event.showcfp?eventid=167439"">ITET 2023</a>\xc2\xa0\xc2\xa0\n2023 4th International Conference on Information Technology and Education Technology (ITET 2023)\n</td></tr>\n<tr><td>\n<a href=""/cfp/servlet/event.showcfp?eventid=167737"">ICIEI 2023</a>\xc2\xa0\xc2\xa0\n2023 The 8th International Conference on Information and Education Innovations (ICIEI 2023)\n</td></tr>\n<tr><td>\n<a href=""/cfp/servlet/event.showcfp?eventid=165696"">ICIET--EI 2023</a>\xc2\xa0\xc2\xa0\n2023 11th International Conference on Information and Education Technology (ICIET 2023)\n</td></tr>\n<tr><td>\n<a href=""/cfp/servlet/event.showcfp?eventid=145683"">IJSC 2022</a>\xc2\xa0\xc2\xa0\nInternational Journal on Soft Computing\n</td></tr>\n</table>\n</td>\n</tr>\n</table>\n</div>'"
b'http://www.wikicfp.com/cfp/servlet/event.showcfp?eventid=164411',b'ICTEL 2022',"b'Teaching, Education & Learning 2022 International Conference (ICTEL)'",b'http://rppf.42web.io/ictel-7-9-22/',b'2022-09-07T00:00:00',b'2022-09-07T23:59:59',"b'Hanoi, Vietnam'","b'Aug 3, 2022'",,,b'education' b'teaching' b'learning' ,"b'\nRPPF aims to provide an opportunity to academics and practitioners around the world to discuss and share the contemporary issues of business and social science research.\rIf you are unable to attend the conference, you may still join the community and submit your article for peer review and possible publication, upload an online presentation, and enjoy subscriber access to the journal.\rThe conference welcomes empirical research as well as theoretical/conceptual research papers having potential for field applications and in-depth literature reviews. Broadly defined, but not limited to, tracks of the conference are:\rEducation Theory and Practice\rCounselor Education\rEducational Foundations\rEducation Practice trends and Issues\rTheory and Practice of Physical Education Development\rTeaching Materials and Courseware Construction\rEducation and Research Management\rEducational Measurement and Evaluation\rTeaching method Promote\rPedagogy\rCurriculum, Research, and Development\rChild and Family Education\rEarly Childhood Education\rTeaching Talent Training\rSpecial Education\rHome Education\rElementary Education\rPrimary Education\rSecondary Education\rComparison of Child Education in Different Countries\rEducation Policy\rEducational Administration\rEducation Policy and Leadership\rRural Education\rStudent Affairs\rLifelong Education\rEducation, Research and Globalization\rTeacher Education\rEducation and Management\rContinuous Education\rHigher Education\rPublic Education Policy\rComparison of Sports Education in Different Cultures\rSports for health education\rAdult and Continuing Education\rLearning\rLifelong Learning\rE-learning\rTeaching and Learning\rLearning Difficulties\rLearning Psychology\rInductive reasoning\rMachine Learning\rLanguage Acquisition\rOthers\rScience Education\rSocial Studies Education\rBusiness Education\rMusic Education\rArt Education\rAdult Education\rESL/TESL\rHealth Education\rLanguage Education, ELT/ FLT\rMathematics Education\rHealth Education\rHuman Resource Development\rMedium Education\rAssessment and Evaluation\n\t'","b'<div align=""left"" class=""cfp"">\n<table align=""center"" cellpadding=""0"" cellspacing=""0px"" width=""100%"">\n<tr valign=""top"">\n<td>\n<table align=""center"" cellpadding=""4"" cellspacing=""3"" width=""100%"">\n<tr><td>\n<a href=""/cfp/servlet/event.showcfp?eventid=167704"">ICLT 2023</a>\xc2\xa0\xc2\xa0\n2023 9th International Conference on Learning and Teaching (ICLT 2023)\n</td></tr>\n<tr><td>\n<a href=""/cfp/servlet/event.showcfp?eventid=145683"">IJSC 2022</a>\xc2\xa0\xc2\xa0\nInternational Journal on Soft Computing\n</td></tr>\n<tr><td>\n<a href=""/cfp/servlet/event.showcfp?eventid=167075"">ACEID 2023</a>\xc2\xa0\xc2\xa0\nThe 9th Asian Conference on Education &amp; International Development (ACEID2023)\n</td></tr>\n<tr><td>\n<a href=""/cfp/servlet/event.showcfp?eventid=153330"">IJITCA 2022</a>\xc2\xa0\xc2\xa0\nInternational Journal of Information Technology, Control and Automation\n</td></tr>\n<tr><td>\n<a href=""/cfp/servlet/event.showcfp?eventid=167702"">ICETT 2023</a>\xc2\xa0\xc2\xa0\n2023 9th International Conference on Education and Training Technologies (ICETT 2023)\n</td></tr>\n<tr><td>\n<a href=""/cfp/servlet/event.showcfp?eventid=149593"">MDPI-SI on DT &amp; FIE in Ed--Scopus,JCI 2023</a>\xc2\xa0\xc2\xa0\nMDPI Education Sciences Journal - Special Issue on Digital Twins and Future Intelligent Educational Environments\n</td></tr>\n<tr><td>\n<a href=""/cfp/servlet/event.showcfp?eventid=156902"">AITIJ 2022</a>\xc2\xa0\xc2\xa0\nAdvances in Interconnect Technologies: An International Journal\n</td></tr>\n<tr><td>\n<a href=""/cfp/servlet/event.showcfp?eventid=137130"">MLDM 2023</a>\xc2\xa0\xc2\xa0\n18th International Conference on Machine Learning and Data Mining\n</td></tr>\n<tr><td>\n<a href=""/cfp/servlet/event.showcfp?eventid=161197"">ACM ICEEL 2022</a>\xc2\xa0\xc2\xa0\nACM--2022 6th International Conference on Education and E-Learning (ICEEL 2022)\n</td></tr>\n<tr><td>\n<a href=""/cfp/servlet/event.showcfp?eventid=155149"">IJHAS 2022</a>\xc2\xa0\xc2\xa0\nInternational Journal of Humanities, Art and Social Studies\n</td></tr>\n</table>\n</td>\n</tr>\n</table>\n</div>'"
b'http://www.wikicfp.com/cfp/servlet/event.showcfp?eventid=164412',b'IEFBC 2022',"b'International Economics, Finance & Business Conference in Phuket 2022'",b'http://enar-conf.rf.gd/iefbc-8-sep-2022/',b'2022-09-08T00:00:00',b'2022-09-08T23:59:59',"b'Phuket, Thailand'","b'Aug 4, 2022'",,,b'business' b'finance' b'economics' ,"b'\nCall for papers/Topics\r Eurasian Network for Academic Research (ENAR) invites scholars, researchers, practitioners, and student proposals to submit papers for paper presentations, interactive sessions, virtual talks, or colloquia addressing one of the following tracks & topics. \r If you are unable to attend the conference, you may still join the community and submit your article for peer review and possible publication, upload an online presentation, and enjoy subscriber access to the journal.\r The topic includes but not limited to:\r Economy, Finance, and Business | Accounting | Behavioral Finance | Consumer Behavior | Corporate Finance | Corporate Governance | Derivatives and Financial Engineering | Economics | Financial and Banking | Financial Econometrics | Financial Marketing and Financial | Game Theory | Human Resource Management | Industrial Economics | International Business | International Financial Management | International Trade: Theory and Policy | Labor Economics | Marketing | Mathematical Statistics | Neuroeconomics | Portfolio Theory and Management | Public Economics | Risk Management | Supply Chain Management.\n\t'","b'<div align=""left"" class=""cfp"">\n<table align=""center"" cellpadding=""0"" cellspacing=""0px"" width=""100%"">\n<tr valign=""top"">\n<td>\n<table align=""center"" cellpadding=""4"" cellspacing=""3"" width=""100%"">\n<tr><td>\n<a href=""/cfp/servlet/event.showcfp?eventid=58503"">ICEFS 2022</a>\xc2\xa0\xc2\xa0\n\xe3\x80\x90WOS\xe3\x80\x91\xe3\x80\x90Scopus\xe3\x80\x912022 10th International Conference on Economics, Finance and Statistics\n</td></tr>\n<tr><td>\n<a href=""/cfp/servlet/event.showcfp?eventid=165461"">ICEFR 2023</a>\xc2\xa0\xc2\xa0\n2023 12th International Conference on Economics and Finance Research (ICEFR 2023)\n</td></tr>\n<tr><td>\n<a href=""/cfp/servlet/event.showcfp?eventid=153925"">ICAAF 2022</a>\xc2\xa0\xc2\xa0\n2022 2nd International Conference on Accounting, Auditing and Finance (ICAAF 2022)\n</td></tr>\n<tr><td>\n<a href=""/cfp/servlet/event.showcfp?eventid=155149"">IJHAS 2022</a>\xc2\xa0\xc2\xa0\nInternational Journal of Humanities, Art and Social Studies\n</td></tr>\n<tr><td>\n<a href=""/cfp/servlet/event.showcfp?eventid=167101"">FEMIB 2023</a>\xc2\xa0\xc2\xa0\n5th International Conference on Finance, Economics, Management and IT Business\n</td></tr>\n<tr><td>\n<a href=""/cfp/servlet/event.showcfp?eventid=158771"">EPEAI 2023</a>\xc2\xa0\xc2\xa0\nAI in Business and Economics - The Economic Perspective on Artificial Intelligence\n</td></tr>\n<tr><td>\n<a href=""/cfp/servlet/event.showcfp?eventid=155763"">ICBIF 2022</a>\xc2\xa0\xc2\xa0\n2022 International Conference on Business, Information and Finance \n</td></tr>\n<tr><td>\n<a href=""/cfp/servlet/event.showcfp?eventid=153926"">ICBMG 2022</a>\xc2\xa0\xc2\xa0\n2022 The 10th International Conference on Business, Management and Governance (ICBMG 2022)\n</td></tr>\n<tr><td>\n<a href=""/cfp/servlet/event.showcfp?eventid=165782"">ICMBE 2022</a>\xc2\xa0\xc2\xa0\n11th International Conference on Management, Business and Economics - HIBRID\n</td></tr>\n<tr><td>\n<a href=""/cfp/servlet/event.showcfp?eventid=95801"">ICAS 2022</a>\xc2\xa0\xc2\xa0\n10th International Conference on Asian Studies 2022\n</td></tr>\n</table>\n</td>\n</tr>\n</table>\n</div>'"
